id,artist,title,lyrics,annotation_count,api_path,full_title,header_image_thumbnail_url,header_image_url,lyrics_owner_id,lyrics_state,path,pyongs_count,song_art_image_thumbnail_url,song_art_image_url,title_with_featured,url,album_api_path,album_cover_art_url,album_full_title,album_id,album_name,album_release_date_for_display,album_url
3547331,Howie Day,Anyone,"1 ContributorAnyone LyricsSay you never wanted change
You've fallen into place
I don't want to see you when you go
'Cause I want a little peace of mind

But I'd believe in anyone
Service got to make a show
But I'd believe in anyone

I see you there but you're out of reach
Treading water and half asleep on cue
I don't want to see what you will do
Days are turning into plays
We're playing back in space
I don't want to see you when you know

But I'd believe in anyone
The service got to make a show
But I'd believe in anyone
I believe we'll never know

I was never one to find
Summers that were in July
In the winter we can make it right
I see you there, but you're out of reach
Treading water and half asleep
So you say you never want to change
'Cause I want a little peace of mind
See Howie Day LiveGet tickets as low as $64You might also likeAnd I'll believe in anyone
Service got to make a show
And I'll believe in anyone
I believe we'll never knowEmbed",0,/songs/3547331,Anyone by Howie Day,https://images.genius.com/6ad46623c762061b50bdcfc86ec00748.300x300x1.jpg,https://images.genius.com/6ad46623c762061b50bdcfc86ec00748.1000x1000x1.jpg,6002448,complete,/Howie-day-anyone-lyrics,,https://images.genius.com/6ad46623c762061b50bdcfc86ec00748.300x300x1.jpg,https://images.genius.com/6ad46623c762061b50bdcfc86ec00748.1000x1000x1.jpg,Anyone,https://genius.com/Howie-day-anyone-lyrics,/albums/405796,https://images.genius.com/6ad46623c762061b50bdcfc86ec00748.1000x1000x1.jpg,Lanterns by Howie Day,405796.0,Lanterns,"April 16, 2015",https://genius.com/albums/Howie-day/Lanterns
3547323,Howie Day,Medicine Ball,"1 ContributorMedicine Ball LyricsCome on I'm reeling here on a rock
Counting the places where hearts go
Maybe our ancestors try to mock us
No, I'm just playing a life that'll change

I just can't fight the desire to love
I just can't lie to a child that's within
Lovers lips are no kind of friend
And everyone dreams that the pragmatic call

Hit in the stomach a medicine ball
Wipe off the dirt and pull back your hair
Head in the clouds meet the state that I'm in
Need a shelter never and end
Yeah, yeah

I'm seeing the world for the way that I am
And I need a center always an end

I'm only feeling my way through the dark
Counting the places I'll never go
So lucky with you that I want to try
So lucky with you that I want to trySee Howie Day LiveGet tickets as low as $64You might also likeEmbed",0,/songs/3547323,Medicine Ball by Howie Day,https://images.genius.com/6ad46623c762061b50bdcfc86ec00748.300x300x1.jpg,https://images.genius.com/6ad46623c762061b50bdcfc86ec00748.1000x1000x1.jpg,6002448,complete,/Howie-day-medicine-ball-lyrics,,https://images.genius.com/6ad46623c762061b50bdcfc86ec00748.300x300x1.jpg,https://images.genius.com/6ad46623c762061b50bdcfc86ec00748.1000x1000x1.jpg,Medicine Ball,https://genius.com/Howie-day-medicine-ball-lyrics,/albums/405796,https://images.genius.com/6ad46623c762061b50bdcfc86ec00748.1000x1000x1.jpg,Lanterns by Howie Day,405796.0,Lanterns,"April 16, 2015",https://genius.com/albums/Howie-day/Lanterns
1406208,Howie Day,So Stung,"2 ContributorsSo Stung LyricsWell overcome, this impression
In the life that you lead, second guessing
On me
So youve come from things youve left behind
You left me here with all this on my mind
Ill be fine
Now I, I feel so stung
Now I, I feel so stung
By you

(He reverses order in different shows: Cause all you wanna be is protected, and all I wanna feel is affected)
All I wanna feel is affected
And all you wanna be is protected
But when you realize were at your door
The wind can push (the) your sails and drive you home
This I know
And well I feel so stung
And now I feel so stung (feel left out)
By you
(Well I can see it coming down, feel it, be it, conceal it, well I can see it from this love, another day on the road)
Well I can see ya (?)
(when you realize youre on the shore, the wind can push the sails and drive you home, this I know
But I feel so stung, and you got the best, you got the best, and I feel so stung, by you, by you)
And now I, feel so stung
And now I, I feel so stung
By youSee Howie Day LiveGet tickets as low as $64You might also likeEmbed",1,/songs/1406208,So Stung by Howie Day,https://images.genius.com/3f1d3d17f58cbed963c6d083e3fd794b.300x300x1.jpg,https://images.genius.com/3f1d3d17f58cbed963c6d083e3fd794b.1000x1000x1.jpg,1549345,complete,/Howie-day-so-stung-lyrics,,https://images.genius.com/3f1d3d17f58cbed963c6d083e3fd794b.300x300x1.jpg,https://images.genius.com/3f1d3d17f58cbed963c6d083e3fd794b.1000x1000x1.jpg,So Stung,https://genius.com/Howie-day-so-stung-lyrics,/albums/155621,https://images.genius.com/3f1d3d17f58cbed963c6d083e3fd794b.1000x1000x1.jpg,Sound the Alarm by Howie Day,155621.0,Sound the Alarm,2009,https://genius.com/albums/Howie-day/Sound-the-alarm
3547235,Howie Day,Make Peace,"1 ContributorMake Peace LyricsYou come out the hard way
You come out the hard way, don't you?
Is there nothing left to say
When it's 4am and the morning's calling?

For once in your life
You were born, you will die
Make peace
Make peace

I see you woman alone in a canyon
I hear a woman cry tears from her eyes
But is it raining in West Memphis?
Is it raining in West Memphis, tell me?

For once in your life
You were born, you will die
For once in your life
Make peace

Say goodbye to what you thought it was wrong
Say hello to the wolves at your door
You are not alone, there's a crowd of us wandering
The same road you're walking and I lead and you follow

For once in your life
So for once in your life
Cause we were born starry eyed, you and I
Make peace
Make peace
Make peaceSee Howie Day LiveGet tickets as low as $64You might also likeEmbed",0,/songs/3547235,Make Peace by Howie Day,https://images.genius.com/6ad46623c762061b50bdcfc86ec00748.300x300x1.jpg,https://images.genius.com/6ad46623c762061b50bdcfc86ec00748.1000x1000x1.jpg,6002448,complete,/Howie-day-make-peace-lyrics,,https://images.genius.com/6ad46623c762061b50bdcfc86ec00748.300x300x1.jpg,https://images.genius.com/6ad46623c762061b50bdcfc86ec00748.1000x1000x1.jpg,Make Peace,https://genius.com/Howie-day-make-peace-lyrics,/albums/405796,https://images.genius.com/6ad46623c762061b50bdcfc86ec00748.1000x1000x1.jpg,Lanterns by Howie Day,405796.0,Lanterns,"April 16, 2015",https://genius.com/albums/Howie-day/Lanterns
1942721,Howie Day,Ceasefire,"1 ContributorCeasefire LyricsLike I told you before, they're just thoughts running through my head
Now the tables have turned, it's our memories instead

Maybe you're gone forever, some other time
You're somewhere across the great divide

Carried all the way to heaven
I know I've been wrong before
Carried all the way to heaven
Maybe there's a way to the heart of my desire for a ceasefire

All I wanted to say were the thoughts running through my head
Now the lesson is learned everything remains unsaid
Now that you're gone, yesterdays can leave me alone
Just a feeling of losing all control

You're carried all the way to heaven
You know I've been wrong before
Carried all the way to heaven
Maybe there's a way to the heart of my desire for a ceasefire

Maybe I'm ordinary, maybe I'm not
Somehow you have to carry on in your heart

Oh.. come on.. no .. come on..
See Howie Day LiveGet tickets as low as $64You might also likeYou're carried all the way to heaven
Maybe there's a way, I've been wrong before
Carried all the way to heaven
Maybe there's a way, I've been waiting for you
Carried all the way carried all the way ..
You're then carried all the way carried all the way .. to a ceasefireEmbed",1,/songs/1942721,Ceasefire by Howie Day,https://images.genius.com/d0e07b1357aed50945ea88932e36971b.300x300x1.jpg,https://images.genius.com/d0e07b1357aed50945ea88932e36971b.400x400x1.jpg,1549345,complete,/Howie-day-ceasefire-lyrics,,https://images.genius.com/d0e07b1357aed50945ea88932e36971b.300x300x1.jpg,https://images.genius.com/d0e07b1357aed50945ea88932e36971b.400x400x1.jpg,Ceasefire,https://genius.com/Howie-day-ceasefire-lyrics,,,,,,,
1852956,Howie Day,Oxygen,"1 ContributorOxygen LyricsCan you tell me how we get there from here?
High in the canyon we can both disappear
Got a change of reason, yeah this much is clear
Can you help me get back, back to the place
Where I was when we got carried away?
Gotta leave this feeling and all I can say
You’re like oxygen; you’re like a midday sun
You’re like a miracle drug in the morning love
That keeps me moving on
You’re like a summer rain, something I just can’t explain
Could it be ---- Or is it really that difficult to say?
Do you remember falling heels over head?
Spent the afternoons just lying in bed
Got a --- and the promise you said
You’re like oxygen; you’re like a midday sun
You’re like a miracle drug in the morning love
That keeps me moving on
You’re like a summer rain, something I just can’t explain
Could it be ---- Or is it really that difficult to say?
And when I start to reel you take the steering wheel
You give me something that I never knew I was missing
You give me something real
You’re like oxygen, you’re like a midday sun
You’re like a miracle drug in the morning love
That keeps me moving on
You’re like a summer rain, something I just can’t explain
Could it be ---- Or is it really that difficult to say?
Can you tell me how we get there from here?See Howie Day LiveGet tickets as low as $64You might also likeEmbed",1,/songs/1852956,Oxygen by Howie Day,https://images.genius.com/d0e07b1357aed50945ea88932e36971b.300x300x1.jpg,https://images.genius.com/d0e07b1357aed50945ea88932e36971b.400x400x1.jpg,1549345,complete,/Howie-day-oxygen-lyrics,,https://images.genius.com/d0e07b1357aed50945ea88932e36971b.300x300x1.jpg,https://images.genius.com/d0e07b1357aed50945ea88932e36971b.400x400x1.jpg,Oxygen,https://genius.com/Howie-day-oxygen-lyrics,,,,,,,
1981885,Howie Day,Damaged,"1 ContributorDamaged LyricsTake a picture of yourself
A world where no one else
Imagines you were there
And you start to know
How it feels loving you
Nothing's real

Won't you take me? Won't you wake me to the lie?
I feel a little damaged
Change me, won't you make me alright?
And I'll feel a little damaged tonight

I'm sinking like a stone
I thought you'd like to know
I was deeper than a well
Then you came along
I fell so hard for you
I just lost my guard

Won't you take me? Won't you wake me to the lie?
I feel a little damaged
Change me, won't you make me alright?
And I'll feel a little damaged tonight

You can take away the pain
Can take away the love
You gave me everything I can't give up
So, leave me with this night, yeah...
See Howie Day LiveGet tickets as low as $64You might also likeTake me, won't you wake me to the lie?
Won't you take me? Won't you wake me to the lie?
I feel a little damaged
Change me, won't you make me alright?
And I'll feel a little damaged (tonight)

Won't you take me? Won't you wake me to the lie?
I feel a little damaged
Change me, won't you make me alright?
And I'll feel a little damaged

Nah hoo...Embed",1,/songs/1981885,Damaged by Howie Day,https://images.genius.com/d0e07b1357aed50945ea88932e36971b.300x300x1.jpg,https://images.genius.com/d0e07b1357aed50945ea88932e36971b.400x400x1.jpg,1549345,complete,/Howie-day-damaged-lyrics,,https://images.genius.com/d0e07b1357aed50945ea88932e36971b.300x300x1.jpg,https://images.genius.com/d0e07b1357aed50945ea88932e36971b.400x400x1.jpg,Damaged,https://genius.com/Howie-day-damaged-lyrics,,,,,,,
3547328,Howie Day,Worry,"1 ContributorWorry LyricsYou hid the note
Then I found it
In a book
Read and weathered

I didn't know
If I caught you
In a lie
Worry never knows
Worry never knows

You found a scarf
In the closet
In the dust
Amid your favorites

I didn't know
If you'd caught me
In a lie
Worry never knows
Worry never knows

I saw you in a place I lost
Hurry, before the fire stops
Our love was against the wall
Worry never knows
See Howie Day LiveGet tickets as low as $64You might also likeYou hid the note
Then I found it
In a book
Read and weathered

I didn't know
If I caught you
In a lie

I saw you in a place I lost
So hurry, before the fire stops
Our love was against the wall
Worry never knows
Worry never knows
Worry never...
Worry never...
Worry never...
Worry never knows
Worry never...Embed",0,/songs/3547328,Worry by Howie Day,https://images.genius.com/6ad46623c762061b50bdcfc86ec00748.300x300x1.jpg,https://images.genius.com/6ad46623c762061b50bdcfc86ec00748.1000x1000x1.jpg,6002448,complete,/Howie-day-worry-lyrics,,https://images.genius.com/6ad46623c762061b50bdcfc86ec00748.300x300x1.jpg,https://images.genius.com/6ad46623c762061b50bdcfc86ec00748.1000x1000x1.jpg,Worry,https://genius.com/Howie-day-worry-lyrics,/albums/405796,https://images.genius.com/6ad46623c762061b50bdcfc86ec00748.1000x1000x1.jpg,Lanterns by Howie Day,405796.0,Lanterns,"April 16, 2015",https://genius.com/albums/Howie-day/Lanterns
1944712,Howie Day,Collide - live in las vegas,"1 ContributorCollide - live in las vegas LyricsThe dawn is breaking
A light shining through
You're barely waking
And I'm tangled up in you, yeah
I'm open, you're closed
Where I follow, you'll go
I worry I won't see your face
Light up again
Even the best fall down sometimes
And even the wrong words seem to rhyme
Out of the doubt that fills your mind
I somehow find you and I collide
Do do do do do x4
I'm quiet you know
You make a first impression
I've found I'm scared to know
I'm always on your mind
Well, even the best fall down sometimes
Even the stars refuse to shine
Out of the back you fall in time
I somehow find you and I collide
Don't stop here
I lost my place
I'm close behind
Do do do do do x4
Even the best fall down sometimes
Even the wrong words seem to rhyme
Out of the doubt that fills your mind
You finally find you and I collide
Do do do do do x2
You finally find you and I collide
Do do do do do x2
You finally find you and I collideSee Howie Day LiveGet tickets as low as $64You might also likeEmbed",1,/songs/1944712,Collide - live in las vegas by Howie Day,https://images.genius.com/d0e07b1357aed50945ea88932e36971b.300x300x1.jpg,https://images.genius.com/d0e07b1357aed50945ea88932e36971b.400x400x1.jpg,1549345,complete,/Howie-day-collide-live-in-las-vegas-lyrics,,https://images.genius.com/d0e07b1357aed50945ea88932e36971b.300x300x1.jpg,https://images.genius.com/d0e07b1357aed50945ea88932e36971b.400x400x1.jpg,Collide - live in las vegas,https://genius.com/Howie-day-collide-live-in-las-vegas-lyrics,,,,,,,
1233220,Howie Day,Counting on Me,"2 ContributorsCounting on Me LyricsI see your face in the sun by a streetlight
By the colors that glow in my eyes
And I see them burning bright
And I know where I'm supposed to be

Counting on me, you're counting on me

You've got me tied by the wrist, by the shoulder
By the blood that runs under my skin
And I see my hands turn white
And I know that I won't get free

You're counting on me, you're counting on me
Counting on me, counting on me

I never knew that I could be this way before
Like I was living in your hallway
And you opened the door, opened the door

And I can feel a change will come in our love, love
And I can feel a change will come now
Tell me you find, tell me you find it here

You're counting on me, you're counting on me
Can you count on me? You're counting on me
See Howie Day LiveGet tickets as low as $64You might also likeAnd I know that I won't, yes, I know that I won't
Now I know that I won't get freeEmbed",1,/songs/1233220,Counting on Me by Howie Day,https://images.genius.com/3f1d3d17f58cbed963c6d083e3fd794b.300x300x1.jpg,https://images.genius.com/3f1d3d17f58cbed963c6d083e3fd794b.1000x1000x1.jpg,1549345,complete,/Howie-day-counting-on-me-lyrics,,https://images.genius.com/3f1d3d17f58cbed963c6d083e3fd794b.300x300x1.jpg,https://images.genius.com/3f1d3d17f58cbed963c6d083e3fd794b.1000x1000x1.jpg,Counting on Me,https://genius.com/Howie-day-counting-on-me-lyrics,/albums/155621,https://images.genius.com/3f1d3d17f58cbed963c6d083e3fd794b.1000x1000x1.jpg,Sound the Alarm by Howie Day,155621.0,Sound the Alarm,2009,https://genius.com/albums/Howie-day/Sound-the-alarm
1024187,Howie Day,Madrigals (Demo),"2 ContributorsMadrigals (Demo) LyricsI'm not so sure what i was dreaming
About but i'm sure it was better
Than this and i'll hope you suppose
That i'm alright (i'm thinking of hours
That...I...)

Told everyone, you know everything
Is real in here
And your madrigals and your silver rings
I still see a flash
From the time i opened my eyes too wide(...tonight)

I couldn't have asked you to stay
I'm already falling to pieces
From this and i'll hope you suppose
That i'm alright i'll stay here for hours
Waiting up for you

(i told everyone, you) know everything
Is real in here
And your madrigals and your silver rings
I still see a flash
From the time i opened my eyes too wide(...tonight)See Howie Day LiveGet tickets as low as $64You might also likeEmbed",1,/songs/1024187,Madrigals (Demo) by Howie Day,https://images.genius.com/83156b94d38044ef42a3611a69715186.300x300x1.jpg,https://images.genius.com/83156b94d38044ef42a3611a69715186.300x300x1.jpg,1549345,complete,/Howie-day-madrigals-demo-lyrics,,https://images.genius.com/83156b94d38044ef42a3611a69715186.300x300x1.jpg,https://images.genius.com/83156b94d38044ef42a3611a69715186.300x300x1.jpg,Madrigals (Demo),https://genius.com/Howie-day-madrigals-demo-lyrics,/albums/271958,https://images.genius.com/83156b94d38044ef42a3611a69715186.300x300x1.jpg,The Madrigals EP by Howie Day,271958.0,The Madrigals EP,2003,https://genius.com/albums/Howie-day/The-madrigals-ep
960120,Howie Day,The Drugs Don’t Work,"1 ContributorThe Drugs Don’t Work LyricsAll this talk of getting old
It's getting me down my lord
Like a cat in a bag waiting to drown
This time i'm coming 'round

And i hope you're thinking of me
As you lay down on your side

Now the drugs don't work they just make you worse
But i know i'll see your face again

Now the drugs don't work they just make you worse
But i know i'll see your face again

But i know i'm on a losing streak
As i pass down by your street
And if you want a show
Then just let me know
And i'll sing in your ear again

Now the drugs don't work they just make you worse
But i know i'll see your face again

Cause maybe
If heaven falls
I'm coming to
Just like you said
If you leave my life
I'm better off dead
See Howie Day LiveGet tickets as low as $64You might also likeAll this talk of getting old
It's getting me down my love
Like a cat in a bag waiting to drown
This time i'm coming 'round

Now the drugs don't work they just make you worse
But i know i'll see your face again

Cause maybe
If heaven falls
I'm coming to
Just like you said
If you leave my life
I'm better off dead

But if you want a show
Then just let me know
And i'll sing in your ear again

Now the drugs don't work they just make you worse
But i know i'll see your face again

I know i'll see your face again

Never coming down
No moreEmbed",1,/songs/960120,The Drugs Don't Work by Howie Day,https://images.genius.com/d0e07b1357aed50945ea88932e36971b.300x300x1.jpg,https://images.genius.com/d0e07b1357aed50945ea88932e36971b.400x400x1.jpg,1549345,complete,/Howie-day-the-drugs-dont-work-lyrics,,https://images.genius.com/d0e07b1357aed50945ea88932e36971b.300x300x1.jpg,https://images.genius.com/d0e07b1357aed50945ea88932e36971b.400x400x1.jpg,The Drugs Don't Work,https://genius.com/Howie-day-the-drugs-dont-work-lyrics,,,,,,,
1599620,Howie Day,Sorry So Sorry (live in NYC),"2 ContributorsSorry So Sorry (live in NYC) LyricsSpend your nights here
We'll always be up late
Keep eachother on
Chemicals can make us stay
I meant you're outta line
With your friends and all your jokes
Moving out tonight
Making phones that hard to hold
-
And you really didn't know
And you really didn't know
-
Spend your days here
And never give up now
You keep the children down
You're down for one more hour
Imagine i would feel
If your friends were all your dates
I'm moving out with her
Do your shake, you'll be ok
-
And if you really didn't know
I swear i really didn't know
So i'm sorry, so sorry
I'm sorry, oh no
And i'm sorry, so sorry
I'm sorry
-
Spend your nights here
We'll always be up late
Keep eachother up
Chemicals can make us stay
I meant you're outta line
With your friends and all your jokes
Moving out tonight
Making phones that hard to hold
-
And if you really didn't know
I swear i really didn't know
So i'm sorry, so sorry
I'm sorry, oh no
And i'm sorry, so sorry
I'm sorrySee Howie Day LiveGet tickets as low as $64You might also likeEmbed",1,/songs/1599620,Sorry So Sorry (live in NYC) by Howie Day,https://images.genius.com/83156b94d38044ef42a3611a69715186.300x300x1.jpg,https://images.genius.com/83156b94d38044ef42a3611a69715186.300x300x1.jpg,1549345,complete,/Howie-day-sorry-so-sorry-live-in-nyc-lyrics,,https://images.genius.com/83156b94d38044ef42a3611a69715186.300x300x1.jpg,https://images.genius.com/83156b94d38044ef42a3611a69715186.300x300x1.jpg,Sorry So Sorry (live in NYC),https://genius.com/Howie-day-sorry-so-sorry-live-in-nyc-lyrics,/albums/271958,https://images.genius.com/83156b94d38044ef42a3611a69715186.300x300x1.jpg,The Madrigals EP by Howie Day,271958.0,The Madrigals EP,2003,https://genius.com/albums/Howie-day/The-madrigals-ep
3547111,Howie Day,Ghost (Live from Boston),"1 ContributorGhost (Live from Boston) LyricsOh, now it's shining through
I was alone for the last time
Before my night's vacation with you
Alive from the first
Now I'm denied by the ghost of you

Make yourself a photograph and laugh with me
Please

I know there's little use in crying
It's more wide awake and dying then I'm used to
I thought we'd walk these streets together
And now I'm hoping that I'll never have to meet you
You step aside from all this anger
And somewhere in between I can feel you
Ask me should we try again
I'm thinking no
Not what I believe in

It's not what I believe in
Won't you make yourself a photograph and laugh with me
Please
You make yourself a photograph and laugh with me
Please
No I, want to taste your love
No I...no I
No I, just want to taste your love
See Howie Day LiveGet tickets as low as $64You might also likeStanding in your shoes
I turn and now
You're standing bare in my doorway
I only wish that I had been prepared
I'm gonna have to go along with your way
Just take the plastic camera out
It's the pants you borrowed in the driveway
Alive from the first
Now I'm denied by the ghost of you

You make yourself a photograph and laugh with me
Please
You make yourself a photograph and laugh with me
Please
No I, want to taste your love
No I...
I was alive from the first
Now I'm denied by the ghost of youEmbed",0,/songs/3547111,Ghost (Live from Boston) by Howie Day,https://images.genius.com/51a39d4a387cded90f49fe37953f319b.300x300x1.jpg,https://images.genius.com/51a39d4a387cded90f49fe37953f319b.497x497x1.jpg,6002448,complete,/Howie-day-ghost-live-from-boston-lyrics,,https://images.genius.com/51a39d4a387cded90f49fe37953f319b.300x300x1.jpg,https://images.genius.com/51a39d4a387cded90f49fe37953f319b.497x497x1.jpg,Ghost (Live from Boston),https://genius.com/Howie-day-ghost-live-from-boston-lyrics,/albums/318459,https://images.genius.com/51a39d4a387cded90f49fe37953f319b.497x497x1.jpg,Live From... by Howie Day,318459.0,Live From...,2005,https://genius.com/albums/Howie-day/Live-from
1627464,Howie Day,Ghost (mix 6),"2 ContributorsGhost (mix 6) LyricsLately i've been thinking
Lately i've been dreaming with you
I'm so resistent to this type of thinking
Oh now it's shining through

I was alone for the last time
Before my nights' vacation with you
Alive from the first now i'm denied
By the ghost of you

Oh you take yourself a photograph and laugh at me
Please

I know there's little use in crying
It's more wide awake and dying than i'm used to
I thought we'd walk these streets together
Now i'm hoping that I'll never have to meet you
Step aside from all this anger
And somewhere in between I can feel you
Ask me should we try again
I'm thinking no yeah
It's not what i believe in
It's not what i believe in

Oh, Won't you take yourself a photograph and laugh at me
Please
You make yourself a photograph and laugh at me
Please
See Howie Day LiveGet tickets as low as $64You might also likeNo I, wanna taste your love
No I...no I
No I, just wanna taste your love
Oh, no I

Standing in your shoes I turn
And now you're standing bare in my doorway
I only wish that I had been prepared
I'm gonna have to go along with your way

Just take the plastic camera out
It's in the pants you borrowed in the driveway
Alive from the first now i'm denied by the ghost of you

Make yourself a photograph & laugh at me please
Yeah make yourself a photograph & laugh at me please
No i want a taste of love no i
I was alive from the first now i'm denied by the ghost of youEmbed",1,/songs/1627464,Ghost (mix 6) by Howie Day,https://images.genius.com/83156b94d38044ef42a3611a69715186.300x300x1.jpg,https://images.genius.com/83156b94d38044ef42a3611a69715186.300x300x1.jpg,1549345,complete,/Howie-day-ghost-mix-6-lyrics,,https://images.genius.com/83156b94d38044ef42a3611a69715186.300x300x1.jpg,https://images.genius.com/83156b94d38044ef42a3611a69715186.300x300x1.jpg,Ghost (mix 6),https://genius.com/Howie-day-ghost-mix-6-lyrics,/albums/271958,https://images.genius.com/83156b94d38044ef42a3611a69715186.300x300x1.jpg,The Madrigals EP by Howie Day,271958.0,The Madrigals EP,2003,https://genius.com/albums/Howie-day/The-madrigals-ep
