search_name,artist_id,artist_name,album_api_path,album_cover_art_url,album_full_title,album_id,album_name,album_release_date_for_display,album_url,song_id,song_artist_names,song_title,song_annotation_count,song_api_path,song_full_title,song_header_image_thumbnail_url,song_header_image_url,song_lyrics_owner_id,song_lyrics_state,song_path,song_pyongs_count,song_song_art_image_thumbnail_url,song_song_art_image_url,song_title_with_featured,song_url,lyrics
Frank Ocean,1985,Frank Ocean,/albums/164205,https://images.genius.com/08a6d929376be008cec9c877ec1cda20.1000x1000x1.png,Endless by Frank Ocean,164205,Endless,"August 19, 2016",https://genius.com/albums/Frank-ocean/Endless,3045793,Frank Ocean,Xenons,3,/songs/3045793,Xenons by Frank Ocean,https://images.genius.com/b26637d617c603d39f004193ad77456a.300x169x1.png,https://images.genius.com/b26637d617c603d39f004193ad77456a.1000x563x1.png,104344,complete,/Frank-ocean-xenons-lyrics,6.0,https://images.genius.com/08a6d929376be008cec9c877ec1cda20.300x300x1.png,https://images.genius.com/08a6d929376be008cec9c877ec1cda20.1000x1000x1.png,Xenons,https://genius.com/Frank-ocean-xenons-lyrics,"35 ContributorsTranslationsPortuguêsXenons Lyrics[Intro]
Oh, yes
Oh, slide

[Verse]
Xenon's with the blue color
If that's a lease, least it look cool on you
That's your business and I'm off, when I'm on you
Like holidays, I get off on youYou might also like6Embed"
Frank Ocean,1985,Frank Ocean,/albums/164205,https://images.genius.com/08a6d929376be008cec9c877ec1cda20.1000x1000x1.png,Endless by Frank Ocean,164205,Endless,"August 19, 2016",https://genius.com/albums/Frank-ocean/Endless,2840999,Frank Ocean,Mitsubishi Sony,10,/songs/2840999,Mitsubishi Sony by Frank Ocean,https://images.genius.com/b26637d617c603d39f004193ad77456a.300x169x1.png,https://images.genius.com/b26637d617c603d39f004193ad77456a.1000x563x1.png,672397,complete,/Frank-ocean-mitsubishi-sony-lyrics,12.0,https://images.genius.com/08a6d929376be008cec9c877ec1cda20.300x300x1.png,https://images.genius.com/08a6d929376be008cec9c877ec1cda20.1000x1000x1.png,Mitsubishi Sony,https://genius.com/Frank-ocean-mitsubishi-sony-lyrics,"67 ContributorsTranslationsPortuguêsMitsubishi Sony Lyrics[Intro]
That ain't really loud
Couldn't raise his voice 'cause his wind gone (Woo)
Niggas sound like Reggie (Reggie)
(Already, they ran through already) Yeah
(Oh, niggas goin' in, fuck it)

[Verse]
Pray to the pipe (Fuck it), I slide deep inside
Not too deep, not too shallow, I'm mindful of size
She chock full of my swipe, like a capsule sealed tight
With that substance you need, start a family tonight
Big-body Merc', LED lights and it's all overprice
The dollar been cheap' than a bitch
Tuberose and tulips
On the boxes you're in, from the holes in your skin
Hit the road and get rich or stay home and get broke
It's your choice in the end
Yeah they watching my fence, like they next to my kin
Like they paid by the pope, got some priests by the door
Frisk the demons before they step into my glow
Oh my, my
Get it, get itYou might also like12Embed"
Frank Ocean,1985,Frank Ocean,/albums/164205,https://images.genius.com/08a6d929376be008cec9c877ec1cda20.1000x1000x1.png,Endless by Frank Ocean,164205,Endless,"August 19, 2016",https://genius.com/albums/Frank-ocean/Endless,9641249,Frank Ocean,Walk Away,2,/songs/9641249,Walk Away by Frank Ocean,https://images.genius.com/b26637d617c603d39f004193ad77456a.300x169x1.png,https://images.genius.com/b26637d617c603d39f004193ad77456a.1000x563x1.png,12233752,complete,/Frank-ocean-walk-away-lyrics,1.0,https://images.genius.com/08a6d929376be008cec9c877ec1cda20.300x300x1.png,https://images.genius.com/08a6d929376be008cec9c877ec1cda20.1000x1000x1.png,Walk Away,https://genius.com/Frank-ocean-walk-away-lyrics,"3 ContributorsWalk Away Lyrics[Interlude]
Walk away, walk away, walk away, away (Ooh)
Away (Ooh, ooh-aah)You might also like1Embed"
Frank Ocean,1985,Frank Ocean,/albums/822697,https://images.genius.com/187681d851b7d431082239648c6c80ec.1000x1000x1.png,channel ORANGE (CD Version) by Frank Ocean,822697,channel ORANGE (CD Version),"July 17, 2012",https://genius.com/albums/Frank-ocean/Channel-orange-cd-version,78954,Frank Ocean,Start,2,/songs/78954,Start by Frank Ocean,https://images.genius.com/6523ef2dbe975dd04570ee626edf53ca.300x300x1.png,https://images.genius.com/6523ef2dbe975dd04570ee626edf53ca.1000x1000x1.png,11524,complete,/Frank-ocean-start-lyrics,16.0,https://images.genius.com/6523ef2dbe975dd04570ee626edf53ca.300x300x1.png,https://images.genius.com/6523ef2dbe975dd04570ee626edf53ca.1000x1000x1.png,Start,https://genius.com/Frank-ocean-start-lyrics,"41 ContributorsTranslationsEspañolPolskiStart Lyrics[Intro]
They look like twins
That was embarrassingYou might also like16Embed"
Frank Ocean,1985,Frank Ocean,/albums/822697,https://images.genius.com/187681d851b7d431082239648c6c80ec.1000x1000x1.png,channel ORANGE (CD Version) by Frank Ocean,822697,channel ORANGE (CD Version),"July 17, 2012",https://genius.com/albums/Frank-ocean/Channel-orange-cd-version,53152,Frank Ocean,Thinkin Bout You,5,/songs/53152,Thinkin Bout You by Frank Ocean,https://images.genius.com/6523ef2dbe975dd04570ee626edf53ca.300x300x1.png,https://images.genius.com/6523ef2dbe975dd04570ee626edf53ca.1000x1000x1.png,18746,complete,/Frank-ocean-thinkin-bout-you-lyrics,416.0,https://images.genius.com/14e2193bf47237e1ba4b8ab2e8279f16.300x300x1.png,https://images.genius.com/14e2193bf47237e1ba4b8ab2e8279f16.1000x1000x1.png,Thinkin Bout You,https://genius.com/Frank-ocean-thinkin-bout-you-lyrics,"262 ContributorsTranslationsTürkçeEspañolРусскийPolskiFrançaisThinkin Bout You Lyrics[Verse 1]
A tornado flew around my room before you came
Excuse the mess it made, it usually doesn't rain in
Southern California, much like Arizona
My eyes don't shed tears, but boy, they pour when

[Pre-Chorus]
I'm thinkin' 'bout you, ooh no, no, no
I've been thinkin' bout you, you know, know, know
I've been thinkin' bout you, do you think about me still?
Do ya, do ya?

[Chorus]
Or do you not think so far ahead?
'Cause I been thinkin' bout forever, ooh
Or do you not think so far ahead?
'Cause I been thinkin' bout forever, ooh

[Verse 2]
No, I don't like you, I just thought you were cool enough to kick it
Got a beach house I could sell you in Idaho
Since you think I don't love you, I just thought you were cute
That's why I kissed you
Got a fighter jet, I don't get to fly it though, I'm lying down

[Pre-Chorus]
Thinkin' 'bout you, ooh no, no, no
I've been thinkin' bout you, you know, know, know
I've been thinkin' bout you, do you think about me still?
Do ya, do ya?
You might also like[Chorus]
Or do you not think so far ahead?
'Cause I been thinkin' bout forever, ooh
Or do you not think so far ahead?
'Cause I been thinkin' bout forever, ooh

[Bridge]
Yes, of course, I remember, how could I forget (How could I forget?) how you feel? (How you feel?)
You know you were my first time, a new feel
It won't ever get old, not in my soul, not in my spirit, keep it alive
We'll go down this road 'til it turns from color to black and white

[Chorus]
Or do you not think so far ahead?
'Cause I been thinkin' bout forever, ooh
Or do you not think so far ahead?
'Cause I been thinkin' bout forever, ooh416Embed"
Frank Ocean,1985,Frank Ocean,/albums/822697,https://images.genius.com/187681d851b7d431082239648c6c80ec.1000x1000x1.png,channel ORANGE (CD Version) by Frank Ocean,822697,channel ORANGE (CD Version),"July 17, 2012",https://genius.com/albums/Frank-ocean/Channel-orange-cd-version,78955,Frank Ocean,Fertilizer,4,/songs/78955,Fertilizer by Frank Ocean,https://images.genius.com/6523ef2dbe975dd04570ee626edf53ca.300x300x1.png,https://images.genius.com/6523ef2dbe975dd04570ee626edf53ca.1000x1000x1.png,56091,complete,/Frank-ocean-fertilizer-lyrics,19.0,https://images.genius.com/6523ef2dbe975dd04570ee626edf53ca.300x300x1.png,https://images.genius.com/6523ef2dbe975dd04570ee626edf53ca.1000x1000x1.png,Fertilizer,https://genius.com/Frank-ocean-fertilizer-lyrics,"55 ContributorsTranslationsEspañolFertilizer Lyrics[Intro]
(Really, though, I think)

[Verse]
Fertilizer
I'll take bullshit if that's all you got
Some fertilizer
FertilizerYou might also like19Embed"
Frank Ocean,1985,Frank Ocean,/albums/822697,https://images.genius.com/187681d851b7d431082239648c6c80ec.1000x1000x1.png,channel ORANGE (CD Version) by Frank Ocean,822697,channel ORANGE (CD Version),"July 17, 2012",https://genius.com/albums/Frank-ocean/Channel-orange-cd-version,78956,Frank Ocean,Sierra Leone,12,/songs/78956,Sierra Leone by Frank Ocean,https://images.genius.com/6523ef2dbe975dd04570ee626edf53ca.300x300x1.png,https://images.genius.com/6523ef2dbe975dd04570ee626edf53ca.1000x1000x1.png,5307,complete,/Frank-ocean-sierra-leone-lyrics,62.0,https://images.genius.com/6523ef2dbe975dd04570ee626edf53ca.300x300x1.png,https://images.genius.com/6523ef2dbe975dd04570ee626edf53ca.1000x1000x1.png,Sierra Leone,https://genius.com/Frank-ocean-sierra-leone-lyrics,"107 ContributorsTranslationsEspañolEnglishSierra Leone Lyrics[Verse 1]
(We're spendin' too much time alone)
Spendin' too much time alone
(And I just ran outta Trojans)
Horses gallop to her throne
(We're behaving like teenagers)
Yes, we're behaving like teenagers
(Making less than minimum wage)
Still inside our parents' homes
(No, I don't live in Denver)
No, I don't live in Denver
(I grew up in Sierra Leone)
And her pink skies will keep me warm

[Chorus]
Sierra Leone
Sierra Leone
Tid bits of intuition that I be gettin' abandon mission
(Sierra Leone)
Abandon mission, you must be kiddin', this shit feelin' different
Shit feelin' too good to me
Glistening, shimmerin' underneath the sunlight, the sunlight
(Sierra Leone)

[Verse 2]
And a new day will bring about the dawn
And a new day will bring another crying babe into the world
(Girl now)
Our daughter's reaching for your nipple 'cause it's time for her to eat (Reaching for ya)
Tonight I'll lay her in the cradle if it's time to go to sleep (Oh, go to sleep, oh, oh)
I'll sing a Lennon lullaby, she can have a pretty dream
Baby girl, if you knew what I know, knew what I know
You might also like[Outro]
Na, na na, na na, na...
Na, na na, na na, na...62Embed"
Frank Ocean,1985,Frank Ocean,/albums/822697,https://images.genius.com/187681d851b7d431082239648c6c80ec.1000x1000x1.png,channel ORANGE (CD Version) by Frank Ocean,822697,channel ORANGE (CD Version),"July 17, 2012",https://genius.com/albums/Frank-ocean/Channel-orange-cd-version,78957,Frank Ocean,Sweet Life,23,/songs/78957,Sweet Life by Frank Ocean,https://images.genius.com/6523ef2dbe975dd04570ee626edf53ca.300x300x1.png,https://images.genius.com/6523ef2dbe975dd04570ee626edf53ca.1000x1000x1.png,11524,complete,/Frank-ocean-sweet-life-lyrics,92.0,https://images.genius.com/be9275ce8581c0b81b6ef0639b257a95.300x300x1.png,https://images.genius.com/be9275ce8581c0b81b6ef0639b257a95.1000x1000x1.png,Sweet Life,https://genius.com/Frank-ocean-sweet-life-lyrics,"142 ContributorsTranslationsEspañolSweet Life Lyrics[Verse 1]
The best song wasn't the single, but you weren't either
Livin' in Ladera Heights, the black Beverly Hills
Domesticated paradise, palm trees and pools
The water's blue, swallow the pill
Keepin' it surreal, whatever you like
Whatever feels good, whatever takes your mountain high
Keepin' it surreal, not sugar-free
My TV ain't HD, that's too real
Grapevine, mango, peaches, and limes, the sweet life

[Pre-Chorus]
The sweet life, sweet life
Sweet life, sweet life
The sweet, sweet, sweet, sweet life
Sweet life, the sweet life
Sweetie pie

[Chorus]
You've had a landscaper and a house keeper since you were born
The starshine always kept you warm
So why see the world, when you got the beach?
Don't know why see the world, when you got the beach
The sweet life

[Verse 2]
The best song wasn't the single
But you couldn't turn your radio down
Satellite need a receiver, can't seem to turn the signal fully off
Transmitting the waves
You're catching that breeze 'til you're dead in the grave
But you're keepin' it surreal, whatever you like
Whatever feels good, whatever takes your mountain high
Keepin' it surreal, not sugar-free
My TV ain't HD, that's too real
Grapevines, mango, peaches, and lime, a sweet life
You might also like[Pre-Chorus]
A sweet life
A sweet life, yeah
A sweet life, a sweet life
A sweet life
Live and die in the life

[Chorus]
You've had a landscaper and a house keeper since you were born (Yeah)
The starshine always kept you warm
So why see the world, when you got the beach?
Don't know why see the world, when you got the beach?

[Bridge]
And the water is exactly what I wanted (Ah)
It's everything I thought it would be (Thought it would be)
But this neighborhood is gettin' trippier every day
The neighborhood is goin' ape shit crazy, ahh

[Chorus]
You've had a landscaper and a house keeper since you were born
The starshine always kept you warm
So why see the world, when you got the beach?
Don't know why see the world, when you got the beach
The sweet life92Embed"
Frank Ocean,1985,Frank Ocean,/albums/822697,https://images.genius.com/187681d851b7d431082239648c6c80ec.1000x1000x1.png,channel ORANGE (CD Version) by Frank Ocean,822697,channel ORANGE (CD Version),"July 17, 2012",https://genius.com/albums/Frank-ocean/Channel-orange-cd-version,78959,Frank Ocean,Not Just Money,9,/songs/78959,Not Just Money by Frank Ocean,https://images.genius.com/6523ef2dbe975dd04570ee626edf53ca.300x300x1.png,https://images.genius.com/6523ef2dbe975dd04570ee626edf53ca.1000x1000x1.png,11524,complete,/Frank-ocean-not-just-money-lyrics,11.0,https://images.genius.com/6523ef2dbe975dd04570ee626edf53ca.300x300x1.png,https://images.genius.com/6523ef2dbe975dd04570ee626edf53ca.1000x1000x1.png,Not Just Money,https://genius.com/Frank-ocean-not-just-money-lyrics,"53 ContributorsTranslationsEnglishNot Just Money Lyrics[Skit: Rosie Watson]
Stop thinking of this as being money
""It's just money, I'ma make more""
No, no, no-no-no-no
Please decondition yourself
It's not just money
It's happiness
It's the difference between happy, being happy and sad
It's the difference between having a home and living on the streets
That's what it is, it's not just money
It's so much more than that
Right now, it's the difference between you being able to go to a prom
And disappointing a girl
As I told you from the beginning, I don't have money
I have bills to pay
But that meant nothing to you
Absolutely nothing
Hmm, let's see, I have
Ooh, yeah, I'ma make myself a hot link when I get home
Meant nothing to you
Saving my seven dollarsYou might also like11Embed"
Frank Ocean,1985,Frank Ocean,/albums/822697,https://images.genius.com/187681d851b7d431082239648c6c80ec.1000x1000x1.png,channel ORANGE (CD Version) by Frank Ocean,822697,channel ORANGE (CD Version),"July 17, 2012",https://genius.com/albums/Frank-ocean/Channel-orange-cd-version,78960,Frank Ocean (Ft. Earl Sweatshirt),Super Rich Kids,39,/songs/78960,Super Rich Kids by Frank Ocean (Ft. Earl Sweatshirt),https://images.genius.com/6523ef2dbe975dd04570ee626edf53ca.300x300x1.png,https://images.genius.com/6523ef2dbe975dd04570ee626edf53ca.1000x1000x1.png,115538,complete,/Frank-ocean-super-rich-kids-lyrics,276.0,https://images.genius.com/9aa692c98a17ee7203aa1b4662b80830.300x300x1.png,https://images.genius.com/9aa692c98a17ee7203aa1b4662b80830.500x500x1.png,Super Rich Kids (Ft. Earl Sweatshirt),https://genius.com/Frank-ocean-super-rich-kids-lyrics,"276 ContributorsTranslationsEspañolSuper Rich Kids Lyrics[Chorus: Frank Ocean]
Too many bottles of this wine we can't pronounce
Too many bowls of that green, no Lucky Charms
The maids come around too much
Parents ain't around enough
Too many joy rides in daddy's Jaguar
Too many white lies and white lines
Super rich kids with nothing but loose ends
Super rich kids with nothing but fake friends

[Verse 1: Frank Ocean]
Start my day up on the roof
There's nothing like this type of view
Point the clicker at the tube
I prefer expensive news
New car, new girl
New ice, new glass
New watch, good times babe
It's good times, yeah
She wash my back three times a day
This shower head feels so amazing
We'll both be high, the help don't stare
They just walk by, they must don't care
A million one, a million two
A hundred more will never do
You might also like[Chorus: Frank Ocean]
Too many bottles of this wine we can't pronounce
Too many bowls of that green, no Lucky Charms
The maids come around too much
Parents ain't around enough
Too many joy rides in daddy's Jaguar
Too many white lies and white lines
Super rich kids with nothing but loose ends
Super rich kids with nothing but fake friends

[Bridge: Frank Ocean]
Real love, I'm searching for a real love
Oh, real love, I'm searching for a real love
Oh, real love
[Verse 2: Earl Sweatshirt]
Alright, close your eyes to what you can't imagine
We are the Xanny-gnashing
Caddy-smashing, bratty assy
He mad, he snatched his daddy's Jag
And used the shit for batting practice
Adamant and he thrashing
Purchasing crappy grams with half the hand of cash you handed
Panic and patch me up
Pappy done latch-keyed us
Toying with Raggy Anns and Mammy done had enough
Brash as fuck, breachin' all these aqueducts
Don't believe us
Treat us like we can't erupt, yup
[Alternate Verse 2: Frank Ocean]
Polo sweats and Hermes blankets
Them label hoes be stealing my shit
And all they clothes revealing they tits
Pills, high enough to touch the rim in that bitch
We party in my living room
'Cause father is gone
And he left me this empire
That runs on its own
So all I got to do is whatever the fuck I want
All we ever do is whatever the fuck we want

[Verse 3: Frank Ocean]
We end our day up on the roof
I say I'll jump, I never do
But when I'm drunk I act a fool
Talking 'bout, do they sew wings on tailored suits
I'm on that ledge, she grabs my arm
She slaps my hand
It's good times, yeah
Sleeve rips off, I slip, I fall
The market's down like 60 stories
And some don't end the way they should
My silver spoon has fed me good
A million one, a million cash
Close my eyes and feel the crash
[Chorus: Frank Ocean]
Too many bottles of this wine we can't pronounce
Too many bowls of that green, no Lucky Charms
The maids come around too much
Parents ain't around enough
Too many joy rides in daddy's Jaguar
Too many white lies and white lines
Super rich kids with nothing but loose ends
Super rich kids with nothing but fake friends

[Outro: Frank Ocean]
Real love, ain't that something rare
I'm searching for a real love, talking 'bout real love
Real love, yeah
Real love
I'm searching for a real love
Talkin' 'bout a real love276Embed"
Frank Ocean,1985,Frank Ocean,/albums/822697,https://images.genius.com/187681d851b7d431082239648c6c80ec.1000x1000x1.png,channel ORANGE (CD Version) by Frank Ocean,822697,channel ORANGE (CD Version),"July 17, 2012",https://genius.com/albums/Frank-ocean/Channel-orange-cd-version,78961,Frank Ocean,Pilot Jones,11,/songs/78961,Pilot Jones by Frank Ocean,https://images.genius.com/6523ef2dbe975dd04570ee626edf53ca.300x300x1.png,https://images.genius.com/6523ef2dbe975dd04570ee626edf53ca.1000x1000x1.png,5307,complete,/Frank-ocean-pilot-jones-lyrics,54.0,https://images.genius.com/6523ef2dbe975dd04570ee626edf53ca.300x300x1.png,https://images.genius.com/6523ef2dbe975dd04570ee626edf53ca.1000x1000x1.png,Pilot Jones,https://genius.com/Frank-ocean-pilot-jones-lyrics,"96 ContributorsTranslationsEspañolPilot Jones Lyrics[Intro]
We once had things in common
Now the only thing we share is the refrigerator
Ice cold, baby, I told you, I'm ice cold (Ice cold!)
You out here flyin' high (High)
Go 'head, fly that thing!
High, high, yeah
But fly alone

[Verse 1]
You always smokin' in the house
What if my mother comes over?
You can't get up and get a job
'Cause this little hustle's getting you by
You're the dealer and the stoner
With the sweetest kiss I've ever known

[Chorus]
I know what I was on
I had a Pilot Jones (What you know about it?)
She took me high (Oh, did she now?)
Then she took me home (We talkin' 'bout)
Pilot Jones, Pilot Jones

[Verse 2]
Tonight she came stumblin' across my lawn again
I just don't know why I keep on tryin' to keep a grown woman sober
See, there you go reachin' up your blouse
And no, I don't want a child
But I ain't been touched in a while
By the dealer and the stoner
With the sweetest kiss I've ever known, ever known
You might also like[Chorus]
I know what I was on (Ever known)
I had a Pilot Jones (What you know about it?)
She took me high (Oh, did she now?)
Then she took me home (We talkin' 'bout)
Pilot Jones, Pilot Jones

[Verse 3]
In the sky up above, the birds
I saw the sky like I never seen before
You thought I was above you
Above this in so many ways
But if I got a condo on a cloud
Then I guess you can stay at my place, ooh
I'ma get one
Mhm, I need ya
I admit it
You're my Pilot Jones54Embed"
Frank Ocean,1985,Frank Ocean,/albums/822697,https://images.genius.com/187681d851b7d431082239648c6c80ec.1000x1000x1.png,channel ORANGE (CD Version) by Frank Ocean,822697,channel ORANGE (CD Version),"July 17, 2012",https://genius.com/albums/Frank-ocean/Channel-orange-cd-version,78962,Frank Ocean,Crack Rock,17,/songs/78962,Crack Rock by Frank Ocean,https://images.genius.com/6523ef2dbe975dd04570ee626edf53ca.300x300x1.png,https://images.genius.com/6523ef2dbe975dd04570ee626edf53ca.1000x1000x1.png,56091,complete,/Frank-ocean-crack-rock-lyrics,90.0,https://images.genius.com/6523ef2dbe975dd04570ee626edf53ca.300x300x1.png,https://images.genius.com/6523ef2dbe975dd04570ee626edf53ca.1000x1000x1.png,Crack Rock,https://genius.com/Frank-ocean-crack-rock-lyrics,"132 ContributorsTranslationsEspañolCrack Rock Lyrics[Produced by Malay and Om'Mas Keith]

[Verse 1]
You don't know how little you matter until you're all alone
In the middle of Arkansas with a little rock left in that glass dick
Used to date a blonde, you used to hit it raw
'Cause she was and you are madly involved, madly involved

[Hook]
Hittin' stones in glass homes
You're smokin' stones in abandoned homes
You hit them stones and broke your home
Crack rock, crack rock
Crack rock, crack rock
Hittin' stones in glass homes
You're smokin' stones in abandoned homes
You hit them stones and broke your home
Crack rock, crack rock
Crack rock, crack rock

[Verse 2]
You're shuckin' and jivin', stealin' and robbin'
To get the fixing that you're itching for
Your family stopped inviting you to things
Won't let you hold their infant
You used to to get a little cut-up from time to time
But the freaks ain't trying to sleep with cracky
You might also like[Hook]
Hittin' stones in glass homes
You're smokin' stones in abandoned homes
You hit them stones and you broke your home
Crack rock
Crack rock, crack rock

[Bridge]
Crooked cop, dead cop
How much dope can you push to me?
Crooked cop, dead cop
No good for community
Fuckin' pig get shot, three hundred men will search for me
My brother get popped and don't no one hear the sound
Don't no one hear the rounds (Sound)
Don't no one hear the shells (Shells)

[Outro]
Don't no one hear a sound
Don't no one disturb the peace for riot
Don't no one disrupt nirvana
Don't no one wanna blow the high
Crack rock, crack rock, crack rock
How you feeling, girl?
How's the gutter doing?
Crack rock90Embed"
