search_name,artist_id,artist_name,album_api_path,album_cover_art_url,album_full_title,album_id,album_name,album_release_date_for_display,album_url,song_id,song_artist_names,song_title,song_annotation_count,song_api_path,song_full_title,song_header_image_thumbnail_url,song_header_image_url,song_lyrics_owner_id,song_lyrics_state,song_path,song_pyongs_count,song_song_art_image_thumbnail_url,song_song_art_image_url,song_title_with_featured,song_url,lyrics
Frank Ocean,1985,Frank Ocean,/albums/164741,https://images.genius.com/ab6ea0cf9dc36b3630fed6008f40d08b.1000x1000x1.png,Blonde (Magazine Version) by Frank Ocean,164741,Blonde (Magazine Version),"August 20, 2016",https://genius.com/albums/Frank-ocean/Blonde-magazine-version,2842086,Frank Ocean,Seigfried,18,/songs/2842086,Seigfried by Frank Ocean,https://images.genius.com/750737a023d383b93057b73d546bfe4e.300x300x1.png,https://images.genius.com/750737a023d383b93057b73d546bfe4e.1000x1000x1.png,22533,complete,/Frank-ocean-seigfried-lyrics,156.0,https://images.genius.com/750737a023d383b93057b73d546bfe4e.300x300x1.png,https://images.genius.com/750737a023d383b93057b73d546bfe4e.1000x1000x1.png,Seigfried,https://genius.com/Frank-ocean-seigfried-lyrics,"256 ContributorsTranslationsEspañolPortuguêsSeigfried Lyrics[Verse 1]
The markings on your surface
Your speckled face
Flawed crystals hang from your ears
I couldn't gauge your fears
I can't relate to my peers
I'd rather live outside
I'd rather chip my pride than lose my mind out here
Maybe I'm a fool
Maybe I should move and settle
Two kids and a swimming pool
I'm not brave
(Brave)
I'm not brave

[Verse 2]
I'm living over city
And taking in the homeless sometimes, I've
Been living in an idea
An idea from another man's mind
Maybe I'm a fool
To settle for a place with some nice views (Nice views)
Maybe I should move, settle down
Two kids and a swimming pool
I'm not brave
I'd rather live outside
I'd rather live outside
I'd rather go to jail
I've tried hell
(It's a loop) What would you recommend I do?
(The other side of the loop is a loop)
This, this fe—, this feel, this feel, this feels
This feels how molly must feel
This feels how molly must feel
How molly must feel
This feels how molly must feel
How molly must feel
You might also like[Bridge]
This is not my life
It's just a fond farewell to a friend
It's just a fond farewell to a friend
This is not my life
It's just a fond farewell to a friend
It's not what I'm like
It's just a fond farewell
(Brave)

[Verse 3]
Speaking of nirvana, it was there
Rare as the feathers on my dash from a phoenix
There with my crooked teeth and companion sleeping, yeah
Dreaming a thought that could dream about a thought
That could think of the dreamer that thought
That could think of dreaming and getting a glimmer of God
I be dreaming of dreaming a thought
That could dream about a thought
That could think of dreaming a dream
Where I cannot, where I cannot

[Verse 4]
Less morose and more present
Dwell on my gifts for a second, a moment
One solar flare, we're consumed
So why not spend this flammable paper on the film that's my life?
High flights, inhale the vapor, exhale once and think twice
Eat some shrooms, maybe have a good cry about you
See some colors, light hang glide off the moon
[Outro]
(In the dark)
(In the dark)
I'd do anything for you
(In the dark)
I'd do anything for you
(In the dark)
I'd do anything for you
(In the dark)
I'd do anything for you
(In the dark)
I'd do anything for you, anything for you
(In the dark)
I'd do anything for you, anything for156Embed"
Frank Ocean,1985,Frank Ocean,/albums/164741,https://images.genius.com/ab6ea0cf9dc36b3630fed6008f40d08b.1000x1000x1.png,Blonde (Magazine Version) by Frank Ocean,164741,Blonde (Magazine Version),"August 20, 2016",https://genius.com/albums/Frank-ocean/Blonde-magazine-version,2842075,Frank Ocean,Godspeed,8,/songs/2842075,Godspeed by Frank Ocean,https://images.genius.com/750737a023d383b93057b73d546bfe4e.300x300x1.png,https://images.genius.com/750737a023d383b93057b73d546bfe4e.1000x1000x1.png,282633,complete,/Frank-ocean-godspeed-lyrics,97.0,https://images.genius.com/750737a023d383b93057b73d546bfe4e.300x300x1.png,https://images.genius.com/750737a023d383b93057b73d546bfe4e.1000x1000x1.png,Godspeed,https://genius.com/Frank-ocean-godspeed-lyrics,"137 ContributorsTranslationsTürkçeEspañolPortuguêsРусскийGodspeed Lyrics[Verse: Frank Ocean]
I will always love you
How I do
Let go of a prayer for you
Just a sweet word
The table is prepared for you
Wishing you godspeed, glory
There will be mountains you won't move
Still, I'll always be there for you
How I do
I let go of my claim on you
It's a free world
You'll look down on where you came from sometimes
But you'll have this place to call home always

[Bridge: Frank Ocean & Kim Burrell]
This love will keep us through blinding of the eyes
Silence in the ears, darkness of the mind (Until it's time)
This love will keep through blinding of the eyes (Oh)
Silence in the ears, darkness of the mind (Oh)
This love will keep us through blinding of the eyes (Oh, it's 'til it's time we die)
Silence in the ears, darkness of the mind

[Outro: Kim Burrell]
Oh, oh
I'll always love you
Until the time we die
Oh, ohYou might also like97Embed"
Frank Ocean,1985,Frank Ocean,/albums/164741,https://images.genius.com/ab6ea0cf9dc36b3630fed6008f40d08b.1000x1000x1.png,Blonde (Magazine Version) by Frank Ocean,164741,Blonde (Magazine Version),"August 20, 2016",https://genius.com/albums/Frank-ocean/Blonde-magazine-version,2842090,Frank Ocean,Futura Free,30,/songs/2842090,Futura Free by Frank Ocean,https://images.genius.com/750737a023d383b93057b73d546bfe4e.300x300x1.png,https://images.genius.com/750737a023d383b93057b73d546bfe4e.1000x1000x1.png,104344,complete,/Frank-ocean-futura-free-lyrics,81.0,https://images.genius.com/750737a023d383b93057b73d546bfe4e.300x300x1.png,https://images.genius.com/750737a023d383b93057b73d546bfe4e.1000x1000x1.png,Futura Free,https://genius.com/Frank-ocean-futura-free-lyrics,"303 ContributorsTranslationsEspañolPortuguêsFutura Free Lyrics[Intro]
Alright, hold on

[Verse 1]
If I was being honest
I'd say long as I could fuck three times a day and not skip a meal, I'm good
I used to work on my feet for seven dollars a hour
Call my mama like, ""Mama
I ain't making minimum wage, mama
I'm on, mama, I'm on
Now  I'm making 400, 600, 800K, mama
To stand on my feet, mama
Play these songs, it's therapy, mama
They paying me, mama
I should be paying them""
I should be paying y'all, honest to God
I'm just a guy, I'm not a god
Sometimes I feel like I'm a god, but I'm not a god
If I was, I don't know which heaven would have me, mama
Let me run this bitch, I'ma run it into the ground, mama, the whole galaxy
Goddamn, fuck these lames, they don't want none
Fuck these lames, they don't want none
Fuck these niggas
Fuck these niggas, they don't want none
Fuck these niggas
Fuck you niggas and
Fuck me if I hated on you
You might also like[Verse 2]
I'ma stick around
I'm gon' let my nuts hang
Nigga, you got some just like me, don't you?
Or maybe not just like me
You know I'm Africano Americano
And even if you're half Japanese, roots run deep
Family tree throw a big shadow (Jamming to the rhythm)
Tech company, please give me immortality (It's a face to face)
I'm going rapidly, fading drastically (Keep me high, Castrati)
Damn (Punani fade the stress)
Or pull the zip down
Wet your lips first, lick the tip now (Bugatti left some stretch marks on that freeway)
Smoke somethin'
(Marks on that freeway)
They tryna find 2Pac
Don't let 'em find 2Pac
He evade the press
He escape the stress
La, la-la-la-la
La, la-la-la-la
La-la-la

[Verse 3]
I'll keep quiet and let you run your phone bill up
I know you love to talk
I ain't on your schedule
I ain't on no schedule
I ain't had me a job since 2009
I ain't on no sales floor
You say I'm changing on you
I feel like Selena
They wanna murder a nigga, murder me like Selena
You must ain't get the memo
I don't cuff bitches no more
But your bitch my exception
Come get her outta my photo
I only got one four-door
Remember when I had that Lexus, no
Our friendship don't go back that far
Tyler slept on my sofa, yeah
Niggas go back that far
I ain't smoked all year
This the last song, so I'm finna wipe that off
Tolerance is so low, still smoke a whole 'gar
Ménage on my birthday, tap out on the first stroke
'Cause this ain't no work day, she don't give head anyway
'Cause what niggas say, that's what she tell her man
What a difference distance makes
Niggas wan' fight in the streets
Now shit startin' to make my hands hurt
Jay hit me on the email, said I oughta act my net worth
Dog, this is chess now, not fetch, I ain't runnin' for a nigga
Ain't ran since track meets, that's the only time I ran from a nigga
You can change this track now, could've changed this bitch a long time ago
—know and —know, —know and —know
Shout out to Hollygrove, I'm from that 7th, though
Twins know and Lance know, Clark know and Matt know
Shit went one-eighty on me, please run that back, though
[Skit]
You say some shit about me? Tuck a real sport, my nigga
That shit happened the second time? 'Cause Mark saw both times, nigga, I only saw the first time
That second time, Jerron was there, nigga
On God, he grabbed me in circles, nigga
And the, and the other nigga tried to pull me
Oh yeah, Jerron told me you that your ass especially told him
Yeah, 'cause the nigga tried to boom me in my face
I had AD in a headlock, nigga (The first time I saw?), I had this nigga like—
[Outro: Mikey Alfred, Ryan Breaux, Sage Elsesser, Evan Clark, Na’kel Smith, Frank Ocean]

[Mikey]
Make sure you speak up

[Ryan]
Okay

[Mikey]
What's your name?

[Ryan]
Ryan

[Mikey]
Yo, ayy be quiet, what's your name?
What do you do?
What's your first memory?
[Ryan]
The first word I learned to say or that I ever said

[Mikey]
What's the most amazing thing you've ever witnessed?
(Uh, hell no)
(You're not gon' make it, are you?)

[Na'kel]
Friendship and how it controls the world

[Mikey]
Hahaha
Alright, um
What three superpowers do you wish you had?
My bad, say it again

[Ryan]
Flying, contortion, to be invincible

[Mikey]
Alright, make sure you speak up (What's your name?)
Maybe we can get a little— a little bit, little bit, little bit

[Evan]
I wish I could sleep without, like, being dead
But forever at the same time

[Mikey]
Yo, what, what's, what's the year 3000 going to look like? (Dog, stop, stop, what you mean, bro? Stop, stop)

[Na'kel]
Or it could be great and shit can fly
And buildings would be very, very tall and everybody won't know what the ground looks like

[Frank]
That's fucked up
(Excuse me)

[Mikey]
Chloe, shh, okay, start over

[Na'kel]
Best thing about being me is
I got a nice set of friends, feel me?
A pretty clear mind, I feel like, sometimes
What's the worst thing about being me? Probably, uh–

[Sage]
Being Drake

[Na’kel]
I think a lot, a lot, too much
Sometimes I'm very musty

[Mikey]
Talents, got any secret talents?
[Na’kel]
I don't think so, I'm pretty open with all, everything that I do

[Frank]
Talents? Um, I can play the theremin

[Ryan]
Probably my brother, just to see how much work he has in one day

[Sage]
Probably, uh, probably Tyler, his life seems pretty awesome
No, actually, no, fuck him uh
I don't know
Probably Dill, 'cause he doesn't have to do anything at all
Just sits inside his house

[Mikey]
What's your name?

[Sage]
Sage Elsesser

[Mikey]
What do you do?

[Ryan]
I play soccer
And I go to school
Um, I wanna be better at skating

[Evan]
Probably jump off something really high
Super high and try to land in like a handstand or something

[Mikey]
Alright, that's it

[Ryan]
I don't know, there would be a lot of things I'll do
Probably spend a lot of time with my family

[Na’kel]
Spend a couple hours with my family and I would go out and do like everything that I ever thought about trying

[Ryan]
I don't know, there's a lot of things that you could do
That's it

[Mikey]
How far is a light-year? How far is a light-year?
(I'd say like a thousand years?)81Embed"
Frank Ocean,1985,Frank Ocean,/albums/164741,https://images.genius.com/ab6ea0cf9dc36b3630fed6008f40d08b.1000x1000x1.png,Blonde (Magazine Version) by Frank Ocean,164741,Blonde (Magazine Version),"August 20, 2016",https://genius.com/albums/Frank-ocean/Blonde-magazine-version,2842603,Frank Ocean (Ft. KOHH),Nikes (Magazine Version),6,/songs/2842603,Nikes (Magazine Version) by Frank Ocean (Ft. KOHH),https://images.genius.com/a45f6f2e35fe5078633b819dd3f18dc8.300x200x1.png,https://images.genius.com/a45f6f2e35fe5078633b819dd3f18dc8.1000x667x1.png,1507505,complete,/Frank-ocean-nikes-magazine-version-lyrics,3.0,https://images.genius.com/b20ee56925b1bd58ee592d683c5e9b4b.300x300x1.png,https://images.genius.com/b20ee56925b1bd58ee592d683c5e9b4b.1000x1000x1.png,Nikes (Magazine Version) (Ft. KOHH),https://genius.com/Frank-ocean-nikes-magazine-version-lyrics,"13 ContributorsNikes (Magazine Version) Lyrics[Verse 1: Frank Ocean]
These bitches want Nikes
They looking for a check
Tell 'em it ain't likely
Said she need a ring like Carmelo
You must be on that white like Othello
All you want is Nikes, but the real ones
Just like you, just like me
I don't play, I don't make time
But if you need dick, I got you
And I yam from the line
Pour up for A$AP, R.I.P. Pimp C
R.I.P. Trayvon, that nigga look just like me
Woo, fuckin' buzzin', woo
That my little cousin, he got a little trade
His girl keep the scales, a little mermaid
We out by the pool, some little mermaids
Me and them gel like twigs with them bangs
Now that's a real mermaid
You been holding your breath, weighted down
Punk madre, punk papá
He don't care for me, but he cares for me
And that's good enough
We don't talk much or nothin'
But when we talkin' 'bout somethin'
We have good discussion
I met his friends last week
Feels like they're up to somethin'
That's good for us
You might also like[Verse 2: Frank Ocean]
We'll let you guys prophesy
We'll let you guys prophesy
We gon' see the future first
We'll let you guys prophesy
We gon' see the future first
Living so the last night feels like a past life
Speaking of the don't know what got into people
Devil be possessin' homies
Demons try to body-jump
Why you think I'm in this bitch wearing a fucking yarmulke?
Acid on me like the rain
Weed crumbles into glitter
Rain, glitter
We laid out on this wet floor
Away turf, no Astro
Mesmerized how the strobes glow
Look at all the people feet dance
I know that your nigga came witcha
But he ain't witcha
We only human and it's humid in these Balmains
I mean my balls sticking to my jeans
We breathin' pheromones, Amber Rose
Sippin' pink-gold lemonades
Feelin'
[Bridge: Frank Ocean]
I may be younger, but I'll look after you
We're not in love, but I'll make love to you
When you're not here, I'll save some for you
I'm not him, but I'll mean something to you
I'll mean something to you
I'll mean something to you
You got a roommate, he'll hear what we do
It's only awkward if you're fucking him too

[Verse 3: KOHH]
一人の男
たくさんかわいい女の子
誰かのことを 誰も縛れはしない
他人の心
まあ、飲みたいならお酒でも飲もう（ふぉ）
彼女がいたり、彼氏がいたり
気の合っちゃう人間２人
しょうがない
男たちと 女たち
去るもの追わず
来るもの選ぶ
それだけの話
今しかない時間
大事にしな
何億万人も
いい人ならいるよ
あの子がまたモデルの子に嫉妬
でも好きなら好き
無理なら無理だし
次から次に （次に）
類が友を呼んでくれるいつも （類が友を呼ぶ）
たまには離れてみるのも必要 （必要, 必要）
自由にする まるでパリスヒルトン (パリスヒルトン)3Embed"
Frank Ocean,1985,Frank Ocean,/albums/164567,https://images.genius.com/8719184d150ded2afb853fcd75e1dd54.1000x1000x1.png,Boys Don't Cry (Magazine) by Frank Ocean,164567,Boys Don’t Cry (Magazine),"August 20, 2016",https://genius.com/albums/Frank-ocean/Boys-don-t-cry-magazine,2842128,Frank Ocean,Tumblr / Magazine Letter,18,/songs/2842128,Tumblr / Magazine Letter by Frank Ocean,https://images.genius.com/8c9b40d0ec909b97e52c8df9082b45fd.300x203x1.png,https://images.genius.com/8c9b40d0ec909b97e52c8df9082b45fd.1000x678x1.png,1091826,complete,/Frank-ocean-tumblr-magazine-letter-annotated,8.0,https://images.genius.com/8f581b62abe8a370cad5b87fc066d85a.300x300x1.png,https://images.genius.com/8f581b62abe8a370cad5b87fc066d85a.868x868x1.png,Tumblr / Magazine Letter,https://genius.com/Frank-ocean-tumblr-magazine-letter-annotated,"21 ContributorsTumblr / Magazine Letter LyricsTwo years ago I found an image of a kid with her hands covering her face. A seatbelt reached across her torso, riding up her neck and a mop of blonde hair stayed swept, for the moment, behind her ears. Her eyes seemed clear and calm but not blank, the road behind her seemed the same. I put myself in her seat then I played it all out in my head. The claustrophobia hits as the seatbelt tightens, preventing me from even leaning forward in my seat. the pressing on internal organs. I lean back and forward to release it. Then backwards and forward again. There it is—I got free. How much of my life has happened inside of a car? I wonder if the odds are that I'll die in one. Knock on wood-grain. Shouldn't speak like that. We live in cars in some cities, commuting across space either for our livelihood, or devouring fossil fuels for joy. It's close to as much time as we spend in our beds, more for some. The first time I did shrooms, my manager had to come rescue me from Caltech's 'Trip Day.' As I got into her car, I swear to God the aluminum center console in her Porsche truck looked like it was breathing, like the throat of something. On the freeway, leaving Pasadena, we spoke and I looked away, outside, at the wheels and tires of cars doing that optical illusion thing they do where it looks like they're spinning backwards, which, according to Google, happens because our brains are assuming something completely wrong and showing it to us. Staring, I was transfixed by all the indicator lights oscillating and throbbing against the wind. We drove thru downtown LA headed west, flying on the same freeways I used to run outta gas on. Welcomed in by the perennial creatures, imperial palm trees and climbing vines living their lives out just off the shoulder. The feeling familiar enhanced, on the 10. I used to ride around in my sinewy crossover SUV, smoke and listen to rough mixes of my old shit before it came out, or whatever someone wanted to play when they hooked up their iPhone to the aux cord. A few years and few daily-drivers later I'm not driving much anymore. It's been a year since I moved to London, at the time of writing this, and there's no practical reason to drive in this city. I ordered a GT3 RS and it'll keep low miles out here but I guess it's good to have in case of emergency :) Raf Simons once told me it was cliché, my whole car obsession. Maybe it links to a deep subconscious straight boy fantasy. Consciously though, I don't want straight—a little bent is good. I found it romantic, sometimes, editing this project. The whole time I felt as though I was in the presence of a $16m McLaren F1 armed with a disposable camera. My memories are in these pages, places closeby and long ass-numbing flights away. Cruising the suburbs of Tokyo in RWB Porsches. Throwing parties around England and mobbing freeways in four project M3s that I built with some friends. Going to Mississippi and playing in the mud with amphibious quads. Street-casting models at a random kung fu dojo out in Senegal. Commissioning life-size toy boxes for the fuck of it. Shooting a music video for fun with Tyrone Lebon, the genius giant. Taking a break/reconnaissance mission to Tulum, Mexico, enjoying some star visibility for a change. Recording in Tokyo, NYC, Miami, LA, London, Paris. Stopping in Berlin to witness Berghain for myself. Trading jewels and soaking in parables with the many-headed Brandon aka BasedGod in conversation. I wrote a story in the middle—It's called ""Godspeed."" It's basically a reimagined part of my boyhood. Boys do cry, but I don't think I shed a tear for a good chunk of my teenage years. It's surprisingly my favorite part of life so far. Surprising, to me, because the current phase is what I was asking the cosmos for when I was a kid. Maybe that part had its rough stretches too, but in my rearview mirror it's getting small enough to convince myself it was all good. And really though… It's still all good.

This is Boys Don't Cry & Blonde. First times. Worldwide.8Embed"
Frank Ocean,1985,Frank Ocean,/albums/164567,https://images.genius.com/8719184d150ded2afb853fcd75e1dd54.1000x1000x1.png,Boys Don't Cry (Magazine) by Frank Ocean,164567,Boys Don’t Cry (Magazine),"August 20, 2016",https://genius.com/albums/Frank-ocean/Boys-don-t-cry-magazine,10350878,Frank Ocean (Ft. Auntie Fee),Auntie Fee Interview,4,/songs/10350878,Auntie Fee Interview by Frank Ocean (Ft. Auntie Fee),https://images.genius.com/9b5226e7446cec78120c77f5f238af12.300x161x1.png,https://images.genius.com/9b5226e7446cec78120c77f5f238af12.1000x536x1.png,12233752,complete,/Frank-ocean-auntie-fee-interview-annotated,,https://images.genius.com/5c18da4e3839af1719b2268583091cd2.300x300x1.png,https://images.genius.com/5c18da4e3839af1719b2268583091cd2.1000x1000x1.png,Auntie Fee Interview (Ft. Auntie Fee),https://genius.com/Frank-ocean-auntie-fee-interview-annotated,"1 ContributorAuntie Fee Interview Lyrics???: When was the last time you saw Frank?

Auntie Fee: Let me tell you the last time I saw him. He always had a habit of running out of gas and he runs out of gas at 2:30 in the morning on the Santa Monica Freeway, OK? He calls about 10 people to come get him and nobody would come get him. He calls me at 2:30 in the morning. I say, 'Okay, not a problem.' I get up out of my bed, get my AAA, get him off the freeway, get him to the nearest gas station, put gas in his car and give him $20. I never seen him since. Except one time.

???: Do you have a computer?

Auntie Fee: Motherfucker, do I have a computer? What about ""Hello Auntie""? What the fuck is wrong with you!Embed"
Frank Ocean,1985,Frank Ocean,/albums/164567,https://images.genius.com/8719184d150ded2afb853fcd75e1dd54.1000x1000x1.png,Boys Don't Cry (Magazine) by Frank Ocean,164567,Boys Don’t Cry (Magazine),"August 20, 2016",https://genius.com/albums/Frank-ocean/Boys-don-t-cry-magazine,4202366,Tom Sachs,”Color”: A Comprehensive Color Guide Book,1,/songs/4202366,"""Color"": A Comprehensive Color Guide Book by Tom Sachs",https://images.genius.com/cc4e62f6f88087a3059bf37a52e51ab2.300x300x1.png,https://images.genius.com/cc4e62f6f88087a3059bf37a52e51ab2.640x640x1.png,4424691,complete,/Tom-sachs-color-a-comprehensive-color-guide-book-annotated,1.0,https://images.genius.com/cc4e62f6f88087a3059bf37a52e51ab2.300x300x1.png,https://images.genius.com/cc4e62f6f88087a3059bf37a52e51ab2.640x640x1.png,"""Color"": A Comprehensive Color Guide Book",https://genius.com/Tom-sachs-color-a-comprehensive-color-guide-book-annotated,"3 Contributors”Color”: A Comprehensive Color Guide Book LyricsIn the studio we adhere to a strict color code. Developed over decades, our color code consists of a finite and precise color palate. The color code is non-negotionable. We do not stray from the color code. The whole world as we experience it visually comes to us through the mystic realm of color.

Green.
In the studio, green is olive drab. OD 7 is our olive drab.

For OD 7, our preferred choice is Kyron Industrial Camouflage 8143 Olive Drab. Hove this has been discontinued.

The search continues.

Yellow.
McDonald's Yellow - Golden #1130-6 Series 7
Kodak Yellow - Golden #1147-6, Series 6

Red.
Impervex Latex Enamel High Gloss - Brillaint Red 309

White.
Flat Finish Acabado Liso Sin Brilo Decorators White N215 04

Alternatively: native whites i.e. 1989 Chevrolet Police Package White or Hunt Foamcore White. Chevrolet Caprice, Balaenoptera musculus,  ""Tom Sachs"", Fondazione Prada  Milan, Italy, 6 April -15 June 2006

Black.
Flat: Black N215 90 Flat Acrylic
Gloss: Black 30980

Orange.
Orange is a native color in the studio.
You will not find orange paint here.
Except for emergency situations.
Purple.
The color puple is a forbidden color. The color purple is forbidden in the studio. The color purple is punishable by death. There is never an excuse for the color purple.

Blue.
For all NASA meatball applications we use:
Benjamin Moore Imperevex Latex High Gloss Metal and Wood Enamel  Classic Navy 309 35.

Pantone color standards are generally avoided because their limited range discourages subtlety. While we admire Pantone’s packaging and judicious use of Helvetica, we resent choosing from their limited offerings. Secret societies conspire to keep us in the dark ages of color. Comitee mentally guarantees that shitty cars like Saturn are only available in teal and maroon.
In this studio, we shun decision by committee. Instead, we look to the superlative Porshe palate, which rains beautiful despite the company's Nazi heritage and douche bag clientele.

Tom Sachs and Van Neistat
NYC 2012

Gulf Porshe Blue

Counterfitter's holy grail
Nike color swatch book SP/SU 20121Embed"
