search_name,artist_id,artist_name,album_api_path,album_cover_art_url,album_full_title,album_id,album_name,album_release_date_for_display,album_url,song_id,song_artist_names,song_title,song_annotation_count,song_api_path,song_full_title,song_header_image_thumbnail_url,song_header_image_url,song_lyrics_owner_id,song_lyrics_state,song_path,song_pyongs_count,song_song_art_image_thumbnail_url,song_song_art_image_url,song_title_with_featured,song_url,lyrics
Luke Combs,330498,Luke Combs,/albums/898571,https://images.genius.com/2681291915e2cc8b963c61291d5e7225.600x600x1.jpg,Growin’ Up by Luke Combs,898571,Growin’ Up,"June 24, 2022",https://genius.com/albums/Luke-combs/Growin-up,8016777,Luke Combs,Middle of Somewhere,0,/songs/8016777,Middle of Somewhere by Luke Combs,https://images.genius.com/2681291915e2cc8b963c61291d5e7225.300x300x1.jpg,https://images.genius.com/2681291915e2cc8b963c61291d5e7225.600x600x1.jpg,498964,complete,/Luke-combs-middle-of-somewhere-lyrics,,https://images.genius.com/2681291915e2cc8b963c61291d5e7225.300x300x1.jpg,https://images.genius.com/2681291915e2cc8b963c61291d5e7225.600x600x1.jpg,Middle of Somewhere,https://genius.com/Luke-combs-middle-of-somewhere-lyrics,"3 ContributorsMiddle of Somewhere Lyrics[Verse 1]
There's just one kind of coffee at the Café
A couple kinds of beer at Amoco
Where hard work pays and Jesus saves
Weekends come and hell gets raised
Don't eat much, we can't hunt, fish or grow

[Chorus]
And we like life that way
Sweet and slow and simple
Ain't for much we pray
'Cause all we need's a little
So just remember when you're drivin' through nowhere
To us, that's the middle of somewhere

[Verse 2]
It may look like some empty off the interstate
Placе between where you'vе been and where you go
The folks 'round here, we call it home
From the cradle to the stone
We don't mind, it's all we've ever known

[Chorus]
And we like life that way
Sweet and slow and simple
Ain't for much we pray
'Cause all we need's a little
So just remember when you're drivin' through nowhere
To us that's the middle of somewhere
See Luke Combs LiveGet tickets as low as $40You might also like[Instrumental Break]

[Bridge]
I know it's just another drop in the ocean of map dots
But it means more than the world to us

[Chorus]
'Cause we like life that way
Sweet and slow and simple
It ain't for much we pray
'Cause all we need's a little
So just remember when you're drivin' through nowhere
So just remember when you're drivin' through nowhere
To us, that's the middle of somewhere

[Outro]
Out in the middle of somewhereEmbed"
Luke Combs,330498,Luke Combs,/albums/898571,https://images.genius.com/2681291915e2cc8b963c61291d5e7225.600x600x1.jpg,Growin’ Up by Luke Combs,898571,Growin’ Up,"June 24, 2022",https://genius.com/albums/Luke-combs/Growin-up,8016778,Luke Combs,"Going, Going, Gone",2,/songs/8016778,"Going, Going, Gone by Luke Combs",https://images.genius.com/322834a0e8725d3c65d150e200a25876.300x300x1.jpg,https://images.genius.com/322834a0e8725d3c65d150e200a25876.1000x1000x1.jpg,498964,complete,/Luke-combs-going-going-gone-lyrics,,https://images.genius.com/3fe974995db6f9ba76144d524ce37123.300x300x1.jpg,https://images.genius.com/3fe974995db6f9ba76144d524ce37123.344x344x1.jpg,"Going, Going, Gone",https://genius.com/Luke-combs-going-going-gone-lyrics,"8 ContributorsGoing, Going, Gone Lyrics[Verse 1]
Some things in life are meant to fly
And others, they were born to run
You can't tie them up and leave 'em
Like the changing of the seasons
Good things, they come and then they go

[Chorus]
Like a runaway Southbound train
Like an Arizona desert rain
Like lightning in the sky
Like fireworks in July
Like a left field home run ball
Like a whiskey shot at last call
It's like she was made for moving on
That girl is going, going, gone

[Verse 2]
I can say it wasn't meant to be
But maybe meant to be is misunderstood
I can't hold on to letting go
Change the way the river flows
Lovin' her's like roping in the wind

[Chorus]
Like a runaway Southbound train
Like an Arizona desert rain
Like lightning in the sky
Like fireworks in July
Like a left field homerun ball
Like a whiskey shot at last call
It's like she was made for moving on
That girl is going, going, gone
See Luke Combs LiveGet tickets as low as $40You might also like[Instrumental Break]

[Bridge]
She ain't got one bit of stick around
There's no sense in tryin' to slow her down

[Chorus]
Like a runaway Southbound train
Like an Arizona desert rain
Like lightning in the sky
Like fireworks in July
Like a left field homerun ball
Like a whiskey shot at last call
It's like she was made for moving on
That girl is going, going, gone

[Outro]
Going, going, gone
Going, going, goneEmbed"
Luke Combs,330498,Luke Combs,/albums/794533,https://images.genius.com/f9256c01b4e66bc80fe0bc4591545ea1.1000x1000x1.jpg,The Trilogy by Luke Combs,794533,The Trilogy,"July 5, 2021",https://genius.com/albums/Luke-combs/The-trilogy,3695544,Luke Combs,Beautiful Crazy,4,/songs/3695544,Beautiful Crazy by Luke Combs,https://images.genius.com/8e8e679f21dcc08be0203fcd5c4a8800.300x300x1.jpg,https://images.genius.com/8e8e679f21dcc08be0203fcd5c4a8800.898x899x1.jpg,5637607,complete,/Luke-combs-beautiful-crazy-lyrics,22.0,https://images.genius.com/f7b0567f5ba3cf2e3f85b12a1c74ebf7.300x300x1.jpg,https://images.genius.com/f7b0567f5ba3cf2e3f85b12a1c74ebf7.1000x1000x1.jpg,Beautiful Crazy,https://genius.com/Luke-combs-beautiful-crazy-lyrics,"27 ContributorsBeautiful Crazy Lyrics[Verse 1]
Her day starts with a coffee and ends with a wine
Takes forever getting ready so she's never on time for anything
When she gets that ""come get me"" look in her eyes
Well, it kinda scares me, the way that she drives me wild
When she drives me wild

[Chorus]
Beautiful, crazy, she can't help but amaze me
The way that she dances, ain't afraid to take chances
And wears her heart on her sleeve
Yeah, she's crazy but her crazy's beautiful to me

[Verse 2]
She makes plans for the weekend, can't wait to go out
Till she changes her mind
Says, ""Let's stay on the couch and watch TV""
And she falls asleep

[Chorus]
Beautiful, crazy, she can't help but amaze me
The way that she dances, ain't afraid to take chances
And wears her heart on her sleeve
Yeah, she's crazy but her crazy's beautiful to me

[Bridge]
She's unpredictable, unforgettable
It's unusual, unbelievable
How I'm such a fool, yeah, I'm such a fool for her
See Luke Combs LiveGet tickets as low as $40You might also like[Chorus]
Beautiful, crazy, she can't help but amaze me
The way that she dances, ain't afraid to take chances
And wears her heart on her sleeve
Yeah, she's crazy, she's crazy, she's crazy
But her crazy's beautiful to me
Her crazy's beautiful to me22Embed"
Luke Combs,330498,Luke Combs,/albums/794533,https://images.genius.com/f9256c01b4e66bc80fe0bc4591545ea1.1000x1000x1.jpg,The Trilogy by Luke Combs,794533,The Trilogy,"July 5, 2021",https://genius.com/albums/Luke-combs/The-trilogy,4677486,Luke Combs,Better Together,4,/songs/4677486,Better Together by Luke Combs,https://images.genius.com/82d0d698a892a5b3cf2aea79f42bf1e1.300x300x1.jpg,https://images.genius.com/82d0d698a892a5b3cf2aea79f42bf1e1.1000x1000x1.jpg,8141915,complete,/Luke-combs-better-together-lyrics,18.0,https://images.genius.com/1f41383a5cebbf4765860420902014ac.300x300x1.jpg,https://images.genius.com/1f41383a5cebbf4765860420902014ac.800x800x1.jpg,Better Together,https://genius.com/Luke-combs-better-together-lyrics,"20 ContributorsBetter Together Lyrics[Verse 1]
A 40 HP Johnson on a flat bottom metal boat
Coke cans and BB guns, barbed wire and old fence posts
8-point bucks in autumn and freshly cut cornfields
One arm out the window and one hand on the wheel

[Chorus]
Some things just go better together and probably always will
Like a cup of coffee and a sunrise, Sunday drives and time to kill
What's the point of this ol' guitar if it ain't got no strings?
Or pourin' your heart into a song that you ain't gonna sing?
It's a match made up in heaven, like good ol' boys and beer
And me, as long as you're right here

[Verse 2]
Your license in my wallet when we go out downtown
Your lipstick's stained every coffee cup that I got in this house
The way you say, ""I love you, too"" is like rain on an old tin roof
And your hand fits right into mine like a needle in a groove

[Chorus]
Some things just go better together and probably always will
Like a cup of coffee and a sunrise, Sunday drives and time to kill
What's the point of this ol' guitar if it ain't got no strings?
Or pourin' your heart into a song that you ain't gonna sing?
It's a match made up in heaven, like good ol' boys and beer
And me, as long as you're right here
See Luke Combs LiveGet tickets as low as $40You might also like[Bridge]
Sometimes we're oil and water
But I wouldn't have it any other way
And if I'm being honest
Your first and my last name

[Chorus]
Would just sound better together and probably always will
Like a cup of coffee and a sunrise, Sunday drives and time to kill
What's the point of this ol' guitar if it ain't got no strings?
Or pourin' your heart into a song that you ain't gonna sing?
It's a match made up in heaven, like good ol' boys and beer
And me, as long as you're right here
And me, as long as you're right here18Embed"
Luke Combs,330498,Luke Combs,/albums/794533,https://images.genius.com/f9256c01b4e66bc80fe0bc4591545ea1.1000x1000x1.jpg,The Trilogy by Luke Combs,794533,The Trilogy,"July 5, 2021",https://genius.com/albums/Luke-combs/The-trilogy,5921886,Luke Combs,Forever After All,9,/songs/5921886,Forever After All by Luke Combs,https://images.genius.com/9fc14a065f2bb6318b7993cf3df4c70d.300x300x1.png,https://images.genius.com/9fc14a065f2bb6318b7993cf3df4c70d.1000x1000x1.png,498964,complete,/Luke-combs-forever-after-all-lyrics,20.0,https://images.genius.com/e42fd08ccb70751a97405ef1617ca1ef.300x300x1.jpg,https://images.genius.com/e42fd08ccb70751a97405ef1617ca1ef.1000x1000x1.jpg,Forever After All,https://genius.com/Luke-combs-forever-after-all-lyrics,"31 ContributorsForever After All Lyrics[Verse 1]
A cold beer's got twelve ounces
A good truck's got maybe three hundred thousand
You only get so much until it's gone
Duracells in a Maglite
A needle drop on a forty-five
Are the kinda things that only last so long

[Pre-Chorus]
When the new wears off, and they get to gettin' old
Sooner or later, time's gonna take its toll

[Chorus]
They say nothing lasts forever
But they ain't seen us together
Or the way the moonlight dances in your eyes
Just a T-shirt in the kitchen
With no make-up and a million
Other things that I could look at my whole life
A love like that makes a man have second thoughts
Maybe some things last forever after all

[Verse 2]
The FM station on the outskirts
Blue jeans after years of shift work
All fadin' out like I always knew they would
The strings on this guitar
The first love lost on a young heart
Those things are gonna break after the getting's good
See Luke Combs LiveGet tickets as low as $40You might also like[Pre-Chorus]
'Cause the new wears off and they get to gettin' old
Yeah, sooner or later, time's gonna take its toll

[Chorus]
They say nothing lasts forever
But they ain't seen us together
Or the way the moonlight dances in your eyes
Just a T-shirt in the kitchen
With no make-up and a million
Other things that I could look at my whole life
A love like that makes a man have second thoughts
Maybe some things last forever after all

[Guitar Solo]

[Chorus]
They say nothing lasts forever
But they ain't seen us together
Or the way the moonlight dances in your eyes
And I know there'll be that moment
The good Lord calls one of us home and
One won't have the other by their side
But Heaven knows it, that won't last too long
Maybe some things last forever after all
[Outro]
After all20Embed"
Luke Combs,330498,Luke Combs,/albums/669024,https://images.genius.com/9fc14a065f2bb6318b7993cf3df4c70d.1000x1000x1.png,What You See Ain’t Always What You Get (Deluxe Edition) by Luke Combs,669024,What You See Ain’t Always What You Get (Deluxe Edition),"October 23, 2020",https://genius.com/albums/Luke-combs/What-you-see-aint-always-what-you-get-deluxe-edition,4123356,Luke Combs,Beer Never Broke My Heart,5,/songs/4123356,Beer Never Broke My Heart by Luke Combs,https://images.genius.com/152fee0e7acb0003e6ad14dfcf58b325.300x300x1.jpg,https://images.genius.com/152fee0e7acb0003e6ad14dfcf58b325.1000x1000x1.jpg,7459518,complete,/Luke-combs-beer-never-broke-my-heart-lyrics,1.0,https://images.genius.com/7a78baaaafbdc81a7fc2d29c7738f5d3.300x300x1.jpg,https://images.genius.com/7a78baaaafbdc81a7fc2d29c7738f5d3.500x500x1.jpg,Beer Never Broke My Heart,https://genius.com/Luke-combs-beer-never-broke-my-heart-lyrics,"18 ContributorsBeer Never Broke My Heart Lyrics[Verse 1]
I've had a largemouth bass bust my line
A couple beautiful girls tell me goodbye
Trucks break down, dogs run off
Politicians lie, been fired by the boss

[Pre-Chorus]
It takes one hand
To count the things I can count on
No, there ain't much, man
That ain't never let me down

[Chorus]
Longneck ice-cold beer never broke my heart
Like diamond rings and football teams have torn this boy apart
Like a neon dream, it just dawned on me that bars and this guitar
And longneck ice-cold beer never broke my heart

[Verse 2]
She was a Carolina blue jean baby
Fire in her eyes that drove me crazy
It was red taillights when she left town
If I didn't know then, I sure know now

[Chorus]
But longneck ice-cold beer never broke my heart
Like diamond rings and football teams have torn this boy apart
Like a neon dream, it just dawned on me that bars and this guitar
And longneck ice-cold beer never broke my heart, yeah
See Luke Combs LiveGet tickets as low as $40You might also like[Pre-Chorus]
Well, it takes one hand
To count the things I can count on
But I got one hand
That's grippin' down on a cold one

[Chorus]
'Cause longneck ice-cold beer never broke my heart
Like diamond rings and football teams have torn this boy apart
Like a neon dream, it just dawned on me, that bars, and this guitar
And longneck ice-cold beer never broke my heart, no
It never broke my heart1Embed"
Luke Combs,330498,Luke Combs,/albums/669024,https://images.genius.com/9fc14a065f2bb6318b7993cf3df4c70d.1000x1000x1.png,What You See Ain’t Always What You Get (Deluxe Edition) by Luke Combs,669024,What You See Ain’t Always What You Get (Deluxe Edition),"October 23, 2020",https://genius.com/albums/Luke-combs/What-you-see-aint-always-what-you-get-deluxe-edition,4571412,Luke Combs,Refrigerator Door,8,/songs/4571412,Refrigerator Door by Luke Combs,https://images.genius.com/4dad8ea1993f6d5a9b204dcd589103eb.300x300x1.jpg,https://images.genius.com/4dad8ea1993f6d5a9b204dcd589103eb.750x750x1.jpg,5289751,complete,/Luke-combs-refrigerator-door-lyrics,,https://images.genius.com/4dad8ea1993f6d5a9b204dcd589103eb.300x300x1.jpg,https://images.genius.com/4dad8ea1993f6d5a9b204dcd589103eb.750x750x1.jpg,Refrigerator Door,https://genius.com/Luke-combs-refrigerator-door-lyrics,"13 ContributorsRefrigerator Door Lyrics[Verse 1]
There's daddy on his John Deere, brand new in '96
Beside me and Bandit playing fetch when I was a kid
A Save the Date, best day of my best buddies life
Anybody else could walk on by, and not blink an eye

[Chorus]
'Cause they're just pictures hanging side by side
Forgotten memories from another time
Just the places that I've been before
Couple magnets, recipes, and Polaroids
Yeah, but that's my life on the 'frigerator door

[Verse 2]
My first day of kindergarten when I was 5 years old
A postcard that my cousin sent from Cancun, Mexico
A list of what Mama needs from the IGA today
Is just one small part of a work of art signed Kenmore in '98

[Chorus]
With all those pictures hanging side by side
Forgotten memories from another time
And all the places that I've been before
Couple magnets, recipes, and Polaroids
Yeah, but that's my life on the 'frigerator door
See Luke Combs LiveGet tickets as low as $40You might also like[Bridge]
As life flies by, it spills onto the side
Until it's covered top to bottom with the best days of your life

[Chorus]
And all those pictures hanging side by side
Forgotten memories from another time
And all the places that you've been before
Couple magnets, recipes, and Polaroids
Yeah, but that's our lives on the 'frigerator door
On the 'frigerator doorEmbed"
Luke Combs,330498,Luke Combs,/albums/669024,https://images.genius.com/9fc14a065f2bb6318b7993cf3df4c70d.1000x1000x1.png,What You See Ain’t Always What You Get (Deluxe Edition) by Luke Combs,669024,What You See Ain’t Always What You Get (Deluxe Edition),"October 23, 2020",https://genius.com/albums/Luke-combs/What-you-see-aint-always-what-you-get-deluxe-edition,4571413,Luke Combs,Even Though I’m Leaving,4,/songs/4571413,Even Though I’m Leaving by Luke Combs,https://images.genius.com/152fee0e7acb0003e6ad14dfcf58b325.300x300x1.jpg,https://images.genius.com/152fee0e7acb0003e6ad14dfcf58b325.1000x1000x1.jpg,3499648,complete,/Luke-combs-even-though-im-leaving-lyrics,12.0,https://images.genius.com/5141b3d2c9897d13ba45d410857ca7e3.300x300x1.jpg,https://images.genius.com/5141b3d2c9897d13ba45d410857ca7e3.900x900x1.jpg,Even Though I’m Leaving,https://genius.com/Luke-combs-even-though-im-leaving-lyrics,"16 ContributorsEven Though I’m Leaving Lyrics[Verse 1]
Daddy, I'm afraid, won't you stay a little while?
Keep me safe 'cause there's monsters right outside
Daddy, please don't go, I don't wanna be alone
'Cause the second that you're gone they're gonna know
Before he went to bed he grabbed my hand and said

[Chorus]
Just 'cause I'm leavin'
It don't mean that I won't be right by your side
When you need me
And you can't see me in the middle of the night
Just close your eyes and say a prayer
It's okay, I know you're scared when I'm not here
But I'll always be right there
Even though I'm leavin', I ain't goin' nowhere

[Verse 2]
Dad, we'll be late, and Uncle Sam don't like to wait
He's got a big old plane that's gonna take me far away
I know I act tough, but there's a churnin' in my gut
'Cause I just can't call you up when things get rough
Before I left, he hugged my neck and said

[Chorus]
Just 'cause you're leavin'
It don't mean that I won't be right by your side
When you need me
And you can't see me in the middle of the night
Just close your eyes and say a prayer
It's okay, I know you're scared I might be here
But I'll always be right there
Even though you're leavin', I ain't goin' nowhere
See Luke Combs LiveGet tickets as low as $40You might also like[Bridge]
Daddy, I'm afraid, won't you stay a little while?
I never thought I'd see the day I had to say goodbye
Daddy, please don't go, I can't do this on my own
There's no way that I can walk this road alone
Daddy grabbed my hand and said

[Chorus]
Just 'cause I'm leavin'
It don't mean that I won't be right by your side
When you need me
And you can't see me in the middle of the night
Just close your eyes and say a prayer
It's okay, boy, I ain't scared
I won't be here, but I'll always be right there
Even though I'm leavin', I ain't goin' nowhere
I ain't goin' nowhere12Embed"
Luke Combs,330498,Luke Combs,/albums/669024,https://images.genius.com/9fc14a065f2bb6318b7993cf3df4c70d.1000x1000x1.png,What You See Ain’t Always What You Get (Deluxe Edition) by Luke Combs,669024,What You See Ain’t Always What You Get (Deluxe Edition),"October 23, 2020",https://genius.com/albums/Luke-combs/What-you-see-aint-always-what-you-get-deluxe-edition,4571414,Luke Combs,Lovin’ on You,1,/songs/4571414,Lovin’ on You by Luke Combs,https://images.genius.com/a54019c932badae3c2e515365c157833.300x300x1.jpg,https://images.genius.com/a54019c932badae3c2e515365c157833.1000x1000x1.jpg,3499648,complete,/Luke-combs-lovin-on-you-lyrics,2.0,https://images.genius.com/4acf081e96e40cd85c0bbd47c9758f64.300x300x1.jpg,https://images.genius.com/4acf081e96e40cd85c0bbd47c9758f64.960x960x1.jpg,Lovin’ on You,https://genius.com/Luke-combs-lovin-on-you-lyrics,"12 ContributorsLovin’ on You Lyrics[Verse 1]
Don't get me wrong
I like a bobber on the water
Hookin' 'em and reelin' 'em in
I like a Friday night slow ride
Brooks & Dunn B-side
Hit rewind, spin it again
I like a strong shot of whiskey
The way a Marlboro hits me
Some broken in cowboy boots

[Chorus]
But I'm in love and lovin' on you
I feel that rush soon as you walk in a room
I can't get enough of you, honey
You're right on the money
I'm a junkie for your midnight moves
I'm in love and lovin' on you

[Verse 2]
I like a sunrise, duck blind
Birdie on a par 5
Miller Lite before noon
I like a two-door old Ford
Wood board back porch
Three chords and the truth
See Luke Combs LiveGet tickets as low as $40You might also like[Chorus]
But I'm in love and lovin' on you
I feel that rush soon as you walk in a room
I can't get enough of you, honey
You're right on the money
I'm a junkie for your midnight moves
I'm in love with lovin' on you

[Chorus]
Girl, I'm in love and lovin' on you
I feel that rush soon as you walk in a room
I can't get enough of you, honey
You're right on the money
I'm a junkie for your midnight moves
I'm in love and lovin' on you
I'm in love and lovin' on you2Embed"
Luke Combs,330498,Luke Combs,/albums/669024,https://images.genius.com/9fc14a065f2bb6318b7993cf3df4c70d.1000x1000x1.png,What You See Ain’t Always What You Get (Deluxe Edition) by Luke Combs,669024,What You See Ain’t Always What You Get (Deluxe Edition),"October 23, 2020",https://genius.com/albums/Luke-combs/What-you-see-aint-always-what-you-get-deluxe-edition,4571415,Luke Combs,Moon Over Mexico,1,/songs/4571415,Moon Over Mexico by Luke Combs,https://images.genius.com/4dad8ea1993f6d5a9b204dcd589103eb.300x300x1.jpg,https://images.genius.com/4dad8ea1993f6d5a9b204dcd589103eb.750x750x1.jpg,3499648,complete,/Luke-combs-moon-over-mexico-lyrics,,https://images.genius.com/4dad8ea1993f6d5a9b204dcd589103eb.300x300x1.jpg,https://images.genius.com/4dad8ea1993f6d5a9b204dcd589103eb.750x750x1.jpg,Moon Over Mexico,https://genius.com/Luke-combs-moon-over-mexico-lyrics,"11 ContributorsMoon Over Mexico Lyrics[Verse 1]
I can still see your blue sky blue eyes hangin' on a mango kiss
Hear the waves and the breeze and the Joshua trees
Was just about as good as it gets
Taste the salt on the rim, feel the sand on your skin
And the wild in the wind like I'm right there again

[Chorus]
Under a moon over Mexico
Holdin' onto you as the low tide rolls
Whatever that buzz was, I ain't felt it since
But I can't seem to let it go
And there was a shine in the dark, a flame from a spark
And a lime in a Pacifico
Under a moon over Mexico

[Verse 2]
The second I left I was kickin' myself
'Cause I knew I should've stayed
Still tequila love drunk, from us wakin' up
Under the Cabo palm leaf shade
And it's crazy I know, but I'd give anything to go
To you and me on that coast, in the midnight glow

[Chorus]
Of a moon over Mexico
Holdin' onto you as the low tide rolls
Whatever that buzz was, I ain't felt it since
But I can't seem to let it go
And there was a shine in the dark, a flame from a spark
And a lime in a Pacifico
Under a moon over Mexico
See Luke Combs LiveGet tickets as low as $40You might also like[Bridge]
Taste the salt on the rim, feel the sand on your skin
And the wild in the wind, like I'm right there again

[Chorus]
Under a moon over Mexico
Holdin' onto you as the low tide rolls
Whatever that buzz was, I ain't felt it since
But I can't seem to let it go
And there was a shine in the dark, a flame from a spark
And a lime in a Pacifico
Under a moon over Mexico
Under a moon over Mexico
Over MexicoEmbed"
