search_name,artist_id,artist_name,album_api_path,album_cover_art_url,album_full_title,album_id,album_name,album_release_date_for_display,album_url,song_id,song_artist_names,song_title,song_annotation_count,song_api_path,song_full_title,song_header_image_thumbnail_url,song_header_image_url,song_lyrics_owner_id,song_lyrics_state,song_path,song_pyongs_count,song_song_art_image_thumbnail_url,song_song_art_image_url,song_title_with_featured,song_url,lyrics
Luke Combs,330498,Luke Combs,/albums/426422,https://images.genius.com/6b7d950f76100acff7190c7e497ae1a4.600x600x1.jpg,This One's For You Too by Luke Combs,426422,This One’s For You Too,"June 1, 2018",https://genius.com/albums/Luke-combs/This-one-s-for-you-too,3082138,Luke Combs,Don’t Tempt Me,1,/songs/3082138,Don't Tempt Me by Luke Combs,https://images.genius.com/6abc96b5a3f1134c80f2d172a7214990.300x300x1.jpg,https://images.genius.com/6abc96b5a3f1134c80f2d172a7214990.1000x1000x1.jpg,73946,complete,/Luke-combs-dont-tempt-me-lyrics,,https://images.genius.com/6abc96b5a3f1134c80f2d172a7214990.300x300x1.jpg,https://images.genius.com/6abc96b5a3f1134c80f2d172a7214990.1000x1000x1.jpg,Don't Tempt Me,https://genius.com/Luke-combs-dont-tempt-me-lyrics,"7 ContributorsDon’t Tempt Me Lyrics[Verse 1]
I've been doing my best to make church on Sundays
And ain't been calling in hungover most Mondays
I guess you could say I'm being grown up
I got my shit together and oddly enough
I don't mind
'Cause it's about time
But if you second guessin', don't think for a second
That I can't hang

[Chorus]
'Cause I've been known to get a little bit of wild and reckless
Known to have a little bit of beer with breakfast
You can bet these boots have gotten pretty used to
Stomping on a hardwood floor
And buying the bar another round of shots
Close my tab and hit the parking lot
Next stop is a spot with a fridge stocked on the back porch
I ain't afraid to take too many steps out of line
So don't tempt me with a good time

[Verse 2]
Well most folks think I don't know how to throw down
They done forgot about rowdy
But no doubt he's still around
So keep cracking those jokes
'Cause I'm willing and able
Yeah, this old boy'll drink you under the table
See Luke Combs LiveGet tickets as low as $28You might also like[Chorus]
'Cause I've been known to get a little bit of wild and reckless
Known to have a little bit of beer with breakfast
You can bet these boots have gotten pretty used to
Stomping on a hardwood floor
And buying the bar another round of shots
Close my tab and hit the parking lot
Next stop is a spot with a fridge stocked on the back porch
I ain't afraid to take too many steps out of line
So don't tempt me with a good time

[Bridge]
At 3AM I'm still hanging tough
My buddy's passed out in the bed of my truck
And I can't wait 'til he wakes up
And sees the pictures on his phone

[Chorus]
'Cause I've been known to get a little bit of wild and reckless
Known to have a little bit of beer with breakfast
You can bet these boots have gotten pretty used to
Stomping on a hardwood floor
And buying the bar another round of shots
Close my tab and hit the parking lot
Next stop is a spot with a fridge stocked on the back porch
I ain't afraid to take too many steps out of line
So don't tempt me with a good time
With a good timeEmbed"
Luke Combs,330498,Luke Combs,/albums/426422,https://images.genius.com/6b7d950f76100acff7190c7e497ae1a4.600x600x1.jpg,This One's For You Too by Luke Combs,426422,This One’s For You Too,"June 1, 2018",https://genius.com/albums/Luke-combs/This-one-s-for-you-too,3082140,Luke Combs,When It Rains It Pours,6,/songs/3082140,When It Rains It Pours by Luke Combs,https://images.genius.com/6abc96b5a3f1134c80f2d172a7214990.300x300x1.jpg,https://images.genius.com/6abc96b5a3f1134c80f2d172a7214990.1000x1000x1.jpg,73946,complete,/Luke-combs-when-it-rains-it-pours-lyrics,6.0,https://images.genius.com/5bbbb73e0710317c10d63ffd5bd272af.300x300x1.jpg,https://images.genius.com/5bbbb73e0710317c10d63ffd5bd272af.1000x1000x1.jpg,When It Rains It Pours,https://genius.com/Luke-combs-when-it-rains-it-pours-lyrics,"26 ContributorsWhen It Rains It Pours Lyrics[Verse 1]
Sunday morning
Man, she woke up fightin' mad
Bitchin' and moanin' on and on
'Bout the time I had
And by Tuesday you could say
That girl was good as gone
Then when Thursday came around I was all alone
So I went for a drive to clear my mind
Ended up at a Shell on I-65

[Chorus 1]
Then I won a hundred bucks on a scratch-off ticket
I bought two 12-packs and a tank of gas with it
She swore they were a waste of time
Oh, but she was wrong
I was caller number five on a radio station
Won a four day, three night beach vacation
Deep sea señorita fishing down in Panama
And I ain't gotta see my
Ex-future-mother-in-law anymore
Oh Lord, when it rains it pours

[Verse 2]
Now she was sure real quick to up and apologize
When she heard about my newfound luck
On that FM dial
And it's crazy how lately now
It just seems to come in waves
What I thought was gonna be the death of me
Was my saving grace
It's got me thinking that her leaving
Is the only logical reason
See Luke Combs LiveGet tickets as low as $28You might also like[Chorus 2]
That I got the last spot in the Hooters' parking lot
And the waitress left her number on my check with a heart
She picked up on the first ring when I gave her a call
And I only spent five bucks at the Moose Club raffle
Won a used 4-wheeler and three free passes
For me and two of my buddies to play a round of golf
And I ain't gotta see my
Ex-future-mother-in-law anymore
Oh Lord, when it rains it pours
When it rains it pours

[Bridge]
Well I've been on one hell of a redneck roll
For three weeks now
And it all started on the day that she walked out

[Chorus 1]
Then I won a hundred bucks on a scratch-off ticket
Bought two 12-packs and a tank of gas with it
She swore they were a waste of time
Oh, but she was wrong
And I was caller number five on a radio station
Won a four day, three night beach vacation
Deep sea señorita fishing down in Panama
And I ain't gotta see my
Ex-future-mother-in-law anymore
Oh Lord, when it rains it pours
When it rains it pours6Embed"
Luke Combs,330498,Luke Combs,/albums/426422,https://images.genius.com/6b7d950f76100acff7190c7e497ae1a4.600x600x1.jpg,This One's For You Too by Luke Combs,426422,This One’s For You Too,"June 1, 2018",https://genius.com/albums/Luke-combs/This-one-s-for-you-too,3082130,Luke Combs,This One’s For You,0,/songs/3082130,This One's For You by Luke Combs,https://images.genius.com/68a069ea0072914fc6430b2b1de6d4f1.300x300x1.jpg,https://images.genius.com/68a069ea0072914fc6430b2b1de6d4f1.1000x1000x1.jpg,4007413,complete,/Luke-combs-this-ones-for-you-lyrics,1.0,https://images.genius.com/e1f60b4a2d2e48fcc3c449eae92f283b.300x300x1.jpg,https://images.genius.com/e1f60b4a2d2e48fcc3c449eae92f283b.1000x1000x1.jpg,This One's For You,https://genius.com/Luke-combs-this-ones-for-you-lyrics,"11 ContributorsThis One’s For You Lyrics[Verse 1]
There’s a couple people that I owe a beer or two
And three or four I owe more than a few
For all the times I couldn’t find the answers
Stumbling through the dark without a clue
This one’s for you

[Verse 2]
Mom and daddy always did their best
For a crazy fool who couldn’t help himself
I thank God they were there to see me through
This one’s for you

[Chorus]
I told you all I’d write you a song (Song, song, song)
Pour my heart in the melody
To keep you singing along (Singing along, singing along)
This might not be the right time
These might not be the right lines to prove
For sayin' what I’m tryin' to
But this one’s for you

[Verse 3]
I’ve been knocked down time and time again
Got picked back up by love and few good friends
Who reminded me of all I stood to lose
This one’s for you
See Luke Combs LiveGet tickets as low as $28You might also like[Chorus]
Yeah I told you all I’d write you a song (Song, song)
Pour my heart in the melody
To keep you singing along (Singing along, singing along)
This might not be the right time
These might not be the right lines to prove
For sayin' what I’m tryin' to
This one’s for you

(Oh, yee-eeah)
Uuu-uuu-uuu-uu-uu

[Bridge]
Made more than my fair share of the same mistakes
Bridges burned and lessons learned
A few things that I can’t change
Some apologies are way past overdue
So this one’s for you

[Chorus]
Wow, I told you all I’d write you a song (Song, song)
Pour my heart in the melody
To keep you singing along (Singing along, singing along)
This might not be the right time (Time, time)
And these might not be the right lines to prove (To prove)
For saying what I’m trying to
This one’s for you
[Outro]
There’s a couple people that I owe a beer or two
And three or four I owe more than a few1Embed"
Luke Combs,330498,Luke Combs,/albums/426422,https://images.genius.com/6b7d950f76100acff7190c7e497ae1a4.600x600x1.jpg,This One's For You Too by Luke Combs,426422,This One’s For You Too,"June 1, 2018",https://genius.com/albums/Luke-combs/This-one-s-for-you-too,3082149,Luke Combs,Be Careful What You Wish For,0,/songs/3082149,Be Careful What You Wish For by Luke Combs,https://images.genius.com/6abc96b5a3f1134c80f2d172a7214990.300x300x1.jpg,https://images.genius.com/6abc96b5a3f1134c80f2d172a7214990.1000x1000x1.jpg,1673162,complete,/Luke-combs-be-careful-what-you-wish-for-lyrics,1.0,https://images.genius.com/6abc96b5a3f1134c80f2d172a7214990.300x300x1.jpg,https://images.genius.com/6abc96b5a3f1134c80f2d172a7214990.1000x1000x1.jpg,Be Careful What You Wish For,https://genius.com/Luke-combs-be-careful-what-you-wish-for-lyrics,"7 ContributorsBe Careful What You Wish For Lyrics[Verse 1]
Couldn't wait to ride out of that one horse town
Didn't see no use in sticking around
I was green and busting at the seams to leave
I was sitting on G, waiting on O
The day I hit eighteen, I hit the road
Traded that county maintain for a four lane city street

[Pre-Chorus]
But sometimes things ain't what you think they're gonna be
What you want ain't always what you need

[Chorus]
Don't know what you got 'til it's gone
And you're out on your own
All you want is what you can't get back
Once you let it go, then you know what you have
Don't hold a candle to what you had
Sometimes what you think you'll find
It ain't quite what real life has in store
So be careful what you wish for

[Verse 2]
She was holding on just a little too tight
Talked a little too much about the rest of our lives
I broke her heart thinking freedom would set me free
Well sometimes things ain't what you think they're gonna be
See Luke Combs LiveGet tickets as low as $28You might also like[Chorus]
Don't know what you got 'til it's gone
And you're out on your own
All you want is what you can't get back
Once you let it go, then you know what you have
Don't hold a candle to what you had
Sometimes what you think you'll find
It ain't quite what real life has in store
So be careful what you wish for

[Bridge]
'Cause these city lights can't shine quite like the stars
I wish I could wish her back into my arms

[Chorus]
Don't know what you got 'til it's gone
And you're out on your own
All you want is what you can't get back
Once you let it go, then you know what you have
Don't hold a candle to what you had
Sometimes what you think you'll find
It ain't quite what real life has in store
And you can't get her back no more
So be careful what you wish for
Be careful what you wish for1Embed"
Luke Combs,330498,Luke Combs,/albums/426422,https://images.genius.com/6b7d950f76100acff7190c7e497ae1a4.600x600x1.jpg,This One's For You Too by Luke Combs,426422,This One’s For You Too,"June 1, 2018",https://genius.com/albums/Luke-combs/This-one-s-for-you-too,3082159,Luke Combs,I Got Away with You,0,/songs/3082159,I Got Away with You by Luke Combs,https://images.genius.com/6abc96b5a3f1134c80f2d172a7214990.300x300x1.jpg,https://images.genius.com/6abc96b5a3f1134c80f2d172a7214990.1000x1000x1.jpg,4007413,complete,/Luke-combs-i-got-away-with-you-lyrics,1.0,https://images.genius.com/6abc96b5a3f1134c80f2d172a7214990.300x300x1.jpg,https://images.genius.com/6abc96b5a3f1134c80f2d172a7214990.1000x1000x1.jpg,I Got Away with You,https://genius.com/Luke-combs-i-got-away-with-you-lyrics,"7 ContributorsI Got Away with You Lyrics[Verse 1]
Well I got caught in Panama City
Tryin' to buy some beer for some Georgia girls
And I got wore out by my daddy
For stealin' cigarettes from the Smokes and More
And all my friends would get away
Seems I'd get caught, plain as day
I took the blame for every little thing

[Chorus]
But I got away with you
And somehow l still ain't been found out
It's a crazy truth
Like l strolled out the gates of Alcatraz
And l walked in the Louvre
Now the Mona Lisa's hanging in my house
I bust out of Buckingham with the crown jewels
And l got away with you

[Verse 2]
Well lookin' like you do
On its damn own, should be a crime
Let alone a fool like me
Hand in hand with you, should be doin' time
But here we are runnin' free
Guess someone turned the other cheek
'Cause there ain't no blue lights in the rear view
See Luke Combs LiveGet tickets as low as $28You might also like[Chorus]
Guess I got away with you
And somehow l still ain't been found out
It's a crazy truth
Like l strolled out the gates of Alcatraz
And l walked in the Louvre
Now the Mona Lisa's hanging in my house
I bust out of Buckingham with the crown jewels
And l got away with you

[Bridge]
I'll take it all, the fails, the falls
The county jails and one phone calls
I'd do it all again if I had to

[Chorus]
'Cause I got away with you
Somehow girl, I still ain't been found out
It's a crazy truth
Like l strolled out the gates of Alcatraz
And l walked in the Louvre
Now the Mona Lisa's hanging in my house
I bust out of Buckingham with the crown jewels
And l got away with you
When l got away with you
Yeah, I got away with you1Embed"
Luke Combs,330498,Luke Combs,/albums/426422,https://images.genius.com/6b7d950f76100acff7190c7e497ae1a4.600x600x1.jpg,This One's For You Too by Luke Combs,426422,This One’s For You Too,"June 1, 2018",https://genius.com/albums/Luke-combs/This-one-s-for-you-too,3082168,Luke Combs,Honky Tonk Highway,0,/songs/3082168,Honky Tonk Highway by Luke Combs,https://images.genius.com/6abc96b5a3f1134c80f2d172a7214990.300x300x1.jpg,https://images.genius.com/6abc96b5a3f1134c80f2d172a7214990.1000x1000x1.jpg,5319686,complete,/Luke-combs-honky-tonk-highway-lyrics,,https://images.genius.com/6abc96b5a3f1134c80f2d172a7214990.300x300x1.jpg,https://images.genius.com/6abc96b5a3f1134c80f2d172a7214990.1000x1000x1.jpg,Honky Tonk Highway,https://genius.com/Luke-combs-honky-tonk-highway-lyrics,"9 ContributorsHonky Tonk Highway Lyrics[Verse 1]
Midnight Prevost heading down to Alabam' (Alabam')
I got a three-night run, we’re gonna kick it off in Birmingham
Headlights, wide lines, flying down 65
Trying to catch a few hours’ sleep
Tomorrow comes showtime, that’s when I know I’m
Livin' that neon dream

[Chorus]
Oh, I got the bus and the band and a one-night stand
Waiting on us down the road we’re gonna
Load it in, crank it to ten, whiskey shots till 2am
And off to another show and then it’s
Back to my baby for a couple days
But I can only stay for so long
'Til that honky-tonk highway’s calling me home

[Verse 2]
Rolling into Mobile, name on the marquee sign
Waving at the women that are standing in the ticket line
Point me to the stage I know that’s the only place I’m ever
Smoky bars, guitars, breaking all the girls’ hearts
That’s the only life for me

[Chorus]
Oh, I got the bus and the band and a one-night stand
Waiting on us down the road we’re gonna
Load it in, crank it to ten, whiskey shots till 2am
And off to another show and then it’s
Back to my baby for a couple days
But I can only stay for so long
'Til that honky-tonk highway’s calling me home
See Luke Combs LiveGet tickets as low as $28You might also like[Instrumental]

[Chorus]
Oh, I got the bus and the band and a one-night stand
Waiting on us down the road we’re gonna
Load it in, crank it to ten, whiskey shots till 2am
And off to another show and then it’s
Back to my baby for a couple days
But I can only stay for so long
'Til that honky-tonk highway’s calling me home
'Til that honky-tonk highway’s calling me homeEmbed"
Luke Combs,330498,Luke Combs,/albums/426422,https://images.genius.com/6b7d950f76100acff7190c7e497ae1a4.600x600x1.jpg,This One's For You Too by Luke Combs,426422,This One’s For You Too,"June 1, 2018",https://genius.com/albums/Luke-combs/This-one-s-for-you-too,3698221,Luke Combs,"Houston, We Got a Problem",7,/songs/3698221,"Houston, We Got a Problem by Luke Combs",https://images.genius.com/6b7d950f76100acff7190c7e497ae1a4.300x300x1.jpg,https://images.genius.com/6b7d950f76100acff7190c7e497ae1a4.600x600x1.jpg,1548623,complete,/Luke-combs-houston-we-got-a-problem-lyrics,4.0,https://images.genius.com/6b7d950f76100acff7190c7e497ae1a4.300x300x1.jpg,https://images.genius.com/6b7d950f76100acff7190c7e497ae1a4.600x600x1.jpg,"Houston, We Got a Problem",https://genius.com/Luke-combs-houston-we-got-a-problem-lyrics,"13 ContributorsHouston, We Got a Problem Lyrics[Verse 1]
This is my kinda town
This is my kinda place
I wouldn't mind hangin' 'round
For more than just a couple days
I got a 12th floor room
With a killer view
Of the empty Astrodome
Got a tab at the bar downstairs
But all I can think about is home

[Chorus]
I got my new boots covered in red dirt
A ""Don't Mess With Texas"" t-shirt
And a Lonestar postcard postmarked with ""Missin' you""
It's got the biggest sky you've ever seen
The coldest beer you'd ever drink
But I still feel like I landed on the moon
'Cause it ain't got you
Houston, we got a problem

[Verse 2]
You should've seen 19th Street
You should've seen a midnight rodeo
The way them saloon doors swing
When they line dance to ""Copperhead Road""
Something 'bout the air down here
That'll make you feel
The way all them cowboys do
I wish I was an outlaw
But all I can think about is you
See Luke Combs LiveGet tickets as low as $28You might also like[Chorus]
I got my new boots covered in red dirt
A ""Don't Mess With Texas"" t-shirt
And a Lonestar postcard postmarked with ""Missin' you""
It's got the biggest sky you've ever seen
The coldest beer you'd ever drink
But I still feel like I landed on the moon
'Cause it ain't got you
Houston, we got a problem

[Instrumental Break]

[Chorus/Outro]
It's got the biggest sky you've ever seen
The coldest beer you'd ever drink
But I still feel like I landed on the moon
'Cause it ain't got you
Houston, we got a problem
Houston, we got a problem
Houston, we got a problem4Embed"
Luke Combs,330498,Luke Combs,/albums/426422,https://images.genius.com/6b7d950f76100acff7190c7e497ae1a4.600x600x1.jpg,This One's For You Too by Luke Combs,426422,This One’s For You Too,"June 1, 2018",https://genius.com/albums/Luke-combs/This-one-s-for-you-too,3698222,Luke Combs,Must’ve Never Met You,0,/songs/3698222,Must've Never Met You by Luke Combs,https://images.genius.com/6b7d950f76100acff7190c7e497ae1a4.300x300x1.jpg,https://images.genius.com/6b7d950f76100acff7190c7e497ae1a4.600x600x1.jpg,1548623,complete,/Luke-combs-mustve-never-met-you-lyrics,5.0,https://images.genius.com/6b7d950f76100acff7190c7e497ae1a4.300x300x1.jpg,https://images.genius.com/6b7d950f76100acff7190c7e497ae1a4.600x600x1.jpg,Must've Never Met You,https://genius.com/Luke-combs-mustve-never-met-you-lyrics,"12 ContributorsMust’ve Never Met You Lyrics[Verse 1]
Just pick yourself up, dust yourself off, they say it ain't that hard
But just puttin' one foot in front of the other ain't gettin' me too far
This movin' on ain't comin' along the way they said it would

[Chorus]
I guess whoever said ""the grass is greener"" must've never seen the other side
And ""what don't kill you makes you stronger"" sure sounds like a lie
And whoever said that ""time heals everything and everything will be alright""
Whoever said ""it ain't the end of the world and you'll find somebody new”
Must've never met you

[Verse 2]
Must've never heard you say you'd never leave me then watch you walk away
Must've never fell as hard as I did 'cause then they wouldn't say
""Maybe it wasn't meant to be, yeah maybe you're better off alone""

[Chorus]
I guess whoever said ""the grass is greener"" must've never seen the other side
And ""what don't kill you makes you stronger"" sure sounds like a lie
And whoever said that ""time heals everything and everything will be alright""
Whoever said ""it ain't the end of the world and you'll find somebody new""
Must've never met you
Must've never met you

[Bridge]
""Maybe it wasn't meant to be, yeah maybe you're better off alone""
See Luke Combs LiveGet tickets as low as $28You might also like[Chorus]
Whoever said ""the grass is greener""
Must've never seen the other side
""What don't kill you makes you stronger""
Still sounds like a lie
And whoever said that ""time heals everything and everything will be alright""
Whoever said ""it ain't the end of the world, you know she ain't the only girl""
""You win, you lose, you find somebody new""
Must've never met you
Oh, must've never met you
Hey, must've never met you5Embed"
Luke Combs,330498,Luke Combs,/albums/426422,https://images.genius.com/6b7d950f76100acff7190c7e497ae1a4.600x600x1.jpg,This One's For You Too by Luke Combs,426422,This One’s For You Too,"June 1, 2018",https://genius.com/albums/Luke-combs/This-one-s-for-you-too,3695544,Luke Combs,Beautiful Crazy,4,/songs/3695544,Beautiful Crazy by Luke Combs,https://images.genius.com/8e8e679f21dcc08be0203fcd5c4a8800.300x300x1.jpg,https://images.genius.com/8e8e679f21dcc08be0203fcd5c4a8800.898x899x1.jpg,5637607,complete,/Luke-combs-beautiful-crazy-lyrics,22.0,https://images.genius.com/f7b0567f5ba3cf2e3f85b12a1c74ebf7.300x300x1.jpg,https://images.genius.com/f7b0567f5ba3cf2e3f85b12a1c74ebf7.1000x1000x1.jpg,Beautiful Crazy,https://genius.com/Luke-combs-beautiful-crazy-lyrics,"27 ContributorsBeautiful Crazy Lyrics[Verse 1]
Her day starts with a coffee and ends with a wine
Takes forever getting ready so she's never on time for anything
When she gets that ""come get me"" look in her eyes
Well, it kinda scares me, the way that she drives me wild
When she drives me wild

[Chorus]
Beautiful, crazy, she can't help but amaze me
The way that she dances, ain't afraid to take chances
And wears her heart on her sleeve
Yeah, she's crazy but her crazy's beautiful to me

[Verse 2]
She makes plans for the weekend, can't wait to go out
Till she changes her mind
Says, ""Let's stay on the couch and watch TV""
And she falls asleep

[Chorus]
Beautiful, crazy, she can't help but amaze me
The way that she dances, ain't afraid to take chances
And wears her heart on her sleeve
Yeah, she's crazy but her crazy's beautiful to me

[Bridge]
She's unpredictable, unforgettable
It's unusual, unbelievable
How I'm such a fool, yeah, I'm such a fool for her
See Luke Combs LiveGet tickets as low as $40You might also like[Chorus]
Beautiful, crazy, she can't help but amaze me
The way that she dances, ain't afraid to take chances
And wears her heart on her sleeve
Yeah, she's crazy, she's crazy, she's crazy
But her crazy's beautiful to me
Her crazy's beautiful to me22Embed"
Luke Combs,330498,Luke Combs,/albums/426422,https://images.genius.com/6b7d950f76100acff7190c7e497ae1a4.600x600x1.jpg,This One's For You Too by Luke Combs,426422,This One’s For You Too,"June 1, 2018",https://genius.com/albums/Luke-combs/This-one-s-for-you-too,3698223,Luke Combs,A Long Way,0,/songs/3698223,A Long Way by Luke Combs,https://images.genius.com/6b7d950f76100acff7190c7e497ae1a4.300x300x1.jpg,https://images.genius.com/6b7d950f76100acff7190c7e497ae1a4.600x600x1.jpg,1548623,complete,/Luke-combs-a-long-way-lyrics,,https://images.genius.com/6b7d950f76100acff7190c7e497ae1a4.300x300x1.jpg,https://images.genius.com/6b7d950f76100acff7190c7e497ae1a4.600x600x1.jpg,A Long Way,https://genius.com/Luke-combs-a-long-way-lyrics,"10 ContributorsA Long Way Lyrics[Verse 1]
Six beers and five guys and if I remember right, it was a
Wednesday when we got our buzz on for second hand six pack
Half smoked soft pack, light it up boys, take a drag
And when I fought that cough off everyone else thought I was so damn cool

[Pre-Chorus]
But my head was spinnin' like a Tilt-A-Whirl
Yeah man, it really rocked my world

[Chorus]
Back when everything seemed just a little bit stronger
Back when the weekend lasted a little longer
I can't tell you why they did, but things seemed to never end back then
Oh way back when, when a little went a long way

[Verse 2]
One girl, 45 bucks was all it took that night
Hit the steakhouse makeout and the movies way up in the back
Credits roll on pace,to make it all the way to second base
Tried to play it cool like it was nothin' new and she didn't have a clue

[Pre-Chorus]
But my head was spinnin' like a Tilt-A-Whirl
Yeah man, she really rocked my world
See Luke Combs LiveGet tickets as low as $28You might also like[Chorus]
Back when things seemed just a little bit stronger
Back when the weekend lasted a little longer
I can't tell you why they did, things seemed to never end back then
Oh way back when, when a little went a long way

[Chorus]
Back when everything seemed just a little bit stronger
Back when the weekend lasted a little longer
I can't tell you why they did, but things seemed to never end back then
Oh way back when, when a little went a long long way
A long wayEmbed"
