search_name,artist_id,artist_name,album_api_path,album_cover_art_url,album_full_title,album_id,album_name,album_release_date_for_display,album_url,song_id,song_artist_names,song_title,song_annotation_count,song_api_path,song_full_title,song_header_image_thumbnail_url,song_header_image_url,song_lyrics_owner_id,song_lyrics_state,song_path,song_pyongs_count,song_song_art_image_thumbnail_url,song_song_art_image_url,song_title_with_featured,song_url,lyrics
Luke Combs,330498,Luke Combs,/albums/584309,https://images.genius.com/90f0f5ae2951aed5677e042d8933887c.1000x1000x1.jpg,Luke Combs: The Writer's Cut by Luke Combs,584309,Luke Combs: The Writer’s Cut,"December 6, 2019",https://genius.com/albums/Luke-combs/Luke-combs-the-writer-s-cut,5079784,Luke Combs & Brooks & Dunn,"1, 2 Many (The Writer’s Cut)",0,/songs/5079784,"1, 2 Many (The Writer's Cut) by Luke Combs & Brooks & Dunn",https://images.genius.com/90f0f5ae2951aed5677e042d8933887c.300x300x1.jpg,https://images.genius.com/90f0f5ae2951aed5677e042d8933887c.1000x1000x1.jpg,54639,complete,/Luke-combs-and-brooks-and-dunn-1-2-many-the-writers-cut-lyrics,1.0,https://images.genius.com/90f0f5ae2951aed5677e042d8933887c.300x300x1.jpg,https://images.genius.com/90f0f5ae2951aed5677e042d8933887c.1000x1000x1.jpg,"1, 2 Many (The Writer's Cut)",https://genius.com/Luke-combs-and-brooks-and-dunn-1-2-many-the-writers-cut-lyrics,"1 Contributor1, 2 Many (The Writer’s Cut) Lyrics[Verse 1: Luke Combs]
Well, I got a call from Rowdy 'round six o'clock
Sayin' he caught a hankerin' for a honky tonk
Wants an ice cold beer and a country song
But he didn't want to stay out all night long
Well, I ain't the kind to let a buddy drink alone
But I can't turn it off once I turn it on

[Chorus: Luke Combs]
There's no stoppin' me once I get goin'
Put a can in my hand, man, I'm wide ass open
The tick-tock of that clock is like a time bomb
By half past ten, I'm half past tipsy
At quarter to twelve, man, I done had plenty
The countdown's on when the first beer hits me
Five, four, three, two, one, too many

[Verse 2: Luke Combs]
After five diet Millers, I was feelin' loose
Singin' karaoke to a TL tune
When a pretty little thing shot me a wink
She said, ""Hey, cowboy, could you buy us a drink?""
Well, hey, baby doll, I will if you want
But I can't turn it off once I turn it on

[Chorus: Luke Combs]
There's no stoppin' me once I get goin'
Put a can in my hand, man, I'm wide ass open
The tick-tock of that clock is like a time bomb
By half past ten, I'm half past tipsy
At quarter to twelve, man, I done had plenty
The countdown's on when the first beer hits me
Five, four, three, two, one, too many
You might also like[Bridge: Luke Combs]
C'mon
Now I've never been the kind to quit
Won't stop 'til I get to the bottom of this
And the night's still young
So what ya say we shotgun one?

[Chorus: Luke Combs]
There's no stoppin' me once I get to goin'
Put a can in my hand, man, I'm wide ass open
The tick-tock of that clock is like a time bomb
By half past ten, I'm half past tipsy
At quarter to twelve, man, I done had plenty
The countdown's on when the first beer hits me
Five, four, three, two, one, too many

[Outro]
Tell 'em, Drew
Five, four, three, two, one, too many
Yes, sir1Embed"
Luke Combs,330498,Luke Combs,/albums/584309,https://images.genius.com/90f0f5ae2951aed5677e042d8933887c.1000x1000x1.jpg,Luke Combs: The Writer's Cut by Luke Combs,584309,Luke Combs: The Writer’s Cut,"December 6, 2019",https://genius.com/albums/Luke-combs/Luke-combs-the-writer-s-cut,5079785,Luke Combs,Reasons (The Writer’s Cut),0,/songs/5079785,Reasons (The Writer's Cut) by Luke Combs,https://images.genius.com/90f0f5ae2951aed5677e042d8933887c.300x300x1.jpg,https://images.genius.com/90f0f5ae2951aed5677e042d8933887c.1000x1000x1.jpg,54639,complete,/Luke-combs-reasons-the-writers-cut-lyrics,,https://images.genius.com/90f0f5ae2951aed5677e042d8933887c.300x300x1.jpg,https://images.genius.com/90f0f5ae2951aed5677e042d8933887c.1000x1000x1.jpg,Reasons (The Writer's Cut),https://genius.com/Luke-combs-reasons-the-writers-cut-lyrics,"2 ContributorsReasons (The Writer’s Cut) Lyrics[Verse 1]
I don't know why you can't buy wine 'round here on Sundays
Or an ice cold beer at a college football game
I don't know why at eighteen, mama gave me a curfew
But it was, ""Son, you're under my roof, then you're under my rules""

[Pre-Chorus]
I guess it's all a part of a bigger plan
And some of them, I'll never understand

[Chorus]
But they got their reasons, just like you
When you walked out of my life when you didn't have to
You sent me reelin', there's nothin' I can do
About you takin' my heart and breakin' it right in two
So if you see me soakin' in these thoughts I'm thinkin'
Drownin' in some barroom, off the deep end
I got my reasons

[Verse 2]
I don't know why them uptown guys sittin' three seats from me
Are raisin' 'em up just as fast as they can put 'em down
Or why that old timer wants the Yankees on the TV
And the barkeep keeps buyin' that one girl free rounds

[Chorus]
But they got their reasons, just like you
When you walked out of my life when you didn't have to
You sent me reelin', there's nothin' I can do
About you takin' my heart and breakin' it right in two
So if you see me soakin' in these thoughts I'm thinkin'
Drownin' in some barroom, off the deep end
I got my reasons
See Luke Combs LiveGet tickets as low as $28You might also like[Bridge]
Some are good and some are bad
Some are true and some are sad
Everyone's got some, but I need one that brings you back

[Chorus]
'Cause they got their reasons, just like you
When you walked out of my life when you didn't have to
You sent me reelin', there's nothin' I can do
About you takin' my heart and breakin' it right in two
So if you see me soakin' in these thoughts I'm thinkin'
Drownin' in some barroom, off the deep end
I got my reasons

[Outro]
Woah, I got my reasons
Woah, I got my reasons
I got my reasonsEmbed"
Luke Combs,330498,Luke Combs,/albums/584309,https://images.genius.com/90f0f5ae2951aed5677e042d8933887c.1000x1000x1.jpg,Luke Combs: The Writer's Cut by Luke Combs,584309,Luke Combs: The Writer’s Cut,"December 6, 2019",https://genius.com/albums/Luke-combs/Luke-combs-the-writer-s-cut,5079786,Luke Combs,Greystone Chapel,0,/songs/5079786,Greystone Chapel by Luke Combs,https://images.genius.com/90f0f5ae2951aed5677e042d8933887c.300x300x1.jpg,https://images.genius.com/90f0f5ae2951aed5677e042d8933887c.1000x1000x1.jpg,54639,complete,/Luke-combs-greystone-chapel-lyrics,,https://images.genius.com/90f0f5ae2951aed5677e042d8933887c.300x300x1.jpg,https://images.genius.com/90f0f5ae2951aed5677e042d8933887c.1000x1000x1.jpg,Greystone Chapel,https://genius.com/Luke-combs-greystone-chapel-lyrics,"3 ContributorsGreystone Chapel Lyrics[Chorus]
Inside the walls of prison, my body may be
But the Lord has set my soul free

[Verse 1]
There's a greystone chapel here at Folsom
A house of worship in this den of sin
You wouldn’t think that God had a place here at Folsom
But he saved the souls of many lost men
Now, there's a greystone chapel here at Folsom
Stands a hundred years tall, made of granite rock
It takes a ring of keys to move here at Folsom
But the door to the house of God is never locked

[Chorus]
Inside the walls of prison, my body may be
But the Lord has set my soul free
But my Lord has set my soul free

[Verse 2]
There are men here that don't ever worship
There are men here who scoff at the ones who pray
But I’ve got down on my knees in that greystone chapel
And I thanked the Lord for helping me each day
Now, there's a greystone chapel here at Folsom
It has a touch of God's hand on every stone
It's a flower of light in a field of darkness
And it's given me the strength to carry on
See Luke Combs LiveGet tickets as low as $28You might also like[Chorus]
Inside the walls of prison, my body may be
But the Lord has set my soul free
But my Lord has set my soul freeEmbed"
Luke Combs,330498,Luke Combs,/albums/562077,https://images.genius.com/9e7bee6dd2c61922dfa1b70460ea60ff.1000x1000x1.jpg,What You See Is What You Get by Luke Combs,562077,What You See Is What You Get,"November 8, 2019",https://genius.com/albums/Luke-combs/What-you-see-is-what-you-get,4123356,Luke Combs,Beer Never Broke My Heart,5,/songs/4123356,Beer Never Broke My Heart by Luke Combs,https://images.genius.com/152fee0e7acb0003e6ad14dfcf58b325.300x300x1.jpg,https://images.genius.com/152fee0e7acb0003e6ad14dfcf58b325.1000x1000x1.jpg,7459518,complete,/Luke-combs-beer-never-broke-my-heart-lyrics,1.0,https://images.genius.com/7a78baaaafbdc81a7fc2d29c7738f5d3.300x300x1.jpg,https://images.genius.com/7a78baaaafbdc81a7fc2d29c7738f5d3.500x500x1.jpg,Beer Never Broke My Heart,https://genius.com/Luke-combs-beer-never-broke-my-heart-lyrics,"18 ContributorsBeer Never Broke My Heart Lyrics[Verse 1]
I've had a largemouth bass bust my line
A couple beautiful girls tell me goodbye
Trucks break down, dogs run off
Politicians lie, been fired by the boss

[Pre-Chorus]
It takes one hand
To count the things I can count on
No, there ain't much, man
That ain't never let me down

[Chorus]
Longneck ice-cold beer never broke my heart
Like diamond rings and football teams have torn this boy apart
Like a neon dream, it just dawned on me that bars and this guitar
And longneck ice-cold beer never broke my heart

[Verse 2]
She was a Carolina blue jean baby
Fire in her eyes that drove me crazy
It was red taillights when she left town
If I didn't know then, I sure know now

[Chorus]
But longneck ice-cold beer never broke my heart
Like diamond rings and football teams have torn this boy apart
Like a neon dream, it just dawned on me that bars and this guitar
And longneck ice-cold beer never broke my heart, yeah
See Luke Combs LiveGet tickets as low as $40You might also like[Pre-Chorus]
Well, it takes one hand
To count the things I can count on
But I got one hand
That's grippin' down on a cold one

[Chorus]
'Cause longneck ice-cold beer never broke my heart
Like diamond rings and football teams have torn this boy apart
Like a neon dream, it just dawned on me, that bars, and this guitar
And longneck ice-cold beer never broke my heart, no
It never broke my heart1Embed"
Luke Combs,330498,Luke Combs,/albums/562077,https://images.genius.com/9e7bee6dd2c61922dfa1b70460ea60ff.1000x1000x1.jpg,What You See Is What You Get by Luke Combs,562077,What You See Is What You Get,"November 8, 2019",https://genius.com/albums/Luke-combs/What-you-see-is-what-you-get,4571412,Luke Combs,Refrigerator Door,8,/songs/4571412,Refrigerator Door by Luke Combs,https://images.genius.com/4dad8ea1993f6d5a9b204dcd589103eb.300x300x1.jpg,https://images.genius.com/4dad8ea1993f6d5a9b204dcd589103eb.750x750x1.jpg,5289751,complete,/Luke-combs-refrigerator-door-lyrics,,https://images.genius.com/4dad8ea1993f6d5a9b204dcd589103eb.300x300x1.jpg,https://images.genius.com/4dad8ea1993f6d5a9b204dcd589103eb.750x750x1.jpg,Refrigerator Door,https://genius.com/Luke-combs-refrigerator-door-lyrics,"13 ContributorsRefrigerator Door Lyrics[Verse 1]
There's daddy on his John Deere, brand new in '96
Beside me and Bandit playing fetch when I was a kid
A Save the Date, best day of my best buddies life
Anybody else could walk on by, and not blink an eye

[Chorus]
'Cause they're just pictures hanging side by side
Forgotten memories from another time
Just the places that I've been before
Couple magnets, recipes, and Polaroids
Yeah, but that's my life on the 'frigerator door

[Verse 2]
My first day of kindergarten when I was 5 years old
A postcard that my cousin sent from Cancun, Mexico
A list of what Mama needs from the IGA today
Is just one small part of a work of art signed Kenmore in '98

[Chorus]
With all those pictures hanging side by side
Forgotten memories from another time
And all the places that I've been before
Couple magnets, recipes, and Polaroids
Yeah, but that's my life on the 'frigerator door
See Luke Combs LiveGet tickets as low as $40You might also like[Bridge]
As life flies by, it spills onto the side
Until it's covered top to bottom with the best days of your life

[Chorus]
And all those pictures hanging side by side
Forgotten memories from another time
And all the places that you've been before
Couple magnets, recipes, and Polaroids
Yeah, but that's our lives on the 'frigerator door
On the 'frigerator doorEmbed"
Luke Combs,330498,Luke Combs,/albums/562077,https://images.genius.com/9e7bee6dd2c61922dfa1b70460ea60ff.1000x1000x1.jpg,What You See Is What You Get by Luke Combs,562077,What You See Is What You Get,"November 8, 2019",https://genius.com/albums/Luke-combs/What-you-see-is-what-you-get,4571413,Luke Combs,Even Though I’m Leaving,4,/songs/4571413,Even Though I’m Leaving by Luke Combs,https://images.genius.com/152fee0e7acb0003e6ad14dfcf58b325.300x300x1.jpg,https://images.genius.com/152fee0e7acb0003e6ad14dfcf58b325.1000x1000x1.jpg,3499648,complete,/Luke-combs-even-though-im-leaving-lyrics,12.0,https://images.genius.com/5141b3d2c9897d13ba45d410857ca7e3.300x300x1.jpg,https://images.genius.com/5141b3d2c9897d13ba45d410857ca7e3.900x900x1.jpg,Even Though I’m Leaving,https://genius.com/Luke-combs-even-though-im-leaving-lyrics,"16 ContributorsEven Though I’m Leaving Lyrics[Verse 1]
Daddy, I'm afraid, won't you stay a little while?
Keep me safe 'cause there's monsters right outside
Daddy, please don't go, I don't wanna be alone
'Cause the second that you're gone they're gonna know
Before he went to bed he grabbed my hand and said

[Chorus]
Just 'cause I'm leavin'
It don't mean that I won't be right by your side
When you need me
And you can't see me in the middle of the night
Just close your eyes and say a prayer
It's okay, I know you're scared when I'm not here
But I'll always be right there
Even though I'm leavin', I ain't goin' nowhere

[Verse 2]
Dad, we'll be late, and Uncle Sam don't like to wait
He's got a big old plane that's gonna take me far away
I know I act tough, but there's a churnin' in my gut
'Cause I just can't call you up when things get rough
Before I left, he hugged my neck and said

[Chorus]
Just 'cause you're leavin'
It don't mean that I won't be right by your side
When you need me
And you can't see me in the middle of the night
Just close your eyes and say a prayer
It's okay, I know you're scared I might be here
But I'll always be right there
Even though you're leavin', I ain't goin' nowhere
See Luke Combs LiveGet tickets as low as $40You might also like[Bridge]
Daddy, I'm afraid, won't you stay a little while?
I never thought I'd see the day I had to say goodbye
Daddy, please don't go, I can't do this on my own
There's no way that I can walk this road alone
Daddy grabbed my hand and said

[Chorus]
Just 'cause I'm leavin'
It don't mean that I won't be right by your side
When you need me
And you can't see me in the middle of the night
Just close your eyes and say a prayer
It's okay, boy, I ain't scared
I won't be here, but I'll always be right there
Even though I'm leavin', I ain't goin' nowhere
I ain't goin' nowhere12Embed"
Luke Combs,330498,Luke Combs,/albums/562077,https://images.genius.com/9e7bee6dd2c61922dfa1b70460ea60ff.1000x1000x1.jpg,What You See Is What You Get by Luke Combs,562077,What You See Is What You Get,"November 8, 2019",https://genius.com/albums/Luke-combs/What-you-see-is-what-you-get,4571414,Luke Combs,Lovin’ on You,1,/songs/4571414,Lovin’ on You by Luke Combs,https://images.genius.com/a54019c932badae3c2e515365c157833.300x300x1.jpg,https://images.genius.com/a54019c932badae3c2e515365c157833.1000x1000x1.jpg,3499648,complete,/Luke-combs-lovin-on-you-lyrics,2.0,https://images.genius.com/4acf081e96e40cd85c0bbd47c9758f64.300x300x1.jpg,https://images.genius.com/4acf081e96e40cd85c0bbd47c9758f64.960x960x1.jpg,Lovin’ on You,https://genius.com/Luke-combs-lovin-on-you-lyrics,"12 ContributorsLovin’ on You Lyrics[Verse 1]
Don't get me wrong
I like a bobber on the water
Hookin' 'em and reelin' 'em in
I like a Friday night slow ride
Brooks & Dunn B-side
Hit rewind, spin it again
I like a strong shot of whiskey
The way a Marlboro hits me
Some broken in cowboy boots

[Chorus]
But I'm in love and lovin' on you
I feel that rush soon as you walk in a room
I can't get enough of you, honey
You're right on the money
I'm a junkie for your midnight moves
I'm in love and lovin' on you

[Verse 2]
I like a sunrise, duck blind
Birdie on a par 5
Miller Lite before noon
I like a two-door old Ford
Wood board back porch
Three chords and the truth
See Luke Combs LiveGet tickets as low as $40You might also like[Chorus]
But I'm in love and lovin' on you
I feel that rush soon as you walk in a room
I can't get enough of you, honey
You're right on the money
I'm a junkie for your midnight moves
I'm in love with lovin' on you

[Chorus]
Girl, I'm in love and lovin' on you
I feel that rush soon as you walk in a room
I can't get enough of you, honey
You're right on the money
I'm a junkie for your midnight moves
I'm in love and lovin' on you
I'm in love and lovin' on you2Embed"
Luke Combs,330498,Luke Combs,/albums/562077,https://images.genius.com/9e7bee6dd2c61922dfa1b70460ea60ff.1000x1000x1.jpg,What You See Is What You Get by Luke Combs,562077,What You See Is What You Get,"November 8, 2019",https://genius.com/albums/Luke-combs/What-you-see-is-what-you-get,4571415,Luke Combs,Moon Over Mexico,1,/songs/4571415,Moon Over Mexico by Luke Combs,https://images.genius.com/4dad8ea1993f6d5a9b204dcd589103eb.300x300x1.jpg,https://images.genius.com/4dad8ea1993f6d5a9b204dcd589103eb.750x750x1.jpg,3499648,complete,/Luke-combs-moon-over-mexico-lyrics,,https://images.genius.com/4dad8ea1993f6d5a9b204dcd589103eb.300x300x1.jpg,https://images.genius.com/4dad8ea1993f6d5a9b204dcd589103eb.750x750x1.jpg,Moon Over Mexico,https://genius.com/Luke-combs-moon-over-mexico-lyrics,"11 ContributorsMoon Over Mexico Lyrics[Verse 1]
I can still see your blue sky blue eyes hangin' on a mango kiss
Hear the waves and the breeze and the Joshua trees
Was just about as good as it gets
Taste the salt on the rim, feel the sand on your skin
And the wild in the wind like I'm right there again

[Chorus]
Under a moon over Mexico
Holdin' onto you as the low tide rolls
Whatever that buzz was, I ain't felt it since
But I can't seem to let it go
And there was a shine in the dark, a flame from a spark
And a lime in a Pacifico
Under a moon over Mexico

[Verse 2]
The second I left I was kickin' myself
'Cause I knew I should've stayed
Still tequila love drunk, from us wakin' up
Under the Cabo palm leaf shade
And it's crazy I know, but I'd give anything to go
To you and me on that coast, in the midnight glow

[Chorus]
Of a moon over Mexico
Holdin' onto you as the low tide rolls
Whatever that buzz was, I ain't felt it since
But I can't seem to let it go
And there was a shine in the dark, a flame from a spark
And a lime in a Pacifico
Under a moon over Mexico
See Luke Combs LiveGet tickets as low as $40You might also like[Bridge]
Taste the salt on the rim, feel the sand on your skin
And the wild in the wind, like I'm right there again

[Chorus]
Under a moon over Mexico
Holdin' onto you as the low tide rolls
Whatever that buzz was, I ain't felt it since
But I can't seem to let it go
And there was a shine in the dark, a flame from a spark
And a lime in a Pacifico
Under a moon over Mexico
Under a moon over Mexico
Over MexicoEmbed"
Luke Combs,330498,Luke Combs,/albums/562077,https://images.genius.com/9e7bee6dd2c61922dfa1b70460ea60ff.1000x1000x1.jpg,What You See Is What You Get by Luke Combs,562077,What You See Is What You Get,"November 8, 2019",https://genius.com/albums/Luke-combs/What-you-see-is-what-you-get,4662359,Luke Combs & Brooks & Dunn,"1, 2 Many",1,/songs/4662359,"1, 2 Many by Luke Combs & Brooks & Dunn",https://images.genius.com/9e7bee6dd2c61922dfa1b70460ea60ff.300x300x1.jpg,https://images.genius.com/9e7bee6dd2c61922dfa1b70460ea60ff.1000x1000x1.jpg,4733728,complete,/Luke-combs-and-brooks-and-dunn-1-2-many-lyrics,3.0,https://images.genius.com/9e7bee6dd2c61922dfa1b70460ea60ff.300x300x1.jpg,https://images.genius.com/9e7bee6dd2c61922dfa1b70460ea60ff.1000x1000x1.jpg,"1, 2 Many",https://genius.com/Luke-combs-and-brooks-and-dunn-1-2-many-lyrics,"15 Contributors1, 2 Many Lyrics[Verse 1: Luke Combs]
Well I got a call from Rowdy ‘round six o'clock
Sayin' he caught a hankerin’ for a honky tonk
Wants an ice cold beer and a country song
But he didn't want to stay out all night long
Well I ain't the kind to let a buddy drink alone
But I can't turn it off once I turn it on

[Chorus: Luke Combs]
There's no stoppin' me once I get goin'
Put a can in my hand man, I'm wide ass open
The tick-tock of that clock is like a time bomb
By half past 10 I'm half past tipsy
And quarter to 12, man I done had plenty
The countdowns on when the first beer hits me
5-4-3-2-1 too many

[Verse 2: Luke Combs]
After five diet Millers I was feelin' loose
Singin' karaoke to a TL tune
When a pretty little thing shot me a wink
She said, ""Hey cowboy, could you buy us a drink?""
Well hey, baby doll, I will if you want
But I can't turn it off once I turn it on

[Chorus: Luke Combs]
There's no stoppin' me once I get goin'
Put a can in my hand man, I'm wide ass open
The tick-tock of that clock is like a time bomb
By half past 10 I'm half past tipsy
And quarter to 12, man I done had plenty
The countdowns on when the first beer hits me
5-4-3-2-1 too many
You might also like[Bridge: Luke Combs, Brooks & Dunn]
C'mon
Now I've never been the kind to quit
Won't stop 'til I get to the bottom of this
And the night's still young so whatcha say we shotgun one?
Hell we'll shoot one with you Luke, come on Ronnie

[Chorus: Brooks & Dunn, Luke Combs]
There's no stoppin' me once I get to goin'
Put a can in my hand man, I'm wide ass open
The tick-tock of that clock is like a time bomb
About half past 10 I'm half past tipsy
And quarter to 12, man, I done had plenty
The countdowns on when the first beer hit me
5-4-3-2-1 too many
Yeah, 5-4-3-2-1 too many

[Outro]
Come on, that’s a ******* country song right there3Embed"
Luke Combs,330498,Luke Combs,/albums/562077,https://images.genius.com/9e7bee6dd2c61922dfa1b70460ea60ff.1000x1000x1.jpg,What You See Is What You Get by Luke Combs,562077,What You See Is What You Get,"November 8, 2019",https://genius.com/albums/Luke-combs/What-you-see-is-what-you-get,4920157,Luke Combs,Blue Collar Boys,2,/songs/4920157,Blue Collar Boys by Luke Combs,https://images.genius.com/9e7bee6dd2c61922dfa1b70460ea60ff.300x300x1.jpg,https://images.genius.com/9e7bee6dd2c61922dfa1b70460ea60ff.1000x1000x1.jpg,3499648,complete,/Luke-combs-blue-collar-boys-lyrics,,https://images.genius.com/9e7bee6dd2c61922dfa1b70460ea60ff.300x300x1.jpg,https://images.genius.com/9e7bee6dd2c61922dfa1b70460ea60ff.1000x1000x1.jpg,Blue Collar Boys,https://genius.com/Luke-combs-blue-collar-boys-lyrics,"9 ContributorsBlue Collar Boys Lyrics[Verse 1]
We were just river kids
Pickin' up stones like David did
Watchin' them longnecks break off of a freight train bridge
We went to church in a Detroit car
Our daddies drank draft at the local bar
With an achin' back just like old Granddad did

[Chorus]
And we like cold keg beer and fixin' up trucks
Old bird dogs and the woman we love
Maxwell House steamin' out of a coffee cup
We say our prayers, send 'em to the sky
Bust our backs, barely getting by
Carolina to California up to Illinois
Yeah, there's guys like us
Blue collar boys

[Verse 2]
We're the white paint peeling off a picket fence
The rust stains covering a Craftsman wrench
When the sun's coming up you can bet we're clocking in
Cash our paycheck, two day break, and do it again

[Chorus]
We like cold keg beer and fixin' up trucks
Old bird dogs and the woman we love
Maxwell House steamin' out of a coffee cup
We say our prayers, send 'em to the sky
Bust our backs, barely getting by
Carolina to California up to Illinois
Yeah, there's guys like us
Blue collar boys
See Luke Combs LiveGet tickets as low as $40You might also like[Bridge]
We're worn out boots and old Levi's
The wind behind the stars and stripes

[Chorus]
And we like cold keg beer and fixin' up trucks
Old bird dogs and the woman we love
Maxwell House steamin' out of a coffee cup
We say our prayers, send 'em to the sky
Bust our backs, barely getting by
Carolina to California up to Illinois
Yeah, there's guys like us
Yeah, there's guys like us
Blue collar boys
Blue collar boysEmbed"
