search_name,artist_id,artist_name,album_api_path,album_cover_art_url,album_full_title,album_id,album_name,album_release_date_for_display,album_url,song_id,song_artist_names,song_title,song_annotation_count,song_api_path,song_full_title,song_header_image_thumbnail_url,song_header_image_url,song_lyrics_owner_id,song_lyrics_state,song_path,song_pyongs_count,song_song_art_image_thumbnail_url,song_song_art_image_url,song_title_with_featured,song_url,lyrics
Matt Nathanson,131281,Matt Nathanson,/albums/195554,https://images.genius.com/c97bb098724f01607c727975a2792ed5.500x500x1.jpg,Still Waiting for Spring by Matt Nathanson,195554,Still Waiting for Spring,"November 6, 1999",https://genius.com/albums/Matt-nathanson/Still-waiting-for-spring,1037558,Matt Nathanson,Everything You Say Sounds Like Gospel,1,/songs/1037558,Everything You Say Sounds Like Gospel by Matt Nathanson,https://images.genius.com/c97bb098724f01607c727975a2792ed5.300x300x1.jpg,https://images.genius.com/c97bb098724f01607c727975a2792ed5.500x500x1.jpg,1549345,complete,/Matt-nathanson-everything-you-say-sounds-like-gospel-lyrics,,https://images.genius.com/c97bb098724f01607c727975a2792ed5.300x300x1.jpg,https://images.genius.com/c97bb098724f01607c727975a2792ed5.500x500x1.jpg,Everything You Say Sounds Like Gospel,https://genius.com/Matt-nathanson-everything-you-say-sounds-like-gospel-lyrics,"2 ContributorsEverything You Say Sounds Like Gospel LyricsI've got bravery that shorts out on me
I see superstars in common thieves
And I see all you give up
And I try to be as much

Everything you say it sounds like gospel
Everything you say it sounds like gospel to me

I feel cheated
Tangled up repeatedly
Owed a piece of everything
And
Still you come around
With scissors to cut me down

Everything you say it sounds like gospel
Everything you say it sounds like gospel to me

It's all I can do to win for youSee Matt Nathanson LiveGet tickets as low as $21You might also likeEmbed"
Matt Nathanson,131281,Matt Nathanson,/albums/195554,https://images.genius.com/c97bb098724f01607c727975a2792ed5.500x500x1.jpg,Still Waiting for Spring by Matt Nathanson,195554,Still Waiting for Spring,"November 6, 1999",https://genius.com/albums/Matt-nathanson/Still-waiting-for-spring,1372688,Matt Nathanson,Amazing Again,1,/songs/1372688,Amazing Again by Matt Nathanson,https://images.genius.com/c97bb098724f01607c727975a2792ed5.300x300x1.jpg,https://images.genius.com/c97bb098724f01607c727975a2792ed5.500x500x1.jpg,1549345,complete,/Matt-nathanson-amazing-again-lyrics,,https://images.genius.com/c97bb098724f01607c727975a2792ed5.300x300x1.jpg,https://images.genius.com/c97bb098724f01607c727975a2792ed5.500x500x1.jpg,Amazing Again,https://genius.com/Matt-nathanson-amazing-again-lyrics,"1 ContributorAmazing Again LyricsI must be glorious
I must be a sight to see
Oh maybe you could comfort me
And I come to you strangled
In things I'm told are flattering
Maybe you could come and comfort me

And all the wan, hip, full lipped lovers
Are locked against one another
And I waiver, uncomfortable in my skin

Wait here for me
I'll be back for more and you'll see
And maybe, I'll be saved
And amazing again

You called us perfect
Because we slipped into awkward so easily
So maybe you could comfort me
And I've been better than this before
I know you've seen me be
So maybe you could come and comfort me

And all the wan, hip, full lipped lovers
Are locked against one another
And I waiver, uncomfortable in my skin
See Matt Nathanson LiveGet tickets as low as $21You might also likeWait here for me
I'll be back for more and you'll see
And maybe, I'll be saved
And I'll be amazing

Wait here for me
I'll be back for more and you'll see
And maybe, I'll be saved
And amazing again

(Instrumental)

Wait here for me
I'll be back for more and you'll see
And maybe, I'll be saved
And I'll be amazing

Wait here for me
I'll be back for more and you'll see
And maybe, I'll be saved
And amazing againEmbed"
Matt Nathanson,131281,Matt Nathanson,/albums/195554,https://images.genius.com/c97bb098724f01607c727975a2792ed5.500x500x1.jpg,Still Waiting for Spring by Matt Nathanson,195554,Still Waiting for Spring,"November 6, 1999",https://genius.com/albums/Matt-nathanson/Still-waiting-for-spring,1632161,Matt Nathanson,Little Victories,1,/songs/1632161,Little Victories by Matt Nathanson,https://images.genius.com/c97bb098724f01607c727975a2792ed5.300x300x1.jpg,https://images.genius.com/c97bb098724f01607c727975a2792ed5.500x500x1.jpg,1549345,complete,/Matt-nathanson-little-victories-lyrics,,https://images.genius.com/c97bb098724f01607c727975a2792ed5.300x300x1.jpg,https://images.genius.com/c97bb098724f01607c727975a2792ed5.500x500x1.jpg,Little Victories,https://genius.com/Matt-nathanson-little-victories-lyrics,"4 ContributorsLittle Victories LyricsThis time
I'll be sailing
No more bailing boats for me
I'll be out here on the sea
Just my confidence and me

And I'll be awful sometimes
Weakened to my knees
But I'll learn to get by
On the little victories

This time
I'll have no fear
I'll be standing strong and tall
Turn my back towards them all

And I'll be awful sometimes
Weakened to my knees
But I'll learn to get by
Yeah I'll learn to get by
On the little victories

And if the world decides to catch up with me
It's a little victorySee Matt Nathanson LiveGet tickets as low as $21You might also likeEmbed"
Matt Nathanson,131281,Matt Nathanson,/albums/197341,https://images.genius.com/368249b1d5cbacb64a3c63de4b0afc4f.500x500x1.jpg,Not Colored Too Perfect by Matt Nathanson,197341,Not Colored Too Perfect,"April 1, 1998",https://genius.com/albums/Matt-nathanson/Not-colored-too-perfect,1554953,Matt Nathanson,All Been Said Before,1,/songs/1554953,All Been Said Before by Matt Nathanson,https://images.genius.com/368249b1d5cbacb64a3c63de4b0afc4f.300x300x1.jpg,https://images.genius.com/368249b1d5cbacb64a3c63de4b0afc4f.500x500x1.jpg,1549345,complete,/Matt-nathanson-all-been-said-before-lyrics,,https://images.genius.com/368249b1d5cbacb64a3c63de4b0afc4f.300x300x1.jpg,https://images.genius.com/368249b1d5cbacb64a3c63de4b0afc4f.500x500x1.jpg,All Been Said Before,https://genius.com/Matt-nathanson-all-been-said-before-lyrics,"2 ContributorsAll Been Said Before LyricsI am held together by clothes pins and tension, a wealth of
Odds and ends
I'm dazzling like the neon street signs hiccuping off and on
Again all night long
I've got magazine friends and enough jealousy to lose them
But I know this has all been said before
I shed what escape my fiction provided
I lived a lifetime inside of my shelter and thought it about time
To see outside it
And I believed it was easy, stupidly thought I could just get up
And walk away
I've got illness hugging me like skin and I'll shed it clean until I can taste the oxygenSee Matt Nathanson LiveGet tickets as low as $21You might also likeEmbed"
Matt Nathanson,131281,Matt Nathanson,/albums/197341,https://images.genius.com/368249b1d5cbacb64a3c63de4b0afc4f.500x500x1.jpg,Not Colored Too Perfect by Matt Nathanson,197341,Not Colored Too Perfect,"April 1, 1998",https://genius.com/albums/Matt-nathanson/Not-colored-too-perfect,1625395,Matt Nathanson,Church Clothes,1,/songs/1625395,Church Clothes by Matt Nathanson,https://images.genius.com/368249b1d5cbacb64a3c63de4b0afc4f.300x300x1.jpg,https://images.genius.com/368249b1d5cbacb64a3c63de4b0afc4f.500x500x1.jpg,1549345,complete,/Matt-nathanson-church-clothes-lyrics,,https://images.genius.com/368249b1d5cbacb64a3c63de4b0afc4f.300x300x1.jpg,https://images.genius.com/368249b1d5cbacb64a3c63de4b0afc4f.500x500x1.jpg,Church Clothes,https://genius.com/Matt-nathanson-church-clothes-lyrics,"2 ContributorsChurch Clothes LyricsSpent more than my share on temptation
Trying to cool my swollen tongue
I gorge myself on all that free goodwill
And left the others none

What I wear like church clothes
You wear just like jewellery
All the simple things you revel in
They just suffocate me
I don't know anymore
Wish someone would tell me who to be
Cause I am ready, I am ready to try anything

I'm dazzled by glamour and camera angles
The drama and swagger of fools
Sacrifice beauty once
To chase after their parade
Spent my morning after crawling back to you

What I wear like church clothes
You wear just like jewellery
All the simple things you revel in
They just suffocate me
I don't know anymore
Wish someone would tell me who to be
Cause I am ready, I am ready to try anything
See Matt Nathanson LiveGet tickets as low as $21You might also likeI wanna be brand new
I wanna trade in these wings;
They don't work like yours do

What I wear like church clothes
You wear just like jewellery
All the simple things you revel in
They just suffocate me
I don't know anymore
Wish someone would tell me who to be
Cause I am ready, I am ready to try anything
I am ready, I am ready to try anything
I am ready, I am ready to try anything

I wanna trade in these wings;
They don't work like yours doEmbed"
Matt Nathanson,131281,Matt Nathanson,/albums/197341,https://images.genius.com/368249b1d5cbacb64a3c63de4b0afc4f.500x500x1.jpg,Not Colored Too Perfect by Matt Nathanson,197341,Not Colored Too Perfect,"April 1, 1998",https://genius.com/albums/Matt-nathanson/Not-colored-too-perfect,1541382,Matt Nathanson,New Coats And New Hats,1,/songs/1541382,New Coats And New Hats by Matt Nathanson,https://images.genius.com/368249b1d5cbacb64a3c63de4b0afc4f.300x300x1.jpg,https://images.genius.com/368249b1d5cbacb64a3c63de4b0afc4f.500x500x1.jpg,1549345,complete,/Matt-nathanson-new-coats-and-new-hats-lyrics,,https://images.genius.com/368249b1d5cbacb64a3c63de4b0afc4f.300x300x1.jpg,https://images.genius.com/368249b1d5cbacb64a3c63de4b0afc4f.500x500x1.jpg,New Coats And New Hats,https://genius.com/Matt-nathanson-new-coats-and-new-hats-lyrics,"2 ContributorsNew Coats And New Hats LyricsI
Remember crowds
Where you stand alone right now
And I remember celebrations
But now
My reign has run
All the color from
All my decorations

And I
I am fine
I am fine
Just a little lonely
So can I
Can I
Just ride on your back for a time?

Whoa, the seasons change
So quickly these days
While the rest in their new coats and new hats
Shiver in their beds
You stand outside
You watch the clouds roll by
In the same clothes that I met you in

And I
I am fine
I am fine
I'm just a little lonely
So can I
Can I
Just ride on your back for a time?
Well can I
Can I
Just ride on your back for a time?See Matt Nathanson LiveGet tickets as low as $21You might also likeEmbed"
Matt Nathanson,131281,Matt Nathanson,/albums/197341,https://images.genius.com/368249b1d5cbacb64a3c63de4b0afc4f.500x500x1.jpg,Not Colored Too Perfect by Matt Nathanson,197341,Not Colored Too Perfect,"April 1, 1998",https://genius.com/albums/Matt-nathanson/Not-colored-too-perfect,1109204,Matt Nathanson,Wait Up,1,/songs/1109204,Wait Up by Matt Nathanson,https://images.genius.com/368249b1d5cbacb64a3c63de4b0afc4f.300x300x1.jpg,https://images.genius.com/368249b1d5cbacb64a3c63de4b0afc4f.500x500x1.jpg,1549345,complete,/Matt-nathanson-wait-up-lyrics,,https://images.genius.com/368249b1d5cbacb64a3c63de4b0afc4f.300x300x1.jpg,https://images.genius.com/368249b1d5cbacb64a3c63de4b0afc4f.500x500x1.jpg,Wait Up,https://genius.com/Matt-nathanson-wait-up-lyrics,"1 ContributorWait Up LyricsI recall your kisses and they tasted just like medicine
I put all the pieces back together in my head
Seems so obvious now how fragile a thing we had
And all the leaves were on the ground that fall, the leaves
Were all around
And you fed me stories and you polished up your bruises until
They shined
It kind of made me wish that I had a bruise so fine
I've watched you twice rebuild your life, why don't you wait up
For me
I stumble, why don't you wait up for me
With your childs smile and your innocence
I'd buy you bows and ribbons, the prettiest bows and ribbons
I made you like a queen with all the gifts I'd given
You're a debutante and all you've got is a head full of
Someone else's thoughtsSee Matt Nathanson LiveGet tickets as low as $21You might also likeEmbed"
Matt Nathanson,131281,Matt Nathanson,/albums/197341,https://images.genius.com/368249b1d5cbacb64a3c63de4b0afc4f.500x500x1.jpg,Not Colored Too Perfect by Matt Nathanson,197341,Not Colored Too Perfect,"April 1, 1998",https://genius.com/albums/Matt-nathanson/Not-colored-too-perfect,1559733,Matt Nathanson,You’re Smiling,1,/songs/1559733,You're Smiling by Matt Nathanson,https://images.genius.com/368249b1d5cbacb64a3c63de4b0afc4f.300x300x1.jpg,https://images.genius.com/368249b1d5cbacb64a3c63de4b0afc4f.500x500x1.jpg,1549345,complete,/Matt-nathanson-youre-smiling-lyrics,,https://images.genius.com/368249b1d5cbacb64a3c63de4b0afc4f.300x300x1.jpg,https://images.genius.com/368249b1d5cbacb64a3c63de4b0afc4f.500x500x1.jpg,You're Smiling,https://genius.com/Matt-nathanson-youre-smiling-lyrics,"1 ContributorYou’re Smiling LyricsYou're smiling
But I sense fear when you say
Abandon ship and lets land here
And the water is deep around my knees
But still I don't believe

That another time
Would've followed you anywhere
And another time
Would've followed you anywhere'but not now'
But not now

You're smiling
As you climb into another idea
Of what it means to be you
And I'm supposed to follow
And I'm not supposed to mind
That you keep leaving me behind

At another time
I would've followed you anywhere
And another time
I would've followed you anywhere but not now'
But not now

You said I
Was a shackle to you
And you always say the most violent things my dear
You said I
Was a shackle to you
And you always say the most vile things my dear
See Matt Nathanson LiveGet tickets as low as $21You might also likeAnd another time
I would've followed you anywhere
At another time
I would've followed you anywhere
But not now'
But not now

You said I
Was a shackle to you
And you were always saying the most violent things my dear
You said I
Was a shackle to you
And you always say the most vile things my dearEmbed"
Matt Nathanson,131281,Matt Nathanson,/albums/197341,https://images.genius.com/368249b1d5cbacb64a3c63de4b0afc4f.500x500x1.jpg,Not Colored Too Perfect by Matt Nathanson,197341,Not Colored Too Perfect,"April 1, 1998",https://genius.com/albums/Matt-nathanson/Not-colored-too-perfect,1540068,Matt Nathanson,Miracles,1,/songs/1540068,Miracles by Matt Nathanson,https://images.genius.com/368249b1d5cbacb64a3c63de4b0afc4f.300x300x1.jpg,https://images.genius.com/368249b1d5cbacb64a3c63de4b0afc4f.500x500x1.jpg,1549345,complete,/Matt-nathanson-miracles-lyrics,,https://images.genius.com/368249b1d5cbacb64a3c63de4b0afc4f.300x300x1.jpg,https://images.genius.com/368249b1d5cbacb64a3c63de4b0afc4f.500x500x1.jpg,Miracles,https://genius.com/Matt-nathanson-miracles-lyrics,"2 ContributorsMiracles LyricsThey built a hero, out of expections
And what a hopeless hero was he
Sticks for legs, well he shook when the wind blew, even slightly
And he welcomed the smiles
Welcomed the applause
And hoped they'd never forgot just who they thought he was
They dressed him up in rich mans clothes
And told him he was beautiful

Then they expected miracles
Then they expected miracles

His parents were pleased
They went to all the parties
He was groomed for greatness from the time he was young
Raised on a diet of television
He was taught to listen, kept on

And he welcomed desire
Reckless luxury
The world soaked up every drop of drama
And insecurity

They dressed him up in rich mans clothes
And told him he was beautiful
See Matt Nathanson LiveGet tickets as low as $21You might also likeThen they expected miracles
Then they expected miracles

Then one day his admires just quit him
They just packed up their things and were gone
He stood alone
Their beautiful disatser
Wonderin' where he'd gone wrong
He wanted their smile
Wanted the applause
No one would look him in the eye now
No one returned his calls

They dressed him up in rich mans clothes
And told him he was beautiful

Then they expected miracles
Then they expected miraclesEmbed"
Matt Nathanson,131281,Matt Nathanson,/albums/197341,https://images.genius.com/368249b1d5cbacb64a3c63de4b0afc4f.500x500x1.jpg,Not Colored Too Perfect by Matt Nathanson,197341,Not Colored Too Perfect,"April 1, 1998",https://genius.com/albums/Matt-nathanson/Not-colored-too-perfect,1332565,Matt Nathanson,Clean,1,/songs/1332565,Clean by Matt Nathanson,https://images.genius.com/368249b1d5cbacb64a3c63de4b0afc4f.300x300x1.jpg,https://images.genius.com/368249b1d5cbacb64a3c63de4b0afc4f.500x500x1.jpg,1549345,complete,/Matt-nathanson-clean-lyrics,,https://images.genius.com/368249b1d5cbacb64a3c63de4b0afc4f.300x300x1.jpg,https://images.genius.com/368249b1d5cbacb64a3c63de4b0afc4f.500x500x1.jpg,Clean,https://genius.com/Matt-nathanson-clean-lyrics,"2 ContributorsClean LyricsAm I pretty enough for you now that my ribs show through?
With a little makeup I can look brand new, but can I be pretty
Enough for you?
Fill me with secrets and I'll never tell
Fatten me up, and I'll feed you well
You can polish me perfectly and I'll shine pristine
But not even a cherub is this clean
Am I all that you d hoped that I would be, hanging on
Obediently
To the words that I'm finding so hard to believe?
Am I all that you d hoped that I would be?
Why don't you just stop me if I'm sounding ungrateful
Why don't you stop me if I'm coming on a bit too strongSee Matt Nathanson LiveGet tickets as low as $21You might also likeEmbed"
Matt Nathanson,131281,Matt Nathanson,/albums/197341,https://images.genius.com/368249b1d5cbacb64a3c63de4b0afc4f.500x500x1.jpg,Not Colored Too Perfect by Matt Nathanson,197341,Not Colored Too Perfect,"April 1, 1998",https://genius.com/albums/Matt-nathanson/Not-colored-too-perfect,1006830,Matt Nathanson,Somewhere To Hide,1,/songs/1006830,Somewhere To Hide by Matt Nathanson,https://images.genius.com/368249b1d5cbacb64a3c63de4b0afc4f.300x300x1.jpg,https://images.genius.com/368249b1d5cbacb64a3c63de4b0afc4f.500x500x1.jpg,1549345,complete,/Matt-nathanson-somewhere-to-hide-lyrics,,https://images.genius.com/368249b1d5cbacb64a3c63de4b0afc4f.300x300x1.jpg,https://images.genius.com/368249b1d5cbacb64a3c63de4b0afc4f.500x500x1.jpg,Somewhere To Hide,https://genius.com/Matt-nathanson-somewhere-to-hide-lyrics,"2 ContributorsSomewhere To Hide LyricsShe said come along with me, I've got offerings for you my
Sweet, sweet boy
She promised warmth too, but I knew better
Her words broke hot against my neck
And tasting the sweet, sweet numb of regret on my lips
I filled my pockets and closed the door
And I tasted all I'd left behind, but shameful I crawled naked
Searching for somewhere to hide
And in the end she said it was memorable and comfortable
But funny, I wouldn't have used those words
The secrecy and her bed, it was choking me with a knot in my gut
You have beautiful empty eyes, I'm sure of that much
Oh princess open your eyes and close your mouth
Else all that spite you swallow willingly , it just might fall out
And I've seen you smile wide, I've seen you at your best
And it left me feeling sick inside and unimpressed
And I tasted all I'd left behind, but shameful I crawled naked
Searching for somewhere to hideSee Matt Nathanson LiveGet tickets as low as $21You might also likeEmbed"
Matt Nathanson,131281,Matt Nathanson,/albums/197341,https://images.genius.com/368249b1d5cbacb64a3c63de4b0afc4f.500x500x1.jpg,Not Colored Too Perfect by Matt Nathanson,197341,Not Colored Too Perfect,"April 1, 1998",https://genius.com/albums/Matt-nathanson/Not-colored-too-perfect,964114,Matt Nathanson,Vandalized,1,/songs/964114,Vandalized by Matt Nathanson,https://images.genius.com/368249b1d5cbacb64a3c63de4b0afc4f.300x300x1.jpg,https://images.genius.com/368249b1d5cbacb64a3c63de4b0afc4f.500x500x1.jpg,1549345,complete,/Matt-nathanson-vandalized-lyrics,,https://images.genius.com/368249b1d5cbacb64a3c63de4b0afc4f.300x300x1.jpg,https://images.genius.com/368249b1d5cbacb64a3c63de4b0afc4f.500x500x1.jpg,Vandalized,https://genius.com/Matt-nathanson-vandalized-lyrics,"1 ContributorVandalized LyricsWell, it's late at night
There's nobody around
Just the sounds of the cars
Upon the asphalt ground
It's the waiting time
When the hours grow still
I gaze on through the glass
Inside my windowsill
Though I know that you must be
Somewhere in this world
In this place where, at birth
You and I were both hurled
To think that we once were relating
Is a thing that has almost grown foreign to me

It's a bad sight
Such a terrible waste
To spend your time talking
In such bad taste
It's the same old line
Though it's not you I blame
It's your teachers and television
That you put to shame
The night's lasting longer
Because I've filled my head
With the things I could have done
And the words I could have said
But, in truth, I was only spectating
And that's a permanent part of reality
See Matt Nathanson LiveGet tickets as low as $21You might also likeSo many rude lines
So many petty crimes
And you don't feel a need
To apologize
Tonight is the time
That you stick in my mind
But from now on I won't become
Vandalized

Now the room's started filling
With the dawn's early light
And the end has arrived
Of this long night
I turn off the television
And I hit the bed
While your shade is still haunting
My ever-vulnerable head
And there's no use
In trying to compromise
When the kindest things we say
But it's time I should quit my complaining
And behave with a little more dignity

So many rude lines
So many petty crimes
And you don't feel a need
To apologize
Tonight is the time
That you stick in my mind
But from now on I won't become
Vandalized
Written by Bill ForemanEmbed"
Matt Nathanson,131281,Matt Nathanson,/albums/197341,https://images.genius.com/368249b1d5cbacb64a3c63de4b0afc4f.500x500x1.jpg,Not Colored Too Perfect by Matt Nathanson,197341,Not Colored Too Perfect,"April 1, 1998",https://genius.com/albums/Matt-nathanson/Not-colored-too-perfect,1172448,Matt Nathanson,Trace Of A Cat’s Eye,1,/songs/1172448,Trace Of A Cat's Eye by Matt Nathanson,https://images.genius.com/368249b1d5cbacb64a3c63de4b0afc4f.300x300x1.jpg,https://images.genius.com/368249b1d5cbacb64a3c63de4b0afc4f.500x500x1.jpg,1549345,complete,/Matt-nathanson-trace-of-a-cats-eye-lyrics,,https://images.genius.com/368249b1d5cbacb64a3c63de4b0afc4f.300x300x1.jpg,https://images.genius.com/368249b1d5cbacb64a3c63de4b0afc4f.500x500x1.jpg,Trace Of A Cat's Eye,https://genius.com/Matt-nathanson-trace-of-a-cats-eye-lyrics,"2 ContributorsTrace Of A Cat’s Eye LyricsWhen the leaves have changed
When the world around you starts to grow deranged
The faces that you see are looking strange
And your principles have all been rearranged
When only tears remain
In the residue the ruins of your brain
Start looking for a way you can explain
Though the reasons should've made themselves quite plain
And then you'll think of me
In the moment when we'd almost broken free
Your mind will start its drifting wistfully
To the corner of your heart nobody seesSee Matt Nathanson LiveGet tickets as low as $21You might also likeEmbed"
Matt Nathanson,131281,Matt Nathanson,/albums/225297,https://images.genius.com/bea173b52aa5331b17f8b42fafdc63af.500x500x1.jpg,Ernst by Matt Nathanson,225297,Ernst,"February 1, 1997",https://genius.com/albums/Matt-nathanson/Ernst,1716061,Matt Nathanson,First Time,1,/songs/1716061,First Time by Matt Nathanson,https://images.genius.com/bea173b52aa5331b17f8b42fafdc63af.300x300x1.jpg,https://images.genius.com/bea173b52aa5331b17f8b42fafdc63af.500x500x1.jpg,1549345,complete,/Matt-nathanson-first-time-lyrics,,https://images.genius.com/bea173b52aa5331b17f8b42fafdc63af.300x300x1.jpg,https://images.genius.com/bea173b52aa5331b17f8b42fafdc63af.500x500x1.jpg,First Time,https://genius.com/Matt-nathanson-first-time-lyrics,"2 ContributorsFirst Time LyricsI'm ready to embrace this I am
I'm ready for repair
I've got so many layers left by amateur painters who covered over what was there

I stuffed myself sick on your memory
A beautiful mess that we made
But I'm so tired of being inspired only when things slip away'

You told me time would strip it all free and leave me bone dry
You told me time would strip it all free
But I'm no better then when I left here the first time

I'm ready to erase this I am
I'm ready to begin
Spent myself trying to change all of the beauty we made
Just to want it all back again

And with clouds moving in
Well this hardly looks like the same moon
And with the leaves all gone the trees that once stood strong
Now look pinched and cruel

You told me time would strip it all free and leave me bone dry
You told me time would strip it all free
But I'm no better then when I left here the first time
But I'm no better then when I left here the first
First time
First time'
See Matt Nathanson LiveGet tickets as low as $21You might also likeYou told me time would strip it all free and leave me bone dry
You told me time would strip it all free
But I'm no better then when I left here the first time
Well I'm no better then when I left here the first time
Well I'm no better then when I left here the first time
Time, time, timeEmbed"
