search_name,artist_id,artist_name,album_api_path,album_cover_art_url,album_full_title,album_id,album_name,album_release_date_for_display,album_url,song_id,song_artist_names,song_title,song_annotation_count,song_api_path,song_full_title,song_header_image_thumbnail_url,song_header_image_url,song_lyrics_owner_id,song_lyrics_state,song_path,song_pyongs_count,song_song_art_image_thumbnail_url,song_song_art_image_url,song_title_with_featured,song_url,lyrics
The Killers,599,The Killers,/albums/19003,https://images.genius.com/4ca5c2fe7f7a5130dc35d55d7a818a94.600x600x1.png,Battle Born by The Killers,19003,Battle Born,"September 17, 2012",https://genius.com/albums/The-killers/Battle-born,5873054,The Killers,Runaways (Michel Remix),0,/songs/5873054,Runaways (Michel Remix) by The Killers,https://images.genius.com/4ca5c2fe7f7a5130dc35d55d7a818a94.300x300x1.png,https://images.genius.com/4ca5c2fe7f7a5130dc35d55d7a818a94.600x600x1.png,2790115,complete,/The-killers-runaways-michel-remix-lyrics,,https://images.genius.com/4ca5c2fe7f7a5130dc35d55d7a818a94.300x300x1.png,https://images.genius.com/4ca5c2fe7f7a5130dc35d55d7a818a94.600x600x1.png,Runaways (Michel Remix),https://genius.com/The-killers-runaways-michel-remix-lyrics,"2 ContributorsRunaways (Michel Remix) Lyrics[Verse 1]
Blonde hair blowing in the summer wind
A blue-eyed girl playing in the sand
I'd been on her trail for a little while
But that was the night that she broke down and held my hand
A teenage rush
She said, ""Ain't we all just runaways? We got time""

[Pre-Chorus 1]
But that ain't much
We can't wait till tomorrow
You got to know that this is real, baby, why you want to fight it?
It's the one thing you can choose, oh!

[Verse 2]
We got engaged on a Friday night
I swore on the head of our unborn child
That I could take care of the three of us
But I got the tendency to slip when the nights get wild
It's in my blood
She said she might just runaway somewhere else
Someplace good

[Pre-Chorus 2]
We can't wait til tomorrow
You got to know that this is real, baby, why you want to fight it?
It's the one thing you can choose
Let's take a chance baby, we can't lose
See The Killers LiveGet tickets as low as $68You might also like[Chorus]
Ain't we all just runaways?
I knew it when I met you, I'm not going to let you runaway
I knew it when I held you, I wasn't letting go!

[Verse 3]
We used to look at the stars and confess our dreams
Hold each other till the morning light
We used to laugh, now we only fight
Baby are you lonesome now?

[Verse 4]
At night I come home after they go to sleep
Like a stumbling ghost, I haunt these halls
There's a picture of us on our wedding day
I recognize the girl but I can't settle in these walls

[Pre-Chorus 3]
We can't wait till tomorrow
Oh, we're caught up in the appeal baby, why you wanna hide it?
It's the last thing on my mind
I turn the engine over and my body just comes alive

[Chorus]
Ain't we all just runaways?
I knew it when I met you, I'm not going to let you runaway
I knew it when I held you, I wasn't letting go!
[Outro]
Oh! Oh! Oh!
Yeah, yeah, runaways, yeahEmbed"
The Killers,599,The Killers,/albums/24512,https://images.genius.com/caed7e3c8a8b7071f80dcfe04b38bf1d.1000x1000x1.jpg,(RED) Christmas EP by The Killers,24512,(RED) Christmas EP,2011,https://genius.com/albums/The-killers/Red-christmas-ep,209113,The Killers (Ft. Toni Halliday),A Great Big Sled,7,/songs/209113,A Great Big Sled by The Killers (Ft. Toni Halliday),https://images.genius.com/debcf064317a3c4771205507cf17104b.300x300x1.jpg,https://images.genius.com/debcf064317a3c4771205507cf17104b.1000x1000x1.jpg,250962,complete,/The-killers-a-great-big-sled-lyrics,1.0,https://images.genius.com/c3eea85a61103371262fc238de0de60d.300x300x1.png,https://images.genius.com/c3eea85a61103371262fc238de0de60d.1000x1000x1.png,A Great Big Sled (Ft. Toni Halliday),https://genius.com/The-killers-a-great-big-sled-lyrics,"9 ContributorsA Great Big Sled Lyrics[Verse 1: Brandon Flowers]
This snowman is shaping up to be an eight
But not out of ten
The robots awake to find that they've been taped down
Wondering when
They'll break through these chains
But little boys have action toys for brains
I'm living proof it can last a long time

[Verse 2: Brandon Flowers]
Now the girls off the street are innocent and sweet
When they're all in bed
They got their make-up and dreams of wonderland
Sprinkled inside their heads
And soon they will change
But tonight, Hollywood has never seemed so strange
Now mothers pray it'll last a long time

[Chorus: Brandon Flowers]
I wanna roll around like a kid in the snow
I wanna relearn what I already know
Just let me take flight, dressed in red
Through the night, on a great big sled

[Post-Chorus: Brandon Flowers]
I want to wish you Merry Christmas
Ho, ho, ho
See The Killers LiveGet tickets as low as $68You might also like[Verse 3: Brandon Flowers]
Now the boys are all grown up
Out there working their fingers to the bone
They go around chasing them girls on the weekend
You know they still can't be alone
And I've been racking my brain
With thoughts of peace and love
How on earth did we get so mixed up?
I pray to God it don't last a long time

[Chorus: Brandon Flowers]
I wanna roll around like a kid in the snow
I wanna relearn what I already know
Just let me take flight, dressed in red
Through the night, on a great big sled

[Bridge: Toni Halliday]
I hear the sound of bells
There's something on the roof
I wonder what this night will bring

[Chorus: Brandon Flowers & Toni Halliday]
I wanna roll around like a kid in the snow
(I hear the sound of bells)
I wanna relearn what I already know
(There's something on the roof)
Just let me take flight, dressed in red
(I wonder what this night will bring)
Through the night, on a great big sled
[Outro: Brandon Flowers & Toni Halliday]
I want to wish you Merry Christmas
(You can't do that)
I want to wish you Merry Christmas
(You can't do that)1Embed"
The Killers,599,The Killers,/albums/24512,https://images.genius.com/caed7e3c8a8b7071f80dcfe04b38bf1d.1000x1000x1.jpg,(RED) Christmas EP by The Killers,24512,(RED) Christmas EP,2011,https://genius.com/albums/The-killers/Red-christmas-ep,209116,The Killers (Ft. Ryan Pardey),Don’t Shoot Me Santa,5,/songs/209116,Don't Shoot Me Santa by The Killers (Ft. Ryan Pardey),https://images.genius.com/debcf064317a3c4771205507cf17104b.300x300x1.jpg,https://images.genius.com/debcf064317a3c4771205507cf17104b.1000x1000x1.jpg,250962,complete,/The-killers-dont-shoot-me-santa-lyrics,4.0,https://images.genius.com/191e23111dd27bafc92c75545a4fd1a7.300x300x1.jpg,https://images.genius.com/191e23111dd27bafc92c75545a4fd1a7.600x600x1.jpg,Don't Shoot Me Santa (Ft. Ryan Pardey),https://genius.com/The-killers-dont-shoot-me-santa-lyrics,"10 ContributorsDon’t Shoot Me Santa Lyrics[Verse 1: Brandon Flowers & Ryan Pardey]
Oh, Santa
I've been waiting on you
That's funny, kid, because
I've been coming for you
Oh, Santa
I've been killing just for fun
Well, the party's over, kid
Because I, because I got a bullet in my gun
A bullet in your what?

[Pre-Chorus: Brandon Flowers]
Santa's got a bullet in his gun (You know it)
Santa's got a bullet in his gun

[Chorus: Brandon Flowers]
Don't shoot me, Santa Claus
I've been a clean living boy, I promise you
Did every little thing you asked me to
I can't believe the things I'm going through
Don't shoot me, Santa Claus
Well, no one else around believes me
But the children on the block, they tease me
And I couldn't let 'em off that easy

[Verse 2: Brandon Flowers & Ryan Pardey]
Oh, Santa
It's been a real hard year (Year)
There just ain't no getting around this, life is hard
But look at me, I turned out alright
Hey, Santa
Why don't we talk about it? Work it out
Believe me, this ain't what I wanted
I love all you kids, you know that
Hell, I remember when you were just ten years old
Playing out there in the desert
Just waiting for a sip of that sweet Mojave rain
See The Killers LiveGet tickets as low as $68You might also like[Pre-Chorus: Brandon Flowers]
In the sweet Mojave rain, the boy was on his own

[Chorus: Brandon Flowers]
Don't shoot me, Santa Claus
I've been a clean living boy, I promise you
Did every little thing you asked me to
I can't believe the things I'm going through
Hey, Santa Claus
Well, no one else around believes me
But the children on the block, they tease me
And I couldn't let 'em off that easy

[Bridge: Brandon Flowers]
They had it coming, so why can't you see?
I couldn't turn my cheek no longer
The sun is going down and Christmas is near
Just look the other way and I'll disappear forever
Woo!

[Chorus: Brandon Flowers]
Don't shoot me, Santa Claus
Well, no one else around believes me
But the children on the street, they tease me
And I couldn't let 'em off that easy
[Outro: Brandon Flowers]
Believe me
Santa (Santa)4Embed"
The Killers,599,The Killers,/albums/24512,https://images.genius.com/caed7e3c8a8b7071f80dcfe04b38bf1d.1000x1000x1.jpg,(RED) Christmas EP by The Killers,24512,(RED) Christmas EP,2011,https://genius.com/albums/The-killers/Red-christmas-ep,209118,The Killers (Ft. Elton John & Neil Tennant),"Joseph, Better You Than Me",11,/songs/209118,"Joseph, Better You Than Me by The Killers (Ft. Elton John & Neil Tennant)",https://images.genius.com/debcf064317a3c4771205507cf17104b.300x300x1.jpg,https://images.genius.com/debcf064317a3c4771205507cf17104b.1000x1000x1.jpg,250962,complete,/The-killers-joseph-better-you-than-me-lyrics,,https://images.genius.com/5e55dda83a78f31ba4fcc060d1b99184.300x300x1.jpg,https://images.genius.com/5e55dda83a78f31ba4fcc060d1b99184.700x700x1.jpg,"Joseph, Better You Than Me (Ft. Elton John & Neil Tennant)",https://genius.com/The-killers-joseph-better-you-than-me-lyrics,"8 ContributorsJoseph, Better You Than Me Lyrics[Verse 1: Brandon Flowers]
Well your eyes just haven't been the same, Joseph
Are you bad at dealing with the fame, Joseph?
There's a pale moonshine above you
Do you see both sides? Do they shove you around?

[Verse 2: Elton John & Brandon Flowers]
Is the touchstone forcing you to hide, Joseph?
Are the rumors eating you alive, Joseph?
When the holy night is upon you
Will you do what's right? The position is yours
[Chorus: Elton John]
From the temple walls to the New York night
Our decisions rest on a child
When she took her stand, did she hold your hand?
Will your faith stand still or run away?
Run away

[Verse 3: Elton John]
When they've driven you so far
That you think you're gonna drop
Do you wish you were back there
At the carpenter shop?

[Verse 4: Neil Tennant]
With the plane and the lathe
The work never drove you mad
You're a maker, a creator
Not just somebody's dad
See The Killers LiveGet tickets as low as $68You might also like[Chorus: Brandon Flowers, Elton John & Neil Tennant]
From the temple walls to the New York night
Our decisions rest on a man
When I take the stand, will he hold my hand?
Will my faith stand still or run away?
(Run away)

[Verse 5: Elton John, Elton John & Brandon Flowers]
And the desert, it's a hell of a place to find heaven
Forty years lost in the wilderness, looking for God
And you climb to the top of the mountain
Looking down on the city where you were born
(Oh, the years since you left gave you time to sit back and reflect)

[Refrain: Elton John & Brandon Flowers]
Better you than me (Better you than me)
Better you than me, yeah
Well, the holy night is upon you (Better you, better you)
Do you see both sides, do they shove you around?
Better you than me, Joseph (Better you than me)
Better you than me, Joseph, Joseph
Joseph, Joseph (Than me)
Better you than me (Better you, better you, better you than me)

[Outro: Brandon Flowers]
Well, your eyes just haven't been the same, JosephEmbed"
The Killers,599,The Killers,/albums/24512,https://images.genius.com/caed7e3c8a8b7071f80dcfe04b38bf1d.1000x1000x1.jpg,(RED) Christmas EP by The Killers,24512,(RED) Christmas EP,2011,https://genius.com/albums/The-killers/Red-christmas-ep,209119,The Killers (Ft. Mariachi El Bronx & Wild Light),¡Happy Birthday Guadalupe!,3,/songs/209119,¡Happy Birthday Guadalupe! by The Killers (Ft. Mariachi El Bronx & Wild Light),https://images.genius.com/debcf064317a3c4771205507cf17104b.300x300x1.jpg,https://images.genius.com/debcf064317a3c4771205507cf17104b.1000x1000x1.jpg,250962,complete,/The-killers-happy-birthday-guadalupe-lyrics,,https://images.genius.com/0e9e218213a24096f94dc12a1bfc9742.300x300x1.jpg,https://images.genius.com/0e9e218213a24096f94dc12a1bfc9742.700x700x1.jpg,¡Happy Birthday Guadalupe! (Ft. Mariachi El Bronx & Wild Light),https://genius.com/The-killers-happy-birthday-guadalupe-lyrics,"10 Contributors¡Happy Birthday Guadalupe! Lyrics[Verse 1]
Well I woke up Christmas morning and what did I see?
I saw a lovely señorita looking back at me
Named Guadalupe with big brown eyes
Boy what did you do this time?

Made my excuses and a beeline for the bedroom door
She was begging and a-pleading screaming ""Por favor
Mi cumpleaños stay with me
Baby it's cold outside""

[Chorus]
We are living in a difficult time
We've been walking down a difficult line
Put your feet up baby it's Christmas time
Cumpleaños feliz
Happy Birthday Guadalupe

(Our time will come)
(Oh, we both hold on)

[Verse 2]
She gave me coffee and tortillas to console my head
Prepared the slippers on my feet before she made our bed
And blew the candles from her favorite cake
And we kissed beneath the mistletoe
See The Killers LiveGet tickets as low as $68You might also likeI pulled her body close to mine and I had just one chance
I whispered ""Baby will you marry me for just one dance?""
Infatuation the things you say
I got scared and I left that night

[Chorus]
'Cause, we are living in a difficult time
We've been walking down a difficult line
Put your feet up baby it's Christmas time
Cumpleaños feliz
Happy Birthday Guadalupe

[Bidge]
Deck the halls with rosaries
Wish upon a Christmas tree
Silent night please come to me
Bearing gifts from my... my Mexican angel

[Instrumental]

At night I wake up cold and lonely bursting at the seams
She haunts the early morning hours of December dreams
My Guadalupe with big brown eyes
I wanna break the spell tonight

[Chorus]
'Cause we are living in a difficult time
We've been walking down a difficult line
Put your feet up baby it's Christmas time
Cumpleaños feliz
Happy Birthday Guadalupe
[Outro]
Happy Birthday GuadalupeEmbed"
The Killers,599,The Killers,/albums/24512,https://images.genius.com/caed7e3c8a8b7071f80dcfe04b38bf1d.1000x1000x1.jpg,(RED) Christmas EP by The Killers,24512,(RED) Christmas EP,2011,https://genius.com/albums/The-killers/Red-christmas-ep,99233,The Killers,Boots,14,/songs/99233,Boots by The Killers,https://images.genius.com/debcf064317a3c4771205507cf17104b.300x300x1.jpg,https://images.genius.com/debcf064317a3c4771205507cf17104b.1000x1000x1.jpg,110765,complete,/The-killers-boots-lyrics,,https://images.genius.com/0b4fb78c0a58a43f422c248697e4923f.280x280x1.jpg,https://images.genius.com/0b4fb78c0a58a43f422c248697e4923f.280x280x1.jpg,Boots,https://genius.com/The-killers-boots-lyrics,"11 ContributorsBoots Lyrics[Intro]
Oh, God, oh, God
Dear father in heaven
I'm not a praying man but if you're up there and you can hear me
Show me the way
I'm at the end of my road and I...
Show me the way, oh God

[Verse 1]
No more trouble in this town
Silent night for a change
A brand new year coming up ahead
You know it's been so long since I rang one in
I close my eyes, think about the path I took
Just when I think these times have gotten the best of me

[Hook]
I can see my mother in the kitchen, my father on the floor
Watching television, it's a wonderful life
Cinnamon candles burning, snowball fights outside
Smile below each nose and above each chin
Stomp my boots before I go back in

[Verse 2]
I wasted my wishes on Saturday nights
Boy, what I would give for just one more
I'd soften my heart, shock the world
Do you hear my voice?
Do you know my name?
Light my way, lift my head, light my way
See The Killers LiveGet tickets as low as $68You might also like[Hook]
I can see my mother in the kitchen, my father on the floor
Watching television, it's a wonderful life
Cinnamon candles burning, snowball fights outside
Smile below each nose and above each chin
Stomp my boots before I go back in

[Verse 3]
Family all together, presents piled high
Frost on all the windows, what a wonderful night
Cinnamon candles burning, snowball fights outside
Smile below each nose and above each chin

[Outro]
So happy they found me
Love was all around me
Stomp my boots before I go back inEmbed"
The Killers,599,The Killers,/albums/24512,https://images.genius.com/caed7e3c8a8b7071f80dcfe04b38bf1d.1000x1000x1.jpg,(RED) Christmas EP by The Killers,24512,(RED) Christmas EP,2011,https://genius.com/albums/The-killers/Red-christmas-ep,209122,The Killers,The Cowboys’ Christmas Ball,3,/songs/209122,The Cowboys' Christmas Ball by The Killers,https://images.genius.com/debcf064317a3c4771205507cf17104b.300x300x1.jpg,https://images.genius.com/debcf064317a3c4771205507cf17104b.1000x1000x1.jpg,250962,complete,/The-killers-the-cowboys-christmas-ball-lyrics,,https://images.genius.com/c07b2f4d9a60901b2fd469730f8427c9.300x300x1.jpg,https://images.genius.com/c07b2f4d9a60901b2fd469730f8427c9.400x400x1.jpg,The Cowboys' Christmas Ball,https://genius.com/The-killers-the-cowboys-christmas-ball-lyrics,"7 ContributorsThe Cowboys’ Christmas Ball Lyrics[Verse 1]
Way out in Old Nevada, where the Truckee's waters flow
Where the cattle are ""a-browsing"" and the Spanish ponies grow;
Where the Northers ""come a-whistling"" from beyond the Neutral Strip;
And the prairie dogs are sneezing, as if they had ""The Grip"";
Where the coyotes come a-howling around the ranches after dark
And the bluebirds are a-singing to the lovely ""meadow lark"";
Where the bighorns are a-grazing and the lonely plovers call —
It was there that I attended ""The Cowboys' Christmas Ball""
(whoo!)

[Verse 2]
The boys had left the ranches and come to town in piles;
The ladies — ""kind of scattering"" — had gathered in for miles
The room was togged out gorgeous - with mistletoe and shawls
And candles flickered frescoes, around the airy walls
The women folk looked lovely - the boys looked kinda treed
Till the leader got to yelling: ""Hey, fellers, let's stampede!""
And the music started sighing, and availing through the hall
As a kind of introduction to ""The Cowboys Christmas Ball""

[Verse 3]
Their leader was a feller that came from Swenson's ranch
They called him ""Windy Billy,"" from ""little Dead man's Branch""
His rig was ""kinda careless,"" big spurs and high-heeled boots;
He had the reputation that come when ""a fellers shoots""
His voice was like a bugle upon a mountainous height;
His feet were animated an' a mighty, moving sight
When he commenced to hollering, ""Now, fellers stake your pen!""
""Lock horns with all them heifers, and Russel them like men
""Salute yer lovely critters; now swing and let them go
""Climb the grape vine around them — all hands do-ce-do!
""You Mavericks, join the round-up - Just skip her waterfall""
Huh! It was getting happy, The Cowboys Christmas Ball
See The Killers LiveGet tickets as low as $68You might also like[Verse 4]
Don't tell me about cotillions, or Germans, no sirree!
That whirl at Carson City just takes the cake with me
I'm sick of lazy shuffling's, of them I've had my fill
Just Give me a frontier break-down, backed up by Wild Old Bill

Mc Allister ain't nowhere, when Windy leads the show
I've seen them both in harness, and so I sorta know
Oh, Bill, I shan't forget you, and I'll oftentimes recall
That lively gaited soiree — ""The Cowboys Christmas Ball""

[Outro]
Oh, Bill, I shan't forget you, and I'll oftentimes recall
That lively gaited soiree — ""The Cowboys Christmas Ball""Embed"
The Killers,599,The Killers,/albums/163444,https://images.genius.com/75501ce34080076e21bf19e6ba7ce044.1000x1000x1.png,Live from the Royal Albert Hall by The Killers,163444,Live from the Royal Albert Hall,"November 3, 2009",https://genius.com/albums/The-killers/Live-from-the-royal-albert-hall,209056,The Killers,Enterlude,2,/songs/209056,Enterlude by The Killers,https://images.genius.com/567df620ff89cc36e38d7f600db92ade.300x300x1.jpg,https://images.genius.com/567df620ff89cc36e38d7f600db92ade.1000x1000x1.jpg,272097,complete,/The-killers-enterlude-lyrics,3.0,https://images.genius.com/567df620ff89cc36e38d7f600db92ade.300x300x1.jpg,https://images.genius.com/567df620ff89cc36e38d7f600db92ade.1000x1000x1.jpg,Enterlude,https://genius.com/The-killers-enterlude-lyrics,"20 ContributorsEnterlude Lyrics[Chorus]
We hope you enjoy your stay
It's good to have you with us
Even if it's just for the day
We hope you enjoy your stay
Outside, the sun is shinin'
It seems like heaven ain't far away

[Outro]
It's good to have you with us
Even if it's just for the daySee The Killers LiveGet tickets as low as $68You might also like3Embed"
The Killers,599,The Killers,/albums/163444,https://images.genius.com/75501ce34080076e21bf19e6ba7ce044.1000x1000x1.png,Live from the Royal Albert Hall by The Killers,163444,Live from the Royal Albert Hall,"November 3, 2009",https://genius.com/albums/The-killers/Live-from-the-royal-albert-hall,76872,The Killers,Human,9,/songs/76872,Human by The Killers,https://images.genius.com/8de8b29f5bf034f43fdae3522db5caf1.300x300x1.jpg,https://images.genius.com/8de8b29f5bf034f43fdae3522db5caf1.1000x1000x1.jpg,110765,complete,/The-killers-human-lyrics,34.0,https://images.genius.com/9813234b3f4791fffd26d2ae3013c86e.300x300x1.png,https://images.genius.com/9813234b3f4791fffd26d2ae3013c86e.1000x1000x1.png,Human,https://genius.com/The-killers-human-lyrics,"65 ContributorsTranslationsDeutschHuman Lyrics[Verse 1]
I did my best to notice
When the call came down the line
Up to the platform of surrender
I was brought, but I was kind
And sometimes I get nervous
When I see an open door
Close your eyes, clear your heart

[Pre-Chorus 1]
Cut the cord

[Chorus]
Are we human
Or are we dancer?
My sign is vital
My hands are cold
And I'm on my knees
Looking for the answer
Are we human
Or are we dancer?

[Verse 2]
Pay my respects to grace and virtue
Send my condolences to good
Give my regards to soul and romance
They always did the best they could
And so long to devotion
You taught me everything I know
Wave goodbye, wish me well
See The Killers LiveGet tickets as low as $68You might also like[Pre-Chorus 2]
You've got to let me go

[Chorus]
Are we human
Or are we dancer?
My sign is vital
My hands are cold
And I'm on my knees
Looking for the answer
Are we human
Or are we dancer?

[Bridge]
Will your system be alright
When you dream of home tonight?
There is no message we're receiving
Let me know, is your heart still beating?

[Chorus]
Are we human
Or are we dancer?
My sign is vital
My hands are cold
And I'm on my knees
Looking for the answer
[Pre-Chorus 3]
You've got to let me know

[Chorus]
Are we human
Or are we dancer?
My sign is vital
My hands are cold
And I'm on my knees
Looking for the answer
Are we human
Or are we dancer?

[Outro]
Are we human
Or are we dancer?
Are we human
Or are we dancer?34Embed"
The Killers,599,The Killers,/albums/163444,https://images.genius.com/75501ce34080076e21bf19e6ba7ce044.1000x1000x1.png,Live from the Royal Albert Hall by The Killers,163444,Live from the Royal Albert Hall,"November 3, 2009",https://genius.com/albums/The-killers/Live-from-the-royal-albert-hall,209089,The Killers,This Is Your Life,10,/songs/209089,This Is Your Life by The Killers,https://images.genius.com/2dea9251a6e2bb79f3c3ccac2196d814.300x300x1.jpg,https://images.genius.com/2dea9251a6e2bb79f3c3ccac2196d814.1000x1000x1.jpg,250962,complete,/The-killers-this-is-your-life-lyrics,1.0,https://images.genius.com/2dea9251a6e2bb79f3c3ccac2196d814.300x300x1.jpg,https://images.genius.com/2dea9251a6e2bb79f3c3ccac2196d814.1000x1000x1.jpg,This Is Your Life,https://genius.com/The-killers-this-is-your-life-lyrics,"13 ContributorsThis Is Your Life Lyrics[Verse 1]
Candy talks to strangers
Thinks her life's in danger
No one gives a damn about her hair
It's lonely down on Track Street
She used to go by Jackie
The cops, they'll steal your dreams and they'll kill your prayers
Take a number where the blood just barely dried

[Chorus]
Wait for something better
No one behind you
Watching your shadows
This feeling won't go

[Verse 2]
Crooked wheels keep turning
Children, are you learning
Acclimatized, but don't you lose the plot
A history of blisters
Your brothers and your sisters
Somewhere in the pages we forgot

[Pre-Chorus]
Take a number Jackie
Where the blood just barely dried
You know I'm on your side
See The Killers LiveGet tickets as low as $68You might also like[Chorus]
Wait for something better
No one behind you
Watching your shadows
You got to be stronger than the story
Don't let it blind you
Rivers are shallow
This feeling won't go

[Bridge]
Your sky is full of dreams
But you don't know how to fly
I don't have a simple answer
But I know that I could answer
Something better

[Outro]
This feeling won't go
Wait for it
Wait for it
Wait for it
Wait for it1Embed"
