search_name,artist_id,artist_name,album_api_path,album_cover_art_url,album_full_title,album_id,album_name,album_release_date_for_display,album_url,song_id,song_artist_names,song_title,song_annotation_count,song_api_path,song_full_title,song_header_image_thumbnail_url,song_header_image_url,song_lyrics_owner_id,song_lyrics_state,song_path,song_pyongs_count,song_song_art_image_thumbnail_url,song_song_art_image_url,song_title_with_featured,song_url,lyrics
The Killers,599,The Killers,/albums/43205,https://images.genius.com/615a7ba1d10ec38770ad8c1b00bdcc16.1000x1000x1.jpg,Sawdust by The Killers,43205,Sawdust,"November 9, 2007",https://genius.com/albums/The-killers/Sawdust,209068,The Killers,All the Pretty Faces,2,/songs/209068,All the Pretty Faces by The Killers,https://images.genius.com/615a7ba1d10ec38770ad8c1b00bdcc16.300x300x1.jpg,https://images.genius.com/615a7ba1d10ec38770ad8c1b00bdcc16.1000x1000x1.jpg,272097,complete,/The-killers-all-the-pretty-faces-lyrics,3.0,https://images.genius.com/615a7ba1d10ec38770ad8c1b00bdcc16.300x300x1.jpg,https://images.genius.com/615a7ba1d10ec38770ad8c1b00bdcc16.1000x1000x1.jpg,All the Pretty Faces,https://genius.com/The-killers-all-the-pretty-faces-lyrics,"10 ContributorsAll the Pretty Faces Lyrics[Verse 1]
Help me out, I need it
I don't feel like loving you no more
I don't feel like loving you no more

[Verse 2]
Help me out, I need it
I don't feel like touching her no more
Help me out, I need it
I said, I don't feel like touching her no more

[Pre-Chorus]
Well, how did it happen?
I spent two long years in a strange, strange land
Well, how did it happen?
I'd do anything just to be your man

[Chorus]
You're not going anywhere without me
These trials don't prepare the air, and no
You're not telling anyone about me
And you shake and you bleed while I sing my song

[Post-Chrorus]
I don't feel like, I don't feel like
I don't feel like loving you
I don't feel like, I don't feel like
I don't feel like loving you
See The Killers LiveGet tickets as low as $68You might also like[Verse 3]
All the different places
Ringing out like a shotgun in my head
All the pretty faces
Ringing out and I just can't go to bed

[Pre-Chorus]
Oh, how did it happen?
I spent two long years in a strange, strange land
Oh, how did it happen?
I'd do anything just to be your man
I'd do anything just to be your man

[Chorus]
You're not going anywhere without me
These trials don't prepare the air, and no
You're not telling anyone about me
And you shake and you bleed while I sing my song

[Bridge]
I don't feel like touching you
I don't feel like touching you
I don't feel like touching you
I don't feel like touching you
You can't tell anyone about me
[Chorus]
You're not going anywhere without me
Help me out, I need it (Help me out, I need it)
You can't tell anyone about me (Help me out, I need it)
Help me out, I need it

[Post-Chorus]
I don't feel like, I don't feel like
I don't feel like loving you
I don't feel like, I don't feel like
I don't feel like loving you3Embed"
The Killers,599,The Killers,/albums/43205,https://images.genius.com/615a7ba1d10ec38770ad8c1b00bdcc16.1000x1000x1.jpg,Sawdust by The Killers,43205,Sawdust,"November 9, 2007",https://genius.com/albums/The-killers/Sawdust,1165,The Killers,Leave the Bourbon on the Shelf,8,/songs/1165,Leave the Bourbon on the Shelf by The Killers,https://images.genius.com/615a7ba1d10ec38770ad8c1b00bdcc16.300x300x1.jpg,https://images.genius.com/615a7ba1d10ec38770ad8c1b00bdcc16.1000x1000x1.jpg,7,complete,/The-killers-leave-the-bourbon-on-the-shelf-lyrics,5.0,https://images.genius.com/615a7ba1d10ec38770ad8c1b00bdcc16.300x300x1.jpg,https://images.genius.com/615a7ba1d10ec38770ad8c1b00bdcc16.1000x1000x1.jpg,Leave the Bourbon on the Shelf,https://genius.com/The-killers-leave-the-bourbon-on-the-shelf-lyrics,"23 ContributorsLeave the Bourbon on the Shelf Lyrics[Verse 1]
Shaking like the devil when she lets me go
Got a new place, and how it's so much better
Falling over myself, the television's on
I turn it off and smile
Oh, Jennifer, you know I always tried
Before you say goodbye

[Chorus]
Leave the bourbon on the shelf
And I'll drink it by myself
And I love you endlessly
Darling, don't you see?
I'm not satisfied until I hold you tight

[Post-Chorus]
Give me one more chance tonight
And I swear I'll make it right
But you ain't got time for this
And that wrecking bell is ringing
And I'm not satisfied
Until I hold you

[Verse 2]
Jennifer, tell me where I stand
And who's that boy holding your hand?
Oh, Jennifer, you know I'll always try
Before you say goodbye
See The Killers LiveGet tickets as low as $68You might also like[Chorus]
Leave the bourbon on the shelf
And I'll drink it by myself
And I never liked your hair
Or those people that you lie with
And I'm not satisfied until I hold you tight
And I love you endlessly
Darling, don't you see?
I can't be satisfied until I hold you tight

[Outro]
Leave the bourbon on the shelf
And I'll drink it by myself
And I'll love you endlessly
Darling, don't you see?
I'm not satisfied5Embed"
The Killers,599,The Killers,/albums/43205,https://images.genius.com/615a7ba1d10ec38770ad8c1b00bdcc16.1000x1000x1.jpg,Sawdust by The Killers,43205,Sawdust,"November 9, 2007",https://genius.com/albums/The-killers/Sawdust,209109,The Killers,Sweet Talk,3,/songs/209109,Sweet Talk by The Killers,https://images.genius.com/615a7ba1d10ec38770ad8c1b00bdcc16.300x300x1.jpg,https://images.genius.com/615a7ba1d10ec38770ad8c1b00bdcc16.1000x1000x1.jpg,273241,complete,/The-killers-sweet-talk-lyrics,5.0,https://images.genius.com/615a7ba1d10ec38770ad8c1b00bdcc16.300x300x1.jpg,https://images.genius.com/615a7ba1d10ec38770ad8c1b00bdcc16.1000x1000x1.jpg,Sweet Talk,https://genius.com/The-killers-sweet-talk-lyrics,"9 ContributorsSweet Talk Lyrics[Verse 1]
Lift me up on my honor, take me over this spell
Get this weight off my shoulders, I've carried it well
Loose these shackles of pressure, shake me out of these chains
Lead me not to temptation
Hold my hand harder, ease my mind
Roll down the smoke screen and open the sky

[Chorus]
Let me fly
Man, I need a release from this troublesome mind
Fix my feet when they’re stumbling
And well, you know it hurts sometimes
You know it's going to bleed sometimes

[Verse 2]
Dig me out from this thorn tree, help me bury my shame
Keep my eyes from the fire, they can’t handle the flame
Grace cut out from my brothers when most of them fell
I carry it well

[Chorus]
Let me fly
Man, I need a release from this troublesome mind
Fix my feet when they’re stumbling
I guess you know it hurts sometimes
You know it's going to bleed sometimes
Now hold on
I’m not looking for sweet talk, I’m looking for time
Top a tower and sleepwalk, brother, 'cause it hurts sometimes
You know it's going to bleed sometimes
Hold on
See The Killers LiveGet tickets as low as $68You might also like[Bridge]
You know it's going to hurt sometimes
When you call me, hold on
Hold on
Hold on

[Outro]
I’m going to climb that symphony home and make it mine
Let His resonance light my way
See, all these pessimistic sufferers tend to drag me down
So I could use it to shelter what good I’ve found5Embed"
The Killers,599,The Killers,/albums/43205,https://images.genius.com/615a7ba1d10ec38770ad8c1b00bdcc16.1000x1000x1.jpg,Sawdust by The Killers,43205,Sawdust,"November 9, 2007",https://genius.com/albums/The-killers/Sawdust,209117,The Killers,Under the Gun,2,/songs/209117,Under the Gun by The Killers,https://images.genius.com/336fe67314f24354b529616d9159de9e.300x300x1.jpg,https://images.genius.com/336fe67314f24354b529616d9159de9e.1000x1000x1.jpg,273241,complete,/The-killers-under-the-gun-lyrics,5.0,https://images.genius.com/336fe67314f24354b529616d9159de9e.300x300x1.jpg,https://images.genius.com/336fe67314f24354b529616d9159de9e.1000x1000x1.jpg,Under the Gun,https://genius.com/The-killers-under-the-gun-lyrics,"14 ContributorsUnder the Gun Lyrics[Verse 1]
She's got her halo and wings hidden under his eyes
But she's an angel for sure, she just can't stop telling lies
But it's too late for his love, already caught in a trap
His angel's kiss was a joke and she is not coming back

[Pre-Chorus]
Because heaven sends and heaven takes
Crashing cars in his brain
Keep him tied up to a dream
And only she can set him free
And then he says to me

[Chorus]
Kill me now, kill me now, kill me now, kill me now
Kill me now, kill me now, kill me now, kill me now

[Verse 2]
Yeah, she's got a criminal mind, he's got a reason to pray
His life is under the gun, he's got to hold every day
Now he just wants to wake up, yeah, just to prove it's a dream
'Cause she's an angel for sure, but that remains to be seen

[Pre-Chorus]
Because heaven sends and heaven takes
Crashing cars in his brain
Keep him tied up to a dream
And only she can set him free
And then he says to me
See The Killers LiveGet tickets as low as $68You might also like[Chorus]
Kill me now, kill me now, kill me now, kill me now
Kill me now, kill me now, kill me now, kill me now

[Bridge]
Stupid on the streets of London
James Dean in the rain
Without her it's not the same
But it's alright

[Pre-Chorus]
Because heaven sends and heaven takes
Crashing cars in his brain
And keep him tied up to a dream
And only she can set him free
And then he says to me

[Chorus]
Kill me now, kill me now, kill me now, kill me now
Kill me now, kill me now, kill me now, kill me now
Again and again5Embed"
The Killers,599,The Killers,/albums/43205,https://images.genius.com/615a7ba1d10ec38770ad8c1b00bdcc16.1000x1000x1.jpg,Sawdust by The Killers,43205,Sawdust,"November 9, 2007",https://genius.com/albums/The-killers/Sawdust,209065,The Killers,Where the White Boys Dance,5,/songs/209065,Where the White Boys Dance by The Killers,https://images.genius.com/615a7ba1d10ec38770ad8c1b00bdcc16.300x300x1.jpg,https://images.genius.com/615a7ba1d10ec38770ad8c1b00bdcc16.1000x1000x1.jpg,272097,complete,/The-killers-where-the-white-boys-dance-lyrics,1.0,https://images.genius.com/615a7ba1d10ec38770ad8c1b00bdcc16.300x300x1.jpg,https://images.genius.com/615a7ba1d10ec38770ad8c1b00bdcc16.1000x1000x1.jpg,Where the White Boys Dance,https://genius.com/The-killers-where-the-white-boys-dance-lyrics,"15 ContributorsWhere the White Boys Dance Lyrics[Chorus]
Take me to the place where the white boys dance
Take me to the place where they run and play
My baby is gone, you might have a chance
Just take me to the place where the white boys dance

[Verse 1]
They hug in silence as the sun sets
On their empty street
Her suspicions, well, they're risin' high
And the man who sweeps him off, she doesn't meet
She walks inside and pours a strong one
Put her mind at ease
It's the calm before another storm
And the brain shifts from the whiskey to the keys

[Chorus]
Take me to the place where the white boys dance
Take me to the place where they run and play
My baby is gone, you might have a chance
Just take me to the place where the white boys dance

[Verse 2]
Her heart is racing, she phones a friend and says
""I'm in an awful place
That fool's been messin' round on me
I've seen it in his eyes and on his face""
Hold on a minute, you're talking crazy
Don't be that jealous girl
Just tell Yvonne you need an hour or two
'Cause we're gonna go and change somebody's world
See The Killers LiveGet tickets as low as $68You might also like[Chorus]
Take me to the place where the white boys dance
Take me to the place where they run and play
My baby is gone, you might have a chance
Just take me to the place where the white boys dance

[Bridge]
It's the calm before another storm
It's the calm before another storm
And her brain shifts from the whiskey to the keys

[Chorus]
Take me to the place where the white boys dance
Take me to the place where they run and play
My baby is gone, you might have a chance
Just take me to the place where the white boys dance1Embed"
The Killers,599,The Killers,/albums/43205,https://images.genius.com/615a7ba1d10ec38770ad8c1b00bdcc16.1000x1000x1.jpg,Sawdust by The Killers,43205,Sawdust,"November 9, 2007",https://genius.com/albums/The-killers/Sawdust,209132,The Killers,Show You How,6,/songs/209132,Show You How by The Killers,https://images.genius.com/615a7ba1d10ec38770ad8c1b00bdcc16.300x300x1.jpg,https://images.genius.com/615a7ba1d10ec38770ad8c1b00bdcc16.1000x1000x1.jpg,273241,complete,/The-killers-show-you-how-lyrics,,https://images.genius.com/615a7ba1d10ec38770ad8c1b00bdcc16.300x300x1.jpg,https://images.genius.com/615a7ba1d10ec38770ad8c1b00bdcc16.1000x1000x1.jpg,Show You How,https://genius.com/The-killers-show-you-how-lyrics,"10 ContributorsShow You How Lyrics[Intro]
You have one saved message
To listen to your messages, press 'one'
First saved message
Message sent yesterday at 10:41pm

[Verse 1]
Ha, I got to tell you, I'll make it better
But I know that's something I needed to say
When I was out, though
Maybe you were better alone
I know I'll make it home

[Verse 2]
She told me, sweet thing, run a labor in your shoes
Touch me 'til I follow in love
I want to help her
Maybe we were better alone
I want to show you how

[Verse 3]
And then we walked out, make it made now
I said I want it, but I'm never alone
I want to show you
Maybe we were something uncool
I want to make you sing
See The Killers LiveGet tickets as low as $68You might also like[Outro]
Uh uh oh
Uh uh oh
Uh uh ohEmbed"
The Killers,599,The Killers,/albums/43205,https://images.genius.com/615a7ba1d10ec38770ad8c1b00bdcc16.1000x1000x1.jpg,Sawdust by The Killers,43205,Sawdust,"November 9, 2007",https://genius.com/albums/The-killers/Sawdust,209138,The Killers,Move Away,4,/songs/209138,Move Away by The Killers,https://images.genius.com/c157e6be32a511c719283f1438417b30.300x300x1.jpg,https://images.genius.com/c157e6be32a511c719283f1438417b30.500x500x1.jpg,273241,complete,/The-killers-move-away-lyrics,,https://images.genius.com/c157e6be32a511c719283f1438417b30.300x300x1.jpg,https://images.genius.com/c157e6be32a511c719283f1438417b30.500x500x1.jpg,Move Away,https://genius.com/The-killers-move-away-lyrics,"13 ContributorsTranslationsTürkçeMove Away Lyrics[Verse 1]
Last time I said I was in control
I had 25 debts and we both know
When you come back now, you'll see my face
I said, 25 debts and we both pray

[Chorus]
While I move away
Hard times don't come until tomorrow
These eyes don't see
Take your skin off when you listen to me

Move away
Hard times don't come until tomorrow
These eyes in me
Take your skin off when you're talking to me, me

[Verse 2]
Oh, what a world that we both come in
I said, hold it to the rock and let it in
Oh, what a world, oh, that we are in
I said, hold it to the rock and we're both in

[Chorus]
While I move away
Hard times don't come until tomorrow
These eyes don't see
Take your skin off when you listen to me
See The Killers LiveGet tickets as low as $68You might also likeMove away
Hard times don't come until tomorrow
These eyes don't see
Take your skin off when you listen to me

[Verse 3]
Don't worry about what might have been
Just tell your woman that you're sorry
And you jumped out of your skin
Listen closely to your motto

Don't worry about what might have been
Tell the jury that you're sorry
And it jumped out of your skin
I wanna jump out of my skin
I wanna jump out of my skin and watch the clouds

[Bridge]
Move away
I'm never gonna live it down
Move away
Move away
Move, move, move away
Move away

[Chorus]
Move away
Hard times don't come until tomorrow
These eyes don't see
Take your skin off when you listen to me
Move away
Hard times don't come until tomorrow
[Outro]
Move away
Move away
Move away
Move awayEmbed"
The Killers,599,The Killers,/albums/43205,https://images.genius.com/615a7ba1d10ec38770ad8c1b00bdcc16.1000x1000x1.jpg,Sawdust by The Killers,43205,Sawdust,"November 9, 2007",https://genius.com/albums/The-killers/Sawdust,209082,The Killers,Glamorous Indie Rock & Roll,9,/songs/209082,Glamorous Indie Rock & Roll by The Killers,https://images.genius.com/c96778737ffe224b7636ca8720d4fe24.300x300x1.jpg,https://images.genius.com/c96778737ffe224b7636ca8720d4fe24.1000x1000x1.jpg,271948,complete,/The-killers-glamorous-indie-rock-and-roll-lyrics,8.0,https://images.genius.com/c96778737ffe224b7636ca8720d4fe24.300x300x1.jpg,https://images.genius.com/c96778737ffe224b7636ca8720d4fe24.1000x1000x1.jpg,Glamorous Indie Rock & Roll,https://genius.com/The-killers-glamorous-indie-rock-and-roll-lyrics,"26 ContributorsGlamorous Indie Rock & Roll Lyrics[Verse 1]
Glamorous indie rock and roll is what I want
It's in my soul, it's what I need
Indie rock and roll, it's time
Two of us flipping through a thrift store magazine
She plays the drums, I'm on tambourine
Bet your, your bottom dollar on me

[Chorus]
It's indie rock and roll for me
It's indie rock and roll for me
It's all I need
It's indie rock and roll for me

[Verse 2]
In a clutch, I'm talking every word for all the boys
Electric girls with worn-down toys
Make it up, break it up, what do you care?
Oh, what do you care?
I take my twist with a shout
A coffee shop with a cause, then I'll freak you out
No sex, no drugs, no life, no love
When it comes to today

[Bridge]
Stay if you want to love me, stay
Oh, don't be shy, let's cause a scene
Like lovers do on silver screens
Let's make it, yeah, we'll cause a scene
See The Killers LiveGet tickets as low as $68You might also like[Chorus]
It's indie rock and roll for me
It's indie rock and roll for me
It's all I need
It's indie rock and roll for me

[Outro]
(In a clutch, I'm talking every word for all the boys)
It's indie rock and roll for me
It's all I need
Make it up, break it up, what do you care?
It's indie rock and roll for me
(Two of us flipping through a thrift store magazine)
Indie rock and roll for me
It's all I need
Make it up, break it up, what do you care?
It's indie rock and roll for me8Embed"
The Killers,599,The Killers,/albums/43205,https://images.genius.com/615a7ba1d10ec38770ad8c1b00bdcc16.1000x1000x1.jpg,Sawdust by The Killers,43205,Sawdust,"November 9, 2007",https://genius.com/albums/The-killers/Sawdust,209142,The Killers,Who Let You Go?,3,/songs/209142,Who Let You Go? by The Killers,https://images.genius.com/615a7ba1d10ec38770ad8c1b00bdcc16.300x300x1.jpg,https://images.genius.com/615a7ba1d10ec38770ad8c1b00bdcc16.1000x1000x1.jpg,273241,complete,/The-killers-who-let-you-go-lyrics,,https://images.genius.com/615a7ba1d10ec38770ad8c1b00bdcc16.300x300x1.jpg,https://images.genius.com/615a7ba1d10ec38770ad8c1b00bdcc16.1000x1000x1.jpg,Who Let You Go?,https://genius.com/The-killers-who-let-you-go-lyrics,"11 ContributorsWho Let You Go? Lyrics[Chorus]
Who let you go? Who let you go?
Who let you go? Who let you go?
Who let you go? Who let you go?
Who let you go? Who let you go?
I feel it inside, down in my soul
And I just can't hide these things that I know

[Verse 1]
We could be friends
And I promise that it won't get bad
But hopefully that story ends
But you ain't got nothing I never had
So let's take it slow

Who let you go? Who let you go?
Who let you go? Who let you go?

[Verse 2]
Someone must have loved you
Not the way that I do
You're missing what I'm trying to say
Ain't nothing getting in my way

[Verse 3]
So tell me that's fantastic
And promise me, you'll always sigh
I find it so romantic
When you look into my beautiful eyes
And lose control
See The Killers LiveGet tickets as low as $68You might also like[Chorus]
Who let you go? Who let you go?
Who let you go? Who let you go?
Who let you go? Who let you go?
Who let you go? Who let you go?
I feel it inside, down in my soul
And I just can't hide these things that I know

[Bridge]
I don't know what it means
But I've been wondering
Who let you go?

And honey, when you walk my way
It makes me wanna say
Ohhh

[Outro]
Sha-la-la-lo, sha-la-la-lo
Sha-la-la-lo, sha-la-la-loEmbed"
The Killers,599,The Killers,/albums/43205,https://images.genius.com/615a7ba1d10ec38770ad8c1b00bdcc16.1000x1000x1.jpg,Sawdust by The Killers,43205,Sawdust,"November 9, 2007",https://genius.com/albums/The-killers/Sawdust,209106,The Killers,The Ballad of Michael Valentine,3,/songs/209106,The Ballad of Michael Valentine by The Killers,https://images.genius.com/615a7ba1d10ec38770ad8c1b00bdcc16.300x300x1.jpg,https://images.genius.com/615a7ba1d10ec38770ad8c1b00bdcc16.1000x1000x1.jpg,250962,complete,/The-killers-the-ballad-of-michael-valentine-lyrics,2.0,https://images.genius.com/615a7ba1d10ec38770ad8c1b00bdcc16.300x300x1.jpg,https://images.genius.com/615a7ba1d10ec38770ad8c1b00bdcc16.1000x1000x1.jpg,The Ballad of Michael Valentine,https://genius.com/The-killers-the-ballad-of-michael-valentine-lyrics,"12 ContributorsThe Ballad of Michael Valentine Lyrics[Verse 1]
Michael plays with stars
Soul Sister won't you take a ride in his car
Late to call
When you wanted to be all
Baby, baby, don't be so shy
Rock children hold your heads up high
In the night while I try
And tell the ballad of Valentine

You got it bad, but you know it's true

[Verse 2]
I caught up with a friend in Dallas
We took a trip to New Orleans
Those black-eyed ladies
Won't say they're sorry

[Verse 3]
We finally caught a train to Memphis
Where everybody talks the same
Those blue suede babies
All know my name

[Chorus]
And I said hold tight
Can't you see that it's hurting me
But I've got the buzz
Like Marlon Brando
Michael Valentine, can't we unite?
See The Killers LiveGet tickets as low as $68You might also like[Verse 4]
We ended up in North Dakota
Although my heart's in Mexico
My muñequita
Abre tus ojos

[Verse 5]
With your new suit, and your black tie
Hold on, you're just a gambling man, all proper like
I broke to the right and I caught your eye
Shut your mouth and wave goodbye
Tonight, I am not going to let you rain on this parade

[Chorus]
And I said hold tight
Can't you see that it's hurting me
But I've got the buzz
Like Marlon Brando
Straight-faced with misery tonight

[Verse 6]
And I will not lie when I say I am not cold no more
But I've got the buzz
Like Greta Garbo
Walking forwards in the sun
And I've got a coat tail left to ride
[Outro]
Well uh oh
I know he's going to be there tonight2Embed"
The Killers,599,The Killers,/albums/43205,https://images.genius.com/615a7ba1d10ec38770ad8c1b00bdcc16.1000x1000x1.jpg,Sawdust by The Killers,43205,Sawdust,"November 9, 2007",https://genius.com/albums/The-killers/Sawdust,209107,The Killers,"Ruby, Don’t Take Your Love to Town",1,/songs/209107,"Ruby, Don't Take Your Love to Town by The Killers",https://images.genius.com/615a7ba1d10ec38770ad8c1b00bdcc16.300x300x1.jpg,https://images.genius.com/615a7ba1d10ec38770ad8c1b00bdcc16.1000x1000x1.jpg,250962,complete,/The-killers-ruby-dont-take-your-love-to-town-lyrics,,https://images.genius.com/615a7ba1d10ec38770ad8c1b00bdcc16.300x300x1.jpg,https://images.genius.com/615a7ba1d10ec38770ad8c1b00bdcc16.1000x1000x1.jpg,"Ruby, Don't Take Your Love to Town",https://genius.com/The-killers-ruby-dont-take-your-love-to-town-lyrics,"9 ContributorsRuby, Don’t Take Your Love to Town Lyrics[Verse 1]
You've painted up your lips and rolled and curled your tinted hair
Ruby are you contemplating going out somewhere?
The shadow on the wall tells me the sun is going down
Oh Ruby, don't take your love to town

[Verse 2]
It wasn't me that started this old crazy Asian war
But I was proud to go and do my patriotic chore
And yes, it's true that I'm not the man I used to be
Oh Ruby, I still need some company

[Verse 3]
It's hard to love a man whose legs are bent and paralyzed
And the wants and needs of a woman your age Ruby I realize
But it won't be long, I've heard them say, until I'm not around
Oh Ruby, don't take your love to town

[Verse 4]
She's leaving now cause I just heard the slamming of the door
The way I know I've heard it slam one hundred times before
And if I could move I'd get my gun and put her in the ground
Oh Ruby, don't take your love to town

[Outro]
Oh Ruby, for God's sake, turn aroundSee The Killers LiveGet tickets as low as $68You might also likeEmbed"
